Title,PMID,Abstract,Cross-validation,text
"Pyridine-N-Oxide Alkaloids from Allium stipitatum and Their Synthetic Disulfide Analogs as Potential Drug Candidates against Mycobacterium tuberculosis: A Molecular Docking, QSBAR, and ADMET Prediction Approach.",36246961,"In this study, we consider pyridine-N-oxide alkaloids from Allium stipitatum and their synthetic disulfide analogs (PDAs) as candidates for next-generational antimycobacterial agents, in light of growing resistance to existing conventional therapies. In silico studies involving molecular docking simulations of 12 PDAs were carried out against 7 Mycobacterium tuberculosis target proteins (MTs) to determine their theoretical binding affinities. Compounds A3, A6, and B9 demonstrated stronger binding affinities on similar MTs. Molecular descriptors (MDs) describing structural and physicochemical properties of the compounds were also calculated using ChemDes, explored using Pearson's correlation analysis, and principal component analysis (PCA) in comparison with MDs from conventional antitubercular medicines. The PDAs possessed similar scores as isoniazid and pyrazinamide. The MDs were also used to conduct a quantitative structure-binding affinity relationship (QSBAR) study by building good fit and significant models through principal component regression (PCR) and partial least squares regression (PLSR). Leave-one-out cross-validation was adopted in the PLSR, resulting in good predictive models on all MTs (range of R 2 = 0.7541-0.8992; range of Q 2 = 0.6183-0.8162). Both PCR and PLSR models predicted the significant effects of ndonr, Hy, Mol wt, nhev, nring, ndb, Log P, W, Pol, ISIZ, TIAC, Getov, and UI on the binding of ligands to the MTs. In silico prediction of PDAs' ADMET profiles was conducted with QikProp utility. The ADMET profiles of the compounds were favorable. The outcome of the current study strengthens the significance of these compounds as promising lead candidates for the treatment of multidrug-resistant tuberculosis.",1,"Pyridine-N-Oxide Alkaloids from Allium stipitatum and Their Synthetic Disulfide Analogs as Potential Drug Candidates against Mycobacterium tuberculosis: A Molecular Docking, QSBAR, and ADMET Prediction Approach. In this study, we consider pyridine-N-oxide alkaloids from Allium stipitatum and their synthetic disulfide analogs (PDAs) as candidates for next-generational antimycobacterial agents, in light of growing resistance to existing conventional therapies. In silico studies involving molecular docking simulations of 12 PDAs were carried out against 7 Mycobacterium tuberculosis target proteins (MTs) to determine their theoretical binding affinities. Compounds A3, A6, and B9 demonstrated stronger binding affinities on similar MTs. Molecular descriptors (MDs) describing structural and physicochemical properties of the compounds were also calculated using ChemDes, explored using Pearson's correlation analysis, and principal component analysis (PCA) in comparison with MDs from conventional antitubercular medicines. The PDAs possessed similar scores as isoniazid and pyrazinamide. The MDs were also used to conduct a quantitative structure-binding affinity relationship (QSBAR) study by building good fit and significant models through principal component regression (PCR) and partial least squares regression (PLSR). Leave-one-out cross-validation was adopted in the PLSR, resulting in good predictive models on all MTs (range of R 2 = 0.7541-0.8992; range of Q 2 = 0.6183-0.8162). Both PCR and PLSR models predicted the significant effects of ndonr, Hy, Mol wt, nhev, nring, ndb, Log P, W, Pol, ISIZ, TIAC, Getov, and UI on the binding of ligands to the MTs. In silico prediction of PDAs' ADMET profiles was conducted with QikProp utility. The ADMET profiles of the compounds were favorable. The outcome of the current study strengthens the significance of these compounds as promising lead candidates for the treatment of multidrug-resistant tuberculosis."
Multiview network embedding for drug-target Interactions prediction by consistent and complementary information preserving.,35262678,"Accurate prediction of drug-target interactions (DTIs) can reduce the cost and time of drug repositioning and drug discovery. Many current methods integrate information from multiple data sources of drug and target to improve DTIs prediction accuracy. However, these methods do not consider the complex relationship between different data sources. In this study, we propose a novel computational framework, called MccDTI, to predict the potential DTIs by multiview network embedding, which can integrate the heterogenous information of drug and target. MccDTI learns high-quality low-dimensional representations of drug and target by preserving the consistent and complementary information between multiview networks. Then MccDTI adopts matrix completion scheme for DTIs prediction based on drug and target representations. Experimental results on two datasets show that the prediction accuracy of MccDTI outperforms four state-of-the-art methods for DTIs prediction. Moreover, literature verification for DTIs prediction shows that MccDTI can predict the reliable potential DTIs. These results indicate that MccDTI can provide a powerful tool to predict new DTIs and accelerate drug discovery. The code and data are available at: https://github.com/ShangCS/MccDTI.",0,"Multiview network embedding for drug-target Interactions prediction by consistent and complementary information preserving. Accurate prediction of drug-target interactions (DTIs) can reduce the cost and time of drug repositioning and drug discovery. Many current methods integrate information from multiple data sources of drug and target to improve DTIs prediction accuracy. However, these methods do not consider the complex relationship between different data sources. In this study, we propose a novel computational framework, called MccDTI, to predict the potential DTIs by multiview network embedding, which can integrate the heterogenous information of drug and target. MccDTI learns high-quality low-dimensional representations of drug and target by preserving the consistent and complementary information between multiview networks. Then MccDTI adopts matrix completion scheme for DTIs prediction based on drug and target representations. Experimental results on two datasets show that the prediction accuracy of MccDTI outperforms four state-of-the-art methods for DTIs prediction. Moreover, literature verification for DTIs prediction shows that MccDTI can predict the reliable potential DTIs. These results indicate that MccDTI can provide a powerful tool to predict new DTIs and accelerate drug discovery. The code and data are available at: https://github.com/ShangCS/MccDTI."
GEFA: Early Fusion Approach in Drug-Target Affinity Prediction.,34197324,"Predicting the interaction between a compound and a target is crucial for rapid drug repurposing. Deep learning has been successfully applied in drug-target affinity (DTA)problem. However, previous deep learning-based methods ignore modeling the direct interactions between drug and protein residues. This would lead to inaccurate learning of target representation which may change due to the drug binding effects. In addition, previous DTA methods learn protein representation solely based on a small number of protein sequences in DTA datasets while neglecting the use of proteins outside of the DTA datasets. We propose GEFA (Graph Early Fusion Affinity), a novel graph-in-graph neural network with attention mechanism to address the changes in target representation because of the binding effects. Specifically, a drug is modeled as a graph of atoms, which then serves as a node in a larger graph of residues-drug complex. The resulting model is an expressive deep nested graph neural network. We also use pre-trained protein representation powered by the recent effort of learning contextualized protein representation. The experiments are conducted under different settings to evaluate scenarios such as novel drugs or targets. The results demonstrate the effectiveness of the pre-trained protein embedding and the advantages our GEFA in modeling the nested graph for drug-target interaction.",0,"GEFA: Early Fusion Approach in Drug-Target Affinity Prediction. Predicting the interaction between a compound and a target is crucial for rapid drug repurposing. Deep learning has been successfully applied in drug-target affinity (DTA)problem. However, previous deep learning-based methods ignore modeling the direct interactions between drug and protein residues. This would lead to inaccurate learning of target representation which may change due to the drug binding effects. In addition, previous DTA methods learn protein representation solely based on a small number of protein sequences in DTA datasets while neglecting the use of proteins outside of the DTA datasets. We propose GEFA (Graph Early Fusion Affinity), a novel graph-in-graph neural network with attention mechanism to address the changes in target representation because of the binding effects. Specifically, a drug is modeled as a graph of atoms, which then serves as a node in a larger graph of residues-drug complex. The resulting model is an expressive deep nested graph neural network. We also use pre-trained protein representation powered by the recent effort of learning contextualized protein representation. The experiments are conducted under different settings to evaluate scenarios such as novel drugs or targets. The results demonstrate the effectiveness of the pre-trained protein embedding and the advantages our GEFA in modeling the nested graph for drug-target interaction."
Breaking the barriers of data scarcity in drug-target affinity prediction.,37903413,"Accurate prediction of drug-target affinity (DTA) is of vital importance in early-stage drug discovery, facilitating the identification of drugs that can effectively interact with specific targets and regulate their activities. While wet experiments remain the most reliable method, they are time-consuming and resource-intensive, resulting in limited data availability that poses challenges for deep learning approaches. Existing methods have primarily focused on developing techniques based on the available DTA data, without adequately addressing the data scarcity issue. To overcome this challenge, we present the Semi-Supervised Multi-task training (SSM) framework for DTA prediction, which incorporates three simple yet highly effective strategies: (1) A multi-task training approach that combines DTA prediction with masked language modeling using paired drug-target data. (2) A semi-supervised training method that leverages large-scale unpaired molecules and proteins to enhance drug and target representations. This approach differs from previous methods that only employed molecules or proteins in pre-training. (3) The integration of a lightweight cross-attention module to improve the interaction between drugs and targets, further enhancing prediction accuracy. Through extensive experiments on benchmark datasets such as BindingDB, DAVIS and KIBA, we demonstrate the superior performance of our framework. Additionally, we conduct case studies on specific drug-target binding activities, virtual screening experiments, drug feature visualizations and real-world applications, all of which showcase the significant potential of our work. In conclusion, our proposed SSM-DTA framework addresses the data limitation challenge in DTA prediction and yields promising results, paving the way for more efficient and accurate drug discovery processes.",0,"Breaking the barriers of data scarcity in drug-target affinity prediction. Accurate prediction of drug-target affinity (DTA) is of vital importance in early-stage drug discovery, facilitating the identification of drugs that can effectively interact with specific targets and regulate their activities. While wet experiments remain the most reliable method, they are time-consuming and resource-intensive, resulting in limited data availability that poses challenges for deep learning approaches. Existing methods have primarily focused on developing techniques based on the available DTA data, without adequately addressing the data scarcity issue. To overcome this challenge, we present the Semi-Supervised Multi-task training (SSM) framework for DTA prediction, which incorporates three simple yet highly effective strategies: (1) A multi-task training approach that combines DTA prediction with masked language modeling using paired drug-target data. (2) A semi-supervised training method that leverages large-scale unpaired molecules and proteins to enhance drug and target representations. This approach differs from previous methods that only employed molecules or proteins in pre-training. (3) The integration of a lightweight cross-attention module to improve the interaction between drugs and targets, further enhancing prediction accuracy. Through extensive experiments on benchmark datasets such as BindingDB, DAVIS and KIBA, we demonstrate the superior performance of our framework. Additionally, we conduct case studies on specific drug-target binding activities, virtual screening experiments, drug feature visualizations and real-world applications, all of which showcase the significant potential of our work. In conclusion, our proposed SSM-DTA framework addresses the data limitation challenge in DTA prediction and yields promising results, paving the way for more efficient and accurate drug discovery processes."
QSAR analysis and molecular docking simulation of norepinephrine transporter (NET) inhibitors as anti-psychotic therapeutic agents.,31692668,"The norepinephrine transporter (NET) is a Na+/Cl- coupled neurotransmitter transporter responsible for reuptake of released norepinephrine (NE) into nerve terminals in the brain, a key therapeutic used in the treatment of psychiatric disorders. A quantitative structural activity relationship (QSAR) study was performed on 50 compounds of NET inhibitors to investigate their inhibitory potencies against norepinephrine transporter as novel drugs for anti-psychotic disorders. The compounds were optimized by employing Density functional theory (DFT) with basis set of B3LYP/6-31G*. The genetic function Algorithm (GFA) approach was used to generate a highly predictive and statistically significant model with good correlation coefficient R2 Train = 0.952 Cross validated coefficient Q2 cv = 0.870 and adjusted squared correlation coefficient R2 adj = 0.898. The predictability and accuracy of the developed model was evaluated through external validation using test set compound, Y-randomization and applicability domain techniques. The results of Molecular docking analysis by using two neurotransmitter transporters PDB ID 2A65 (resolution = 1.65 Å) and PDB ID 4M48 (resolution = 2.955 Å) showed that two of the ligands (compound 12 and 44) having higher binding affinity were observed to inhibit the targets by forming hydrogen bonds and hydrophobic interactions with amino acids of the two receptors respectively. The results of these studies would provide important new insight into the molecular basis and structural requirements to design more potent and more specific therapeutic anti-psychotic drugs/agents.",1,"QSAR analysis and molecular docking simulation of norepinephrine transporter (NET) inhibitors as anti-psychotic therapeutic agents. The norepinephrine transporter (NET) is a Na+/Cl- coupled neurotransmitter transporter responsible for reuptake of released norepinephrine (NE) into nerve terminals in the brain, a key therapeutic used in the treatment of psychiatric disorders. A quantitative structural activity relationship (QSAR) study was performed on 50 compounds of NET inhibitors to investigate their inhibitory potencies against norepinephrine transporter as novel drugs for anti-psychotic disorders. The compounds were optimized by employing Density functional theory (DFT) with basis set of B3LYP/6-31G*. The genetic function Algorithm (GFA) approach was used to generate a highly predictive and statistically significant model with good correlation coefficient R2 Train = 0.952 Cross validated coefficient Q2 cv = 0.870 and adjusted squared correlation coefficient R2 adj = 0.898. The predictability and accuracy of the developed model was evaluated through external validation using test set compound, Y-randomization and applicability domain techniques. The results of Molecular docking analysis by using two neurotransmitter transporters PDB ID 2A65 (resolution = 1.65 Å) and PDB ID 4M48 (resolution = 2.955 Å) showed that two of the ligands (compound 12 and 44) having higher binding affinity were observed to inhibit the targets by forming hydrogen bonds and hydrophobic interactions with amino acids of the two receptors respectively. The results of these studies would provide important new insight into the molecular basis and structural requirements to design more potent and more specific therapeutic anti-psychotic drugs/agents."
Neuro-symbolic representation learning on biological knowledge graphs.,28449114,"Motivation: Biological data and knowledge bases increasingly rely on Semantic Web technologies and the use of knowledge graphs for data integration, retrieval and federated queries. In the past years, feature learning methods that are applicable to graph-structured data are becoming available, but have not yet widely been applied and evaluated on structured biological knowledge. Results: We develop a novel method for feature learning on biological knowledge graphs. Our method combines symbolic methods, in particular knowledge representation using symbolic logic and automated reasoning, with neural networks to generate embeddings of nodes that encode for related information within knowledge graphs. Through the use of symbolic logic, these embeddings contain both explicit and implicit information. We apply these embeddings to the prediction of edges in the knowledge graph representing problems of function prediction, finding candidate genes of diseases, protein-protein interactions, or drug target relations, and demonstrate performance that matches and sometimes outperforms traditional approaches based on manually crafted features. Our method can be applied to any biological knowledge graph, and will thereby open up the increasing amount of Semantic Web based knowledge bases in biology to use in machine learning and data analytics.",0,"Neuro-symbolic representation learning on biological knowledge graphs. Motivation: Biological data and knowledge bases increasingly rely on Semantic Web technologies and the use of knowledge graphs for data integration, retrieval and federated queries. In the past years, feature learning methods that are applicable to graph-structured data are becoming available, but have not yet widely been applied and evaluated on structured biological knowledge. Results: We develop a novel method for feature learning on biological knowledge graphs. Our method combines symbolic methods, in particular knowledge representation using symbolic logic and automated reasoning, with neural networks to generate embeddings of nodes that encode for related information within knowledge graphs. Through the use of symbolic logic, these embeddings contain both explicit and implicit information. We apply these embeddings to the prediction of edges in the knowledge graph representing problems of function prediction, finding candidate genes of diseases, protein-protein interactions, or drug target relations, and demonstrate performance that matches and sometimes outperforms traditional approaches based on manually crafted features. Our method can be applied to any biological knowledge graph, and will thereby open up the increasing amount of Semantic Web based knowledge bases in biology to use in machine learning and data analytics."
Clinicopathological significance of DAPK promoter methylation in non-small-cell lung cancer: a systematic review and meta-analysis.,30588095,"Background: Lung carcinogenesis is related to silencing of tumor suppressor genes and activation of oncogenes. The aim was to investigate the significance of death-associated protein kinase (DAPK) methylation in non-small-cell lung cancer (NSCLC) through a meta-analysis. Methods: A detailed literature search was made in PubMed, Embase, and Web of Science databases. All analysis was performed with Review Manager 5.2. Results: In total, 28 studies with a total of 2,148 patients were involved. The frequency of DAPK promoter hypermethylation was 40.50% in NSCLC, significantly higher than in nonmalignant lung tissue; the pooled OR was 5.69, P<0.00001. Additionally, DAPK promoter hypermethylation was significantly correlated with poor overall survival in patients with NSCLC. However, there was no significant difference found while comparing the rate of DAPK promoter hypermethylation in adenocarcinoma and squamous cell cancer. The rate of DAPK promoter hypermethylation was similar between stage III/IV and stage I/II. In addition, the data showed that DAPK promoter hypermethylation was not associated with smoking behavior in patients with NSCLC. Conclusion: DAPK promoter hypermethylation is correlated with risk of NSCLC and is a potential biomarker for prediction of poor prognosis in patients with NSCLC.",0,"Clinicopathological significance of DAPK promoter methylation in non-small-cell lung cancer: a systematic review and meta-analysis. Background: Lung carcinogenesis is related to silencing of tumor suppressor genes and activation of oncogenes. The aim was to investigate the significance of death-associated protein kinase (DAPK) methylation in non-small-cell lung cancer (NSCLC) through a meta-analysis. Methods: A detailed literature search was made in PubMed, Embase, and Web of Science databases. All analysis was performed with Review Manager 5.2. Results: In total, 28 studies with a total of 2,148 patients were involved. The frequency of DAPK promoter hypermethylation was 40.50% in NSCLC, significantly higher than in nonmalignant lung tissue; the pooled OR was 5.69, P<0.00001. Additionally, DAPK promoter hypermethylation was significantly correlated with poor overall survival in patients with NSCLC. However, there was no significant difference found while comparing the rate of DAPK promoter hypermethylation in adenocarcinoma and squamous cell cancer. The rate of DAPK promoter hypermethylation was similar between stage III/IV and stage I/II. In addition, the data showed that DAPK promoter hypermethylation was not associated with smoking behavior in patients with NSCLC. Conclusion: DAPK promoter hypermethylation is correlated with risk of NSCLC and is a potential biomarker for prediction of poor prognosis in patients with NSCLC."
