Title,PMID,Abstract,Attention-based,text
AttentionDTA: Drug-Target Binding Affinity Prediction by Sequence-Based Deep Learning With Attention Mechanism.,35471889,"The identification of drug-target relations (DTRs) is substantial in drug development. A large number of methods treat DTRs as drug-target interactions (DTIs), a binary classification problem. The main drawback of these methods are the lack of reliable negative samples and the absence of many important aspects of DTR, including their dose dependence and quantitative affinities. With increasing number of publications of drug-protein binding affinity data recently, DTRs prediction can be viewed as a regression problem of drug-target affinities (DTAs) which reflects how tightly the drug binds to the target and can present more detailed and specific information than DTIs. The growth of affinity data enables the use of deep learning architectures, which have been shown to be among the state-of-the-art methods in binding affinity prediction. Although relatively effective, due to the black-box nature of deep learning, these models are less biologically interpretable. In this study, we proposed a deep learning-based model, named AttentionDTA, which uses attention mechanism to predict DTAs. Different from the models using 3D structures of drug-target complexes or graph representation of drugs and proteins, the novelty of our work is to use attention mechanism to focus on key subsequences which are important in drug and protein sequences when predicting its affinity. We use two separate one-dimensional Convolution Neural Networks (1D-CNNs) to extract the semantic information of drug's SMILES string and protein's amino acid sequence. Furthermore, a two-side multi-head attention mechanism is developed and embedded to our model to explore the relationship between drug features and protein features. We evaluate our model on three established DTA benchmark datasets, Davis, Metz, and KIBA. AttentionDTA outperforms the state-of-the-art deep learning methods under different evaluation metrics. The results show that the attention-based model can effectively extract protein features related to drug information and drug features related to protein information to better predict drug target affinities. It is worth mentioning that we test our model on IC50 dataset, which provides the binding sites between drugs and proteins, to evaluate the ability of our model to locate binding sites. Finally, we visualize the attention weight to demonstrate the biological significance of the model. The source code of AttentionDTA can be downloaded from https://github.com/zhaoqichang/AttentionDTA_TCBB.",1,"AttentionDTA: Drug-Target Binding Affinity Prediction by Sequence-Based Deep Learning With Attention Mechanism. The identification of drug-target relations (DTRs) is substantial in drug development. A large number of methods treat DTRs as drug-target interactions (DTIs), a binary classification problem. The main drawback of these methods are the lack of reliable negative samples and the absence of many important aspects of DTR, including their dose dependence and quantitative affinities. With increasing number of publications of drug-protein binding affinity data recently, DTRs prediction can be viewed as a regression problem of drug-target affinities (DTAs) which reflects how tightly the drug binds to the target and can present more detailed and specific information than DTIs. The growth of affinity data enables the use of deep learning architectures, which have been shown to be among the state-of-the-art methods in binding affinity prediction. Although relatively effective, due to the black-box nature of deep learning, these models are less biologically interpretable. In this study, we proposed a deep learning-based model, named AttentionDTA, which uses attention mechanism to predict DTAs. Different from the models using 3D structures of drug-target complexes or graph representation of drugs and proteins, the novelty of our work is to use attention mechanism to focus on key subsequences which are important in drug and protein sequences when predicting its affinity. We use two separate one-dimensional Convolution Neural Networks (1D-CNNs) to extract the semantic information of drug's SMILES string and protein's amino acid sequence. Furthermore, a two-side multi-head attention mechanism is developed and embedded to our model to explore the relationship between drug features and protein features. We evaluate our model on three established DTA benchmark datasets, Davis, Metz, and KIBA. AttentionDTA outperforms the state-of-the-art deep learning methods under different evaluation metrics. The results show that the attention-based model can effectively extract protein features related to drug information and drug features related to protein information to better predict drug target affinities. It is worth mentioning that we test our model on IC50 dataset, which provides the binding sites between drugs and proteins, to evaluate the ability of our model to locate binding sites. Finally, we visualize the attention weight to demonstrate the biological significance of the model. The source code of AttentionDTA can be downloaded from https://github.com/zhaoqichang/AttentionDTA_TCBB."
Multi-view self-attention for interpretable drug-target interaction prediction.,32860883,"The drug discovery stage is a vital aspect of the drug development process and forms part of the initial stages of the development pipeline. In recent times, machine learning-based methods are actively being used to model drug-target interactions for rational drug discovery due to the successful application of these methods in other domains. In machine learning approaches, the numerical representation of molecules is critical to the performance of the model. While significant progress has been made in molecular representation engineering, this has resulted in several descriptors for both targets and compounds. Also, the interpretability of model predictions is a vital feature that could have several pharmacological applications. In this study, we propose a self-attention-based multi-view representation learning approach for modeling drug-target interactions. We evaluated our approach using three benchmark kinase datasets and compared the proposed method to some baseline models. Our experimental results demonstrate the ability of our method to achieve competitive prediction performance and offer biologically plausible drug-target interaction interpretations.",1,"Multi-view self-attention for interpretable drug-target interaction prediction. The drug discovery stage is a vital aspect of the drug development process and forms part of the initial stages of the development pipeline. In recent times, machine learning-based methods are actively being used to model drug-target interactions for rational drug discovery due to the successful application of these methods in other domains. In machine learning approaches, the numerical representation of molecules is critical to the performance of the model. While significant progress has been made in molecular representation engineering, this has resulted in several descriptors for both targets and compounds. Also, the interpretability of model predictions is a vital feature that could have several pharmacological applications. In this study, we propose a self-attention-based multi-view representation learning approach for modeling drug-target interactions. We evaluated our approach using three benchmark kinase datasets and compared the proposed method to some baseline models. Our experimental results demonstrate the ability of our method to achieve competitive prediction performance and offer biologically plausible drug-target interaction interpretations."
SAG-DTA: Prediction of Drug-Target Affinity Using Self-Attention Graph Network.,34445696,"The prediction of drug-target affinity (DTA) is a crucial step for drug screening and discovery. In this study, a new graph-based prediction model named SAG-DTA (self-attention graph drug-target affinity) was implemented. Unlike previous graph-based methods, the proposed model utilized self-attention mechanisms on the drug molecular graph to obtain effective representations of drugs for DTA prediction. Features of each atom node in the molecular graph were weighted using an attention score before being aggregated as molecule representation. Various self-attention scoring methods were compared in this study. In addition, two pooing architectures, namely, global and hierarchical architectures, were presented and evaluated on benchmark datasets. Results of comparative experiments on both regression and binary classification tasks showed that SAG-DTA was superior to previous sequence-based or other graph-based methods and exhibited good generalization ability.",1,"SAG-DTA: Prediction of Drug-Target Affinity Using Self-Attention Graph Network. The prediction of drug-target affinity (DTA) is a crucial step for drug screening and discovery. In this study, a new graph-based prediction model named SAG-DTA (self-attention graph drug-target affinity) was implemented. Unlike previous graph-based methods, the proposed model utilized self-attention mechanisms on the drug molecular graph to obtain effective representations of drugs for DTA prediction. Features of each atom node in the molecular graph were weighted using an attention score before being aggregated as molecule representation. Various self-attention scoring methods were compared in this study. In addition, two pooing architectures, namely, global and hierarchical architectures, were presented and evaluated on benchmark datasets. Results of comparative experiments on both regression and binary classification tasks showed that SAG-DTA was superior to previous sequence-based or other graph-based methods and exhibited good generalization ability."
Novel drug-target interactions via link prediction and network embedding.,35379165,"As many interactions between the chemical and genomic space remain undiscovered, computational methods able to identify potential drug-target interactions (DTIs) are employed to accelerate drug discovery and reduce the required cost. Predicting new DTIs can leverage drug repurposing by identifying new targets for approved drugs. However, developing an accurate computational framework that can efficiently incorporate chemical and genomic spaces remains extremely demanding. A key issue is that most DTI predictions suffer from the lack of experimentally validated negative interactions or limited availability of target 3D structures. We report DT2Vec, a pipeline for DTI prediction based on graph embedding and gradient boosted tree classification. It maps drug-drug and protein-protein similarity networks to low-dimensional features and the DTI prediction is formulated as binary classification based on a strategy of concatenating the drug and target embedding vectors as input features. DT2Vec was compared with three top-performing graph similarity-based algorithms on a standard benchmark dataset and achieved competitive results. In order to explore credible novel DTIs, the model was applied to data from the ChEMBL repository that contain experimentally validated positive and negative interactions which yield a strong predictive model. Then, the developed model was applied to all possible unknown DTIs to predict new interactions. The applicability of DT2Vec as an effective method for drug repurposing is discussed through case studies and evaluation of some novel DTI predictions is undertaken using molecular docking. The proposed method was able to integrate and map chemical and genomic space into low-dimensional dense vectors and showed promising results in predicting novel DTIs.",0,"Novel drug-target interactions via link prediction and network embedding. As many interactions between the chemical and genomic space remain undiscovered, computational methods able to identify potential drug-target interactions (DTIs) are employed to accelerate drug discovery and reduce the required cost. Predicting new DTIs can leverage drug repurposing by identifying new targets for approved drugs. However, developing an accurate computational framework that can efficiently incorporate chemical and genomic spaces remains extremely demanding. A key issue is that most DTI predictions suffer from the lack of experimentally validated negative interactions or limited availability of target 3D structures. We report DT2Vec, a pipeline for DTI prediction based on graph embedding and gradient boosted tree classification. It maps drug-drug and protein-protein similarity networks to low-dimensional features and the DTI prediction is formulated as binary classification based on a strategy of concatenating the drug and target embedding vectors as input features. DT2Vec was compared with three top-performing graph similarity-based algorithms on a standard benchmark dataset and achieved competitive results. In order to explore credible novel DTIs, the model was applied to data from the ChEMBL repository that contain experimentally validated positive and negative interactions which yield a strong predictive model. Then, the developed model was applied to all possible unknown DTIs to predict new interactions. The applicability of DT2Vec as an effective method for drug repurposing is discussed through case studies and evaluation of some novel DTI predictions is undertaken using molecular docking. The proposed method was able to integrate and map chemical and genomic space into low-dimensional dense vectors and showed promising results in predicting novel DTIs."
DeepDTA: deep drug-target binding affinity prediction.,30423097,"The identification of novel drug-target (DT) interactions is a substantial part of the drug discovery process. Most of the computational methods that have been proposed to predict DT interactions have focused on binary classification, where the goal is to determine whether a DT pair interacts or not. However, protein-ligand interactions assume a continuum of binding strength values, also called binding affinity and predicting this value still remains a challenge. The increase in the affinity data available in DT knowledge-bases allows the use of advanced learning techniques such as deep learning architectures in the prediction of binding affinities. In this study, we propose a deep-learning based model that uses only sequence information of both targets and drugs to predict DT interaction binding affinities. The few studies that focus on DT binding affinity prediction use either 3D structures of protein-ligand complexes or 2D features of compounds. One novel approach used in this work is the modeling of protein sequences and compound 1D representations with convolutional neural networks (CNNs). The results show that the proposed deep learning based model that uses the 1D representations of targets and drugs is an effective approach for drug target binding affinity prediction. The model in which high-level representations of a drug and a target are constructed via CNNs achieved the best Concordance Index (CI) performance in one of our larger benchmark datasets, outperforming the KronRLS algorithm and SimBoost, a state-of-the-art method for DT binding affinity prediction. https://github.com/hkmztrk/DeepDTA. Supplementary data are available at Bioinformatics online.",0,"DeepDTA: deep drug-target binding affinity prediction. The identification of novel drug-target (DT) interactions is a substantial part of the drug discovery process. Most of the computational methods that have been proposed to predict DT interactions have focused on binary classification, where the goal is to determine whether a DT pair interacts or not. However, protein-ligand interactions assume a continuum of binding strength values, also called binding affinity and predicting this value still remains a challenge. The increase in the affinity data available in DT knowledge-bases allows the use of advanced learning techniques such as deep learning architectures in the prediction of binding affinities. In this study, we propose a deep-learning based model that uses only sequence information of both targets and drugs to predict DT interaction binding affinities. The few studies that focus on DT binding affinity prediction use either 3D structures of protein-ligand complexes or 2D features of compounds. One novel approach used in this work is the modeling of protein sequences and compound 1D representations with convolutional neural networks (CNNs). The results show that the proposed deep learning based model that uses the 1D representations of targets and drugs is an effective approach for drug target binding affinity prediction. The model in which high-level representations of a drug and a target are constructed via CNNs achieved the best Concordance Index (CI) performance in one of our larger benchmark datasets, outperforming the KronRLS algorithm and SimBoost, a state-of-the-art method for DT binding affinity prediction. https://github.com/hkmztrk/DeepDTA. Supplementary data are available at Bioinformatics online."
Drug Target Group Prediction with Multiple Drug Networks.,31267864,"Identification of drug-target interaction is essential in drug discovery. It is beneficial to predict unexpected therapeutic or adverse side effects of drugs. To date, several computational methods have been proposed to predict drug-target interactions because they are prompt and low-cost compared with traditional wet experiments. In this study, we investigated this problem in a different way. According to KEGG, drugs were classified into several groups based on their target proteins. A multi-label classification model was presented to assign drugs into correct target groups. To make full use of the known drug properties, five networks were constructed, each of which represented drug associations in one property. A powerful network embedding method, Mashup, was adopted to extract drug features from above-mentioned networks, based on which several machine learning algorithms, including RAndom k-labELsets (RAKEL) algorithm, Label Powerset (LP) algorithm and Support Vector Machine (SVM), were used to build the classification model. Tenfold cross-validation yielded the accuracy of 0.839, exact match of 0.816 and hamming loss of 0.037, indicating good performance of the model. The contribution of each network was also analyzed. Furthermore, the network model with multiple networks was found to be superior to the one with a single network and classic model, indicating the superiority of the proposed model.",0,"Drug Target Group Prediction with Multiple Drug Networks. Identification of drug-target interaction is essential in drug discovery. It is beneficial to predict unexpected therapeutic or adverse side effects of drugs. To date, several computational methods have been proposed to predict drug-target interactions because they are prompt and low-cost compared with traditional wet experiments. In this study, we investigated this problem in a different way. According to KEGG, drugs were classified into several groups based on their target proteins. A multi-label classification model was presented to assign drugs into correct target groups. To make full use of the known drug properties, five networks were constructed, each of which represented drug associations in one property. A powerful network embedding method, Mashup, was adopted to extract drug features from above-mentioned networks, based on which several machine learning algorithms, including RAndom k-labELsets (RAKEL) algorithm, Label Powerset (LP) algorithm and Support Vector Machine (SVM), were used to build the classification model. Tenfold cross-validation yielded the accuracy of 0.839, exact match of 0.816 and hamming loss of 0.037, indicating good performance of the model. The contribution of each network was also analyzed. Furthermore, the network model with multiple networks was found to be superior to the one with a single network and classic model, indicating the superiority of the proposed model."
GSAML-DTA: An interpretable drug-target binding affinity prediction model based on graph neural networks with self-attention mechanism and mutual information.,37859276,"Identifying drug-target affinity (DTA) has great practical importance in the process of designing efficacious drugs for known diseases. Recently, numerous deep learning-based computational methods have been developed to predict drug-target affinity and achieved impressive performance. However, most of them construct the molecule (drug or target) encoder without considering the weights of features of each node (atom or residue). Besides, they generally combine drug and target representations directly, which may contain irrelevant-task information. In this study, we develop GSAML-DTA, an interpretable deep learning framework for DTA prediction. GSAML-DTA integrates a self-attention mechanism and graph neural networks (GNNs) to build representations of drugs and target proteins from the structural information. In addition, mutual information is introduced to filter out redundant information and retain relevant information in the combined representations of drugs and targets. Extensive experimental results demonstrate that GSAML-DTA outperforms state-of-the-art methods for DTA prediction on two benchmark datasets. Furthermore, GSAML-DTA has the interpretation ability to analyze binding atoms and residues, which may be conducive to chemical biology studies from data. Overall, GSAML-DTA can serve as a powerful and interpretable tool suitable for DTA modelling.",1,"GSAML-DTA: An interpretable drug-target binding affinity prediction model based on graph neural networks with self-attention mechanism and mutual information. Identifying drug-target affinity (DTA) has great practical importance in the process of designing efficacious drugs for known diseases. Recently, numerous deep learning-based computational methods have been developed to predict drug-target affinity and achieved impressive performance. However, most of them construct the molecule (drug or target) encoder without considering the weights of features of each node (atom or residue). Besides, they generally combine drug and target representations directly, which may contain irrelevant-task information. In this study, we develop GSAML-DTA, an interpretable deep learning framework for DTA prediction. GSAML-DTA integrates a self-attention mechanism and graph neural networks (GNNs) to build representations of drugs and target proteins from the structural information. In addition, mutual information is introduced to filter out redundant information and retain relevant information in the combined representations of drugs and targets. Extensive experimental results demonstrate that GSAML-DTA outperforms state-of-the-art methods for DTA prediction on two benchmark datasets. Furthermore, GSAML-DTA has the interpretation ability to analyze binding atoms and residues, which may be conducive to chemical biology studies from data. Overall, GSAML-DTA can serve as a powerful and interpretable tool suitable for DTA modelling."
Drug-target binding affinity prediction using message passing neural network and self supervised learning.,37730555,"Drug-target binding affinity (DTA) prediction is important for the rapid development of drug discovery. Compared to traditional methods, deep learning methods provide a new way for DTA prediction to achieve good performance without much knowledge of the biochemical background. However, there are still room for improvement in DTA prediction: (1) only focusing on the information of the atom leads to an incomplete representation of the molecular graph; (2) the self-supervised learning method could be introduced for protein representation. In this paper, a DTA prediction model using the deep learning method is proposed, which uses an undirected-CMPNN for molecular embedding and combines CPCProt and MLM models for protein embedding. An attention mechanism is introduced to discover the important part of the protein sequence. The proposed method is evaluated on the datasets Ki and Davis, and the model outperformed other deep learning methods. The proposed model improves the performance of the DTA prediction, which provides a novel strategy for deep learning-based virtual screening methods.",1,"Drug-target binding affinity prediction using message passing neural network and self supervised learning. Drug-target binding affinity (DTA) prediction is important for the rapid development of drug discovery. Compared to traditional methods, deep learning methods provide a new way for DTA prediction to achieve good performance without much knowledge of the biochemical background. However, there are still room for improvement in DTA prediction: (1) only focusing on the information of the atom leads to an incomplete representation of the molecular graph; (2) the self-supervised learning method could be introduced for protein representation. In this paper, a DTA prediction model using the deep learning method is proposed, which uses an undirected-CMPNN for molecular embedding and combines CPCProt and MLM models for protein embedding. An attention mechanism is introduced to discover the important part of the protein sequence. The proposed method is evaluated on the datasets Ki and Davis, and the model outperformed other deep learning methods. The proposed model improves the performance of the DTA prediction, which provides a novel strategy for deep learning-based virtual screening methods."
