Title,PMID,Abstract,Docking,text
Modeling receptor flexibility in the structure-based design of KRASG12C inhibitors.,35930206,"KRAS has long been referred to as an 'undruggable' target due to its high affinity for its cognate ligands (GDP and GTP) and its lack of readily exploited allosteric binding pockets. Recent progress in the development of covalent inhibitors of KRASG12C has revealed that occupancy of an allosteric binding site located between the α3-helix and switch-II loop of KRASG12C-sometimes referred to as the 'switch-II pocket'-holds great potential in the design of direct inhibitors of KRASG12C. In studying diverse switch-II pocket binders during the development of sotorasib (AMG 510), the first FDA-approved inhibitor of KRASG12C, we found the dramatic conformational flexibility of the switch-II pocket posing significant challenges toward the structure-based design of inhibitors. Here, we present our computational approaches for dealing with receptor flexibility in the prediction of ligand binding pose and binding affinity. For binding pose prediction, we modified the covalent docking program CovDock to allow for protein conformational mobility. This new docking approach, termed as FlexCovDock, improves success rates from 55 to 89% for binding pose prediction on a dataset of 10 cross-docking cases and has been prospectively validated across diverse ligand chemotypes. For binding affinity prediction, we found standard free energy perturbation (FEP) methods could not adequately handle the significant conformational change of the switch-II loop. We developed a new computational strategy to accelerate conformational transitions through the use of targeted protein mutations. Using this methodology, the mean unsigned error (MUE) of binding affinity prediction were reduced from 1.44 to 0.89 kcal/mol on a set of 14 compounds. These approaches were of significant use in facilitating the structure-based design of KRASG12C inhibitors and are anticipated to be of further use in the design of covalent (and noncovalent) inhibitors of other conformationally labile protein targets.",1,"Modeling receptor flexibility in the structure-based design of KRASG12C inhibitors. KRAS has long been referred to as an 'undruggable' target due to its high affinity for its cognate ligands (GDP and GTP) and its lack of readily exploited allosteric binding pockets. Recent progress in the development of covalent inhibitors of KRASG12C has revealed that occupancy of an allosteric binding site located between the α3-helix and switch-II loop of KRASG12C-sometimes referred to as the 'switch-II pocket'-holds great potential in the design of direct inhibitors of KRASG12C. In studying diverse switch-II pocket binders during the development of sotorasib (AMG 510), the first FDA-approved inhibitor of KRASG12C, we found the dramatic conformational flexibility of the switch-II pocket posing significant challenges toward the structure-based design of inhibitors. Here, we present our computational approaches for dealing with receptor flexibility in the prediction of ligand binding pose and binding affinity. For binding pose prediction, we modified the covalent docking program CovDock to allow for protein conformational mobility. This new docking approach, termed as FlexCovDock, improves success rates from 55 to 89% for binding pose prediction on a dataset of 10 cross-docking cases and has been prospectively validated across diverse ligand chemotypes. For binding affinity prediction, we found standard free energy perturbation (FEP) methods could not adequately handle the significant conformational change of the switch-II loop. We developed a new computational strategy to accelerate conformational transitions through the use of targeted protein mutations. Using this methodology, the mean unsigned error (MUE) of binding affinity prediction were reduced from 1.44 to 0.89 kcal/mol on a set of 14 compounds. These approaches were of significant use in facilitating the structure-based design of KRASG12C inhibitors and are anticipated to be of further use in the design of covalent (and noncovalent) inhibitors of other conformationally labile protein targets."
Dynamic applicability domain (dAD): compound-target binding affinity estimates with local conformal prediction.,37594752,"Increasing efforts are being made in the field of machine learning to advance the learning of robust and accurate models from experimentally measured data and enable more efficient drug discovery processes. The prediction of binding affinity is one of the most frequent tasks of compound bioactivity modelling. Learned models for binding affinity prediction are assessed by their average performance on unseen samples, but point predictions are typically not provided with a rigorous confidence assessment. Approaches, such as the conformal predictor framework equip conventional models with a more rigorous assessment of confidence for individual point predictions. In this article, we extend the inductive conformal prediction framework for interaction data, in particular the compound-target binding affinity prediction task. The new framework is based on dynamically defined calibration sets that are specific for each testing pair and provides prediction assessment in the context of calibration pairs from its compound-target neighbourhood, enabling improved estimates based on the local properties of the prediction model. The effectiveness of the approach is benchmarked on several publicly available datasets and tested in realistic use-case scenarios with increasing levels of difficulty on a complex compound-target binding affinity space. We demonstrate that in such scenarios, novel approach combining applicability domain paradigm with conformal prediction framework, produces superior confidence assessment with valid and more informative prediction regions compared to other 'state-of-the-art' conformal prediction approaches. Dataset and the code are available on GitHub (https://github.com/mlkr-rbi/dAD).",0,"Dynamic applicability domain (dAD): compound-target binding affinity estimates with local conformal prediction. Increasing efforts are being made in the field of machine learning to advance the learning of robust and accurate models from experimentally measured data and enable more efficient drug discovery processes. The prediction of binding affinity is one of the most frequent tasks of compound bioactivity modelling. Learned models for binding affinity prediction are assessed by their average performance on unseen samples, but point predictions are typically not provided with a rigorous confidence assessment. Approaches, such as the conformal predictor framework equip conventional models with a more rigorous assessment of confidence for individual point predictions. In this article, we extend the inductive conformal prediction framework for interaction data, in particular the compound-target binding affinity prediction task. The new framework is based on dynamically defined calibration sets that are specific for each testing pair and provides prediction assessment in the context of calibration pairs from its compound-target neighbourhood, enabling improved estimates based on the local properties of the prediction model. The effectiveness of the approach is benchmarked on several publicly available datasets and tested in realistic use-case scenarios with increasing levels of difficulty on a complex compound-target binding affinity space. We demonstrate that in such scenarios, novel approach combining applicability domain paradigm with conformal prediction framework, produces superior confidence assessment with valid and more informative prediction regions compared to other 'state-of-the-art' conformal prediction approaches. Dataset and the code are available on GitHub (https://github.com/mlkr-rbi/dAD)."
Fine-grained selective similarity integration for drug-target interaction prediction.,36907663,"The discovery of drug-target interactions (DTIs) is a pivotal process in pharmaceutical development. Computational approaches are a promising and efficient alternative to tedious and costly wet-lab experiments for predicting novel DTIs from numerous candidates. Recently, with the availability of abundant heterogeneous biological information from diverse data sources, computational methods have been able to leverage multiple drug and target similarities to boost the performance of DTI prediction. Similarity integration is an effective and flexible strategy to extract crucial information across complementary similarity views, providing a compressed input for any similarity-based DTI prediction model. However, existing similarity integration methods filter and fuse similarities from a global perspective, neglecting the utility of similarity views for each drug and target. In this study, we propose a Fine-Grained Selective similarity integration approach, called FGS, which employs a local interaction consistency-based weight matrix to capture and exploit the importance of similarities at a finer granularity in both similarity selection and combination steps. We evaluate FGS on five DTI prediction datasets under various prediction settings. Experimental results show that our method not only outperforms similarity integration competitors with comparable computational costs, but also achieves better prediction performance than state-of-the-art DTI prediction approaches by collaborating with conventional base models. Furthermore, case studies on the analysis of similarity weights and on the verification of novel predictions confirm the practical ability of FGS.",0,"Fine-grained selective similarity integration for drug-target interaction prediction. The discovery of drug-target interactions (DTIs) is a pivotal process in pharmaceutical development. Computational approaches are a promising and efficient alternative to tedious and costly wet-lab experiments for predicting novel DTIs from numerous candidates. Recently, with the availability of abundant heterogeneous biological information from diverse data sources, computational methods have been able to leverage multiple drug and target similarities to boost the performance of DTI prediction. Similarity integration is an effective and flexible strategy to extract crucial information across complementary similarity views, providing a compressed input for any similarity-based DTI prediction model. However, existing similarity integration methods filter and fuse similarities from a global perspective, neglecting the utility of similarity views for each drug and target. In this study, we propose a Fine-Grained Selective similarity integration approach, called FGS, which employs a local interaction consistency-based weight matrix to capture and exploit the importance of similarities at a finer granularity in both similarity selection and combination steps. We evaluate FGS on five DTI prediction datasets under various prediction settings. Experimental results show that our method not only outperforms similarity integration competitors with comparable computational costs, but also achieves better prediction performance than state-of-the-art DTI prediction approaches by collaborating with conventional base models. Furthermore, case studies on the analysis of similarity weights and on the verification of novel predictions confirm the practical ability of FGS."
Docking with AutoDock4.,31452103,"AutoDock is one of the most popular receptor-ligand docking simulation programs. It was first released in the early 1990s and is in continuous development and adapted to specific protein targets. AutoDock has been applied to a wide range of biological systems. It has been used not only for protein-ligand docking simulation but also for the prediction of binding affinity with good correlation with experimental binding affinity for several protein systems. The latest version makes use of a semi-empirical force field to evaluate protein-ligand binding affinity and for selecting the lowest energy pose in docking simulation. AutoDock4.2.6 has an arsenal of four search algorithms to carry out docking simulation including simulated annealing, genetic algorithm, and Lamarckian algorithm. In this chapter, we describe a tutorial about how to perform docking with AutoDock4. We focus our simulations on the protein target cyclin-dependent kinase 2.",1,"Docking with AutoDock4. AutoDock is one of the most popular receptor-ligand docking simulation programs. It was first released in the early 1990s and is in continuous development and adapted to specific protein targets. AutoDock has been applied to a wide range of biological systems. It has been used not only for protein-ligand docking simulation but also for the prediction of binding affinity with good correlation with experimental binding affinity for several protein systems. The latest version makes use of a semi-empirical force field to evaluate protein-ligand binding affinity and for selecting the lowest energy pose in docking simulation. AutoDock4.2.6 has an arsenal of four search algorithms to carry out docking simulation including simulated annealing, genetic algorithm, and Lamarckian algorithm. In this chapter, we describe a tutorial about how to perform docking with AutoDock4. We focus our simulations on the protein target cyclin-dependent kinase 2."
Study on mechanism of Guilu Erxianjiao in treatment of post-traumatic stress disorder based on network pharmacology.,32489065,"The aim of this paper was to predict the multi-compound, multi-target and multi-pathway mechanism of Guilu Erxianjiao in treating post-traumatic stress disorder(PTSD) based on network pharmacology. Active compounds and corresponding targets of Guilu Erxianjiao were obtained from TCMSP, BATMAN-TCM, Chemistry and DrugBank database, and known therapeutic targets of PTSD were obtained from OMIM, TTD and DisGeNET Database. The protein interaction network of compound-disease was then built by combining with the STRING Database. Topological parameters of the network were analyzed by Cytoscape 3.6.0 to get key active compounds and their targets. The GO biological process analysis and KEGG pathway analysis of the key targets were conducted. Based on the results of KEGG, the 'compound-target-pathway' network was built by Cytoscape 3.6.0 and the results were verified by SystemsDock online molecular docking tool. The prediction results showed that there were 67 active compounds and 420 targets for Guilu Erxianjiao, and 206 known PTSD-related therapeutic targets. Besides, 66 targets, 58 terms and 22 pathways were obtained from Cytoscape 3.6.0 topological parameters analysis, GO biological process analysis, and KEGG pathway analysis, respectively. Molecular docking results showed that both target with the maximum degree value and common targets of PTSD and Guilu Erxianjiao in the pathway can be effectively combined with their corresponding active compounds through molecular docking. The results suggested that Guilu Erxianjiao could exert anti-PTSD effect by regulating synaptic plasticity, anti-apoptotic, anti-inflammatory and promoting fear memory extinction through pathways such as LTP, PI3 K/Akt/mTOR, TNF, serotonergic synapse and dopaminergic synapse. This study provides a theoretical basis for further elucidating pharmacological mechanisms of Guilu Erxianjiao in treating PTSD.",1,"Study on mechanism of Guilu Erxianjiao in treatment of post-traumatic stress disorder based on network pharmacology. The aim of this paper was to predict the multi-compound, multi-target and multi-pathway mechanism of Guilu Erxianjiao in treating post-traumatic stress disorder(PTSD) based on network pharmacology. Active compounds and corresponding targets of Guilu Erxianjiao were obtained from TCMSP, BATMAN-TCM, Chemistry and DrugBank database, and known therapeutic targets of PTSD were obtained from OMIM, TTD and DisGeNET Database. The protein interaction network of compound-disease was then built by combining with the STRING Database. Topological parameters of the network were analyzed by Cytoscape 3.6.0 to get key active compounds and their targets. The GO biological process analysis and KEGG pathway analysis of the key targets were conducted. Based on the results of KEGG, the 'compound-target-pathway' network was built by Cytoscape 3.6.0 and the results were verified by SystemsDock online molecular docking tool. The prediction results showed that there were 67 active compounds and 420 targets for Guilu Erxianjiao, and 206 known PTSD-related therapeutic targets. Besides, 66 targets, 58 terms and 22 pathways were obtained from Cytoscape 3.6.0 topological parameters analysis, GO biological process analysis, and KEGG pathway analysis, respectively. Molecular docking results showed that both target with the maximum degree value and common targets of PTSD and Guilu Erxianjiao in the pathway can be effectively combined with their corresponding active compounds through molecular docking. The results suggested that Guilu Erxianjiao could exert anti-PTSD effect by regulating synaptic plasticity, anti-apoptotic, anti-inflammatory and promoting fear memory extinction through pathways such as LTP, PI3 K/Akt/mTOR, TNF, serotonergic synapse and dopaminergic synapse. This study provides a theoretical basis for further elucidating pharmacological mechanisms of Guilu Erxianjiao in treating PTSD."
Sequence-based drug-target affinity prediction using weighted graph neural networks.,35715739,"Affinity prediction between molecule and protein is an important step of virtual screening, which is usually called drug-target affinity (DTA) prediction. Its accuracy directly influences the progress of drug development. Sequence-based drug-target affinity prediction can predict the affinity according to protein sequence, which is fast and can be applied to large datasets. However, due to the lack of protein structure information, the accuracy needs to be improved. The proposed model which is called WGNN-DTA can be competent in drug-target affinity (DTA) and compound-protein interaction (CPI) prediction tasks. Various experiments are designed to verify the performance of the proposed method in different scenarios, which proves that WGNN-DTA has the advantages of simplicity and high accuracy. Moreover, because it does not need complex steps such as multiple sequence alignment (MSA), it has fast execution speed, and can be suitable for the screening of large databases. We construct protein and molecular graphs through sequence and SMILES that can effectively reflect their structures. To utilize the detail contact information of protein, graph neural network is used to extract features and predict the binding affinity based on the graphs, which is called weighted graph neural networks drug-target affinity predictor (WGNN-DTA). The proposed method has the advantages of simplicity and high accuracy.",0,"Sequence-based drug-target affinity prediction using weighted graph neural networks. Affinity prediction between molecule and protein is an important step of virtual screening, which is usually called drug-target affinity (DTA) prediction. Its accuracy directly influences the progress of drug development. Sequence-based drug-target affinity prediction can predict the affinity according to protein sequence, which is fast and can be applied to large datasets. However, due to the lack of protein structure information, the accuracy needs to be improved. The proposed model which is called WGNN-DTA can be competent in drug-target affinity (DTA) and compound-protein interaction (CPI) prediction tasks. Various experiments are designed to verify the performance of the proposed method in different scenarios, which proves that WGNN-DTA has the advantages of simplicity and high accuracy. Moreover, because it does not need complex steps such as multiple sequence alignment (MSA), it has fast execution speed, and can be suitable for the screening of large databases. We construct protein and molecular graphs through sequence and SMILES that can effectively reflect their structures. To utilize the detail contact information of protein, graph neural network is used to extract features and predict the binding affinity based on the graphs, which is called weighted graph neural networks drug-target affinity predictor (WGNN-DTA). The proposed method has the advantages of simplicity and high accuracy."
Modality-DTA: Multimodality Fusion Strategy for Drug-Target Affinity Prediction.,36083952,"Prediction of the drug-target affinity (DTA) plays an important role in drug discovery. Existing deep learning methods for DTA prediction typically leverage a single modality, namely simplified molecular input line entry specification (SMILES) or amino acid sequence to learn representations. SMILES or amino acid sequences can be encoded into different modalities. Multimodality data provide different kinds of information, with complementary roles for DTA prediction. We propose Modality-DTA, a novel deep learning method for DTA prediction that leverages the multimodality of drugs and targets. A group of backward propagation neural networks is applied to ensure the completeness of the reconstruction process from the latent feature representation to original multimodality data. The tag between the drug and target is used to reduce the noise information in the latent representation from multimodality data. Experiments on three benchmark datasets show that our Modality-DTA outperforms existing methods in all metrics. Modality-DTA reduces the mean square error by 15.7% and improves the area under the precisionrecall curve by 12.74% in the Davis dataset. We further find that the drug modality Morgan fingerprint and the target modality generated by one-hot-encoding play the most significant roles. To the best of our knowledge, Modality-DTA is the first method to explore multimodality for DTA prediction.",0,"Modality-DTA: Multimodality Fusion Strategy for Drug-Target Affinity Prediction. Prediction of the drug-target affinity (DTA) plays an important role in drug discovery. Existing deep learning methods for DTA prediction typically leverage a single modality, namely simplified molecular input line entry specification (SMILES) or amino acid sequence to learn representations. SMILES or amino acid sequences can be encoded into different modalities. Multimodality data provide different kinds of information, with complementary roles for DTA prediction. We propose Modality-DTA, a novel deep learning method for DTA prediction that leverages the multimodality of drugs and targets. A group of backward propagation neural networks is applied to ensure the completeness of the reconstruction process from the latent feature representation to original multimodality data. The tag between the drug and target is used to reduce the noise information in the latent representation from multimodality data. Experiments on three benchmark datasets show that our Modality-DTA outperforms existing methods in all metrics. Modality-DTA reduces the mean square error by 15.7% and improves the area under the precisionrecall curve by 12.74% in the Davis dataset. We further find that the drug modality Morgan fingerprint and the target modality generated by one-hot-encoding play the most significant roles. To the best of our knowledge, Modality-DTA is the first method to explore multimodality for DTA prediction."
