Title,PMID,Abstract,Deep Learning,text
PeMtb: A Database of MHC Antigenic Peptide of Mycobacterium tuberculosis.,28914198,"Background: For design of a subunit vaccine for tuberculosis, identification of antigenic Tcell epitope is of utmost importance. Several MHC prediction server are available that can accurately predict antigenic peptide of variable lengths. However, peptides predicted from one server not necessarily are predicted form another server, thus creating a confusing situation for scientists to choose a best epitope.Method: Keeping the above problem in mind, we developed a comprehensive database of peptides of Mycobacterial proteins. Each protein was taken from PubMed and was run through different MHC prediction servers, with the results being compiled into one database.Results: For each protein, PeMtb generates a set of three different mers of variable lengths (12 mer or 13-mer) based on their ranking; with each mer being predicted for a plethora of MHC alleles. Researcher can choose the peptide (mers) that gives best binding affinity from most of the servers.Conclusion: The database relieves the investigators of the painstaking task of searching various MHC prediction servers for the right epitope (T-cell epitope) for a particular Mycobacterial antigen. We trust and anticipate that PeMtb will be a practical platform for trial and computational analyses of antigenic peptides for Mycobacterium tuberculosis. All the resources and information can be accessed by PeMtb home page www.pemtb-amu.org.",0,"PeMtb: A Database of MHC Antigenic Peptide of Mycobacterium tuberculosis. Background: For design of a subunit vaccine for tuberculosis, identification of antigenic Tcell epitope is of utmost importance. Several MHC prediction server are available that can accurately predict antigenic peptide of variable lengths. However, peptides predicted from one server not necessarily are predicted form another server, thus creating a confusing situation for scientists to choose a best epitope.Method: Keeping the above problem in mind, we developed a comprehensive database of peptides of Mycobacterial proteins. Each protein was taken from PubMed and was run through different MHC prediction servers, with the results being compiled into one database.Results: For each protein, PeMtb generates a set of three different mers of variable lengths (12 mer or 13-mer) based on their ranking; with each mer being predicted for a plethora of MHC alleles. Researcher can choose the peptide (mers) that gives best binding affinity from most of the servers.Conclusion: The database relieves the investigators of the painstaking task of searching various MHC prediction servers for the right epitope (T-cell epitope) for a particular Mycobacterial antigen. We trust and anticipate that PeMtb will be a practical platform for trial and computational analyses of antigenic peptides for Mycobacterium tuberculosis. All the resources and information can be accessed by PeMtb home page www.pemtb-amu.org."
PPDTS: Predicting potential drug-target interactions based on network similarity.,34783172,"Identification of drug-target interactions (DTIs) has great practical importance in the drug discovery process for known diseases. However, only a small proportion of DTIs in these databases has been verified experimentally, and the computational methods for predicting the interactions remain challenging. As a result, some effective computational models have become increasingly popular for predicting DTIs. In this work, the authors predict potential DTIs from the local structure of drug-target associations' network, which is different from the traditional global network similarity methods based on structure and ligand. A novel method called PPDTS is proposed to predict DTIs. First, according to the DTIs' network local structure, the known DTIs are converted into a binary network. Second, the Resource Allocation algorithm is used to obtain a drug-drug similarity network and a target-target similarity network. Third, a Collaborative Filtering algorithm is used with the known drug-target topology information to obtain similarity scores. Fourth, the linear combination of drug-target similarity model and the target-drug similarity model are innovatively proposed to obtain the final prediction results. Finally, the experimental performance of PPDTS has proved to be higher than that of the previously mentioned four popular network-based similarity methods, which is validated in different experimental datasets. Some of the predicted results can be supported in UniProt and DrugBank databases.",0,"PPDTS: Predicting potential drug-target interactions based on network similarity. Identification of drug-target interactions (DTIs) has great practical importance in the drug discovery process for known diseases. However, only a small proportion of DTIs in these databases has been verified experimentally, and the computational methods for predicting the interactions remain challenging. As a result, some effective computational models have become increasingly popular for predicting DTIs. In this work, the authors predict potential DTIs from the local structure of drug-target associations' network, which is different from the traditional global network similarity methods based on structure and ligand. A novel method called PPDTS is proposed to predict DTIs. First, according to the DTIs' network local structure, the known DTIs are converted into a binary network. Second, the Resource Allocation algorithm is used to obtain a drug-drug similarity network and a target-target similarity network. Third, a Collaborative Filtering algorithm is used with the known drug-target topology information to obtain similarity scores. Fourth, the linear combination of drug-target similarity model and the target-drug similarity model are innovatively proposed to obtain the final prediction results. Finally, the experimental performance of PPDTS has proved to be higher than that of the previously mentioned four popular network-based similarity methods, which is validated in different experimental datasets. Some of the predicted results can be supported in UniProt and DrugBank databases."
Toxicity prediction using target,37061207,"In silico methods are essential to the safety evaluation of chemicals. Computational risk assessment offers several approaches, with data science and knowledge-based methods becoming an increasingly important sub-group. One of the substantial attributes of data science is that it allows using existing data to find correlations, build strong hypotheses, and create new, valuable knowledge that may help to reduce the number of resource intensive experiments. In choosing a suitable method for toxicity prediction, the available data and desired toxicity endpoint are two essential factors to consider. The complexity of the endpoint can impact the success rate of the in silico models. For highly complex endpoints such as hepatotoxicity, it can be beneficial to decipher the toxic event from a more systemic point of view. We propose a data science-based modelling pipeline that uses compounds` connections to tissue-specific biological targets, interactome, and biological pathways as descriptors of compounds. Models trained on different combinations of the collected, compound-target, compound-interactor, and compound-pathway profiles, were used to predict the hepatotoxicity of drug-like compounds. Several tree-based models were trained, utilizing separate and combined target, interactome and pathway level variables. The model using combined descriptors of all levels and the random forest algorithm was further optimized. Descriptor importance for model performance was addressed and examined for a biological explanation to define which targets or pathways can have a crucial role in toxicity. Descriptors connected to cytochromes P450 enzymes, heme degradation and biological oxidation received high weights. Furthermore, the involvement of other, less discussed processes in connection with toxicity, such as the involvement of RHO GTPase effectors in hepatotoxicity, were marked as fundamental. The optimized combined model using only the selected descriptors yielded the best performance with an accuracy of 0.766. The same dataset using classical Morgan fingerprints for compound representation yielded models with similar performance measures, as well as the combination of systems biology-based descriptors and Morgan fingerprints. Consequently, adding the structural information of compounds did not enhance the predictive value of the models. The developed systems biology-based pipeline comprises a valuable tool in predicting toxicity, while providing novel insights about the possible mechanisms of the unwanted events.",0,"Toxicity prediction using target In silico methods are essential to the safety evaluation of chemicals. Computational risk assessment offers several approaches, with data science and knowledge-based methods becoming an increasingly important sub-group. One of the substantial attributes of data science is that it allows using existing data to find correlations, build strong hypotheses, and create new, valuable knowledge that may help to reduce the number of resource intensive experiments. In choosing a suitable method for toxicity prediction, the available data and desired toxicity endpoint are two essential factors to consider. The complexity of the endpoint can impact the success rate of the in silico models. For highly complex endpoints such as hepatotoxicity, it can be beneficial to decipher the toxic event from a more systemic point of view. We propose a data science-based modelling pipeline that uses compounds` connections to tissue-specific biological targets, interactome, and biological pathways as descriptors of compounds. Models trained on different combinations of the collected, compound-target, compound-interactor, and compound-pathway profiles, were used to predict the hepatotoxicity of drug-like compounds. Several tree-based models were trained, utilizing separate and combined target, interactome and pathway level variables. The model using combined descriptors of all levels and the random forest algorithm was further optimized. Descriptor importance for model performance was addressed and examined for a biological explanation to define which targets or pathways can have a crucial role in toxicity. Descriptors connected to cytochromes P450 enzymes, heme degradation and biological oxidation received high weights. Furthermore, the involvement of other, less discussed processes in connection with toxicity, such as the involvement of RHO GTPase effectors in hepatotoxicity, were marked as fundamental. The optimized combined model using only the selected descriptors yielded the best performance with an accuracy of 0.766. The same dataset using classical Morgan fingerprints for compound representation yielded models with similar performance measures, as well as the combination of systems biology-based descriptors and Morgan fingerprints. Consequently, adding the structural information of compounds did not enhance the predictive value of the models. The developed systems biology-based pipeline comprises a valuable tool in predicting toxicity, while providing novel insights about the possible mechanisms of the unwanted events."
TorsionNet: A Deep Neural Network to Rapidly Predict Small-Molecule Torsional Energy Profiles with the Accuracy of Quantum Mechanics.,35119861,"Fast and accurate assessment of small-molecule dihedral energetics is crucial for molecular design and optimization in medicinal chemistry. Yet, accurate prediction of torsion energy profiles remains challenging as the current molecular mechanics (MM) methods are limited by insufficient coverage of drug-like chemical space and accurate quantum mechanical (QM) methods are too expensive. To address this limitation, we introduce TorsionNet, a deep neural network (DNN) model specifically developed to predict small-molecule torsion energy profiles with QM-level accuracy. We applied active learning to identify nearly 50k fragments (with elements H, C, N, O, F, S, and Cl) that maximized the coverage of our corporate compound library and leveraged massively parallel cloud computing resources for density functional theory (DFT) torsion scans of these fragments, generating a training data set of 1.2 million DFT energies. After training TorsionNet on this data set, we obtain a model that can rapidly predict the torsion energy profile of typical drug-like fragments with DFT-level accuracy. Importantly, our method also provides an uncertainty estimate for the predicted profiles without any additional calculations. In this report, we show that TorsionNet can accurately identify the preferred dihedral geometries observed in crystal structures. Our TorsionNet-based analysis of a diverse set of protein-ligand complexes with measured binding affinity shows a strong association between high ligand strain and low potency. We also present practical applications of TorsionNet that demonstrate how consideration of DNN-based strain energy leads to substantial improvement in existing lead discovery and design workflows. TorsionNet500, a benchmark data set comprising 500 chemically diverse fragments with DFT torsion profiles (12k MM- and DFT-optimized geometries and energies), has been created and is made publicly available.",1,"TorsionNet: A Deep Neural Network to Rapidly Predict Small-Molecule Torsional Energy Profiles with the Accuracy of Quantum Mechanics. Fast and accurate assessment of small-molecule dihedral energetics is crucial for molecular design and optimization in medicinal chemistry. Yet, accurate prediction of torsion energy profiles remains challenging as the current molecular mechanics (MM) methods are limited by insufficient coverage of drug-like chemical space and accurate quantum mechanical (QM) methods are too expensive. To address this limitation, we introduce TorsionNet, a deep neural network (DNN) model specifically developed to predict small-molecule torsion energy profiles with QM-level accuracy. We applied active learning to identify nearly 50k fragments (with elements H, C, N, O, F, S, and Cl) that maximized the coverage of our corporate compound library and leveraged massively parallel cloud computing resources for density functional theory (DFT) torsion scans of these fragments, generating a training data set of 1.2 million DFT energies. After training TorsionNet on this data set, we obtain a model that can rapidly predict the torsion energy profile of typical drug-like fragments with DFT-level accuracy. Importantly, our method also provides an uncertainty estimate for the predicted profiles without any additional calculations. In this report, we show that TorsionNet can accurately identify the preferred dihedral geometries observed in crystal structures. Our TorsionNet-based analysis of a diverse set of protein-ligand complexes with measured binding affinity shows a strong association between high ligand strain and low potency. We also present practical applications of TorsionNet that demonstrate how consideration of DNN-based strain energy leads to substantial improvement in existing lead discovery and design workflows. TorsionNet500, a benchmark data set comprising 500 chemically diverse fragments with DFT torsion profiles (12k MM- and DFT-optimized geometries and energies), has been created and is made publicly available."
Using BERT to identify drug-target interactions from whole PubMed.,35729494,"Drug-target interactions (DTIs) are critical for drug repurposing and elucidation of drug mechanisms, and are manually curated by large databases, such as ChEMBL, BindingDB, DrugBank and DrugTargetCommons. However, the number of curated articles likely constitutes only a fraction of all the articles that contain experimentally determined DTIs. Finding such articles and extracting the experimental information is a challenging task, and there is a pressing need for systematic approaches to assist the curation of DTIs. To this end, we applied Bidirectional Encoder Representations from Transformers (BERT) to identify such articles. Because DTI data intimately depends on the type of assays used to generate it, we also aimed to incorporate functions to predict the assay format. Our novel method identified 0.6 million articles (along with drug and protein information) which are not previously included in public DTI databases. Using 10-fold cross-validation, we obtained ~ 99% accuracy for identifying articles containing quantitative drug-target profiles. The F1 micro for the prediction of assay format is 88%, which leaves room for improvement in future studies. The BERT model in this study is robust and the proposed pipeline can be used to identify previously overlooked articles containing quantitative DTIs. Overall, our method provides a significant advancement in machine-assisted DTI extraction and curation. We expect it to be a useful addition to drug mechanism discovery and repurposing.",1,"Using BERT to identify drug-target interactions from whole PubMed. Drug-target interactions (DTIs) are critical for drug repurposing and elucidation of drug mechanisms, and are manually curated by large databases, such as ChEMBL, BindingDB, DrugBank and DrugTargetCommons. However, the number of curated articles likely constitutes only a fraction of all the articles that contain experimentally determined DTIs. Finding such articles and extracting the experimental information is a challenging task, and there is a pressing need for systematic approaches to assist the curation of DTIs. To this end, we applied Bidirectional Encoder Representations from Transformers (BERT) to identify such articles. Because DTI data intimately depends on the type of assays used to generate it, we also aimed to incorporate functions to predict the assay format. Our novel method identified 0.6 million articles (along with drug and protein information) which are not previously included in public DTI databases. Using 10-fold cross-validation, we obtained ~ 99% accuracy for identifying articles containing quantitative drug-target profiles. The F1 micro for the prediction of assay format is 88%, which leaves room for improvement in future studies. The BERT model in this study is robust and the proposed pipeline can be used to identify previously overlooked articles containing quantitative DTIs. Overall, our method provides a significant advancement in machine-assisted DTI extraction and curation. We expect it to be a useful addition to drug mechanism discovery and repurposing."
Predicting Drug-Target Interactions Over Heterogeneous Information Network.,36327172,"Identifying Drug-Target Interactions (DTIs) is a critical step in studying pathogenesis and drug development. Due to the fact that conventional experimental methods usually suffer from high costs and low efficiency, various computational methods have been proposed to detect potential DTIs by extracting features from the biological information of drugs and their target proteins. Though effective, most of them fall short of considering the topological structure of the DTI network, which provides a global view to discover novel DTIs. In this paper, a network-based computational method, namely LG-DTI, is proposed to accurately predict DTIs over a heterogeneous information network. For drugs and target proteins, LG-DTI first learns not only their local representations from drug molecular structures and protein sequences, but also their global representations by using a semi-supervised heterogeneous network embedding method. These two kinds of representations consist of the final representations of drugs and target proteins, which are then incorporated into a Random Forest classifier to complete the task of DTI prediction. The performance of LG-DTI has been evaluated on two independent datasets and also compared with several state-of-the-art methods. Experimental results show the superior performance of LG-DTI. Moreover, our case study indicates that LG-DTI can be a valuable tool for identifying novel DTIs.",1,"Predicting Drug-Target Interactions Over Heterogeneous Information Network. Identifying Drug-Target Interactions (DTIs) is a critical step in studying pathogenesis and drug development. Due to the fact that conventional experimental methods usually suffer from high costs and low efficiency, various computational methods have been proposed to detect potential DTIs by extracting features from the biological information of drugs and their target proteins. Though effective, most of them fall short of considering the topological structure of the DTI network, which provides a global view to discover novel DTIs. In this paper, a network-based computational method, namely LG-DTI, is proposed to accurately predict DTIs over a heterogeneous information network. For drugs and target proteins, LG-DTI first learns not only their local representations from drug molecular structures and protein sequences, but also their global representations by using a semi-supervised heterogeneous network embedding method. These two kinds of representations consist of the final representations of drugs and target proteins, which are then incorporated into a Random Forest classifier to complete the task of DTI prediction. The performance of LG-DTI has been evaluated on two independent datasets and also compared with several state-of-the-art methods. Experimental results show the superior performance of LG-DTI. Moreover, our case study indicates that LG-DTI can be a valuable tool for identifying novel DTIs."
Detecting Drug-Target Interactions with Feature Similarity Fusion and Molecular Graphs.,36101348,"The key to drug discovery is the identification of a target and a corresponding drug compound. Effective identification of drug-target interactions facilitates the development of drug discovery. In this paper, drug similarity and target similarity are considered, and graphical representations are used to extract internal structural information and intermolecular interaction information about drugs and targets. First, drug similarity and target similarity are fused using the similarity network fusion (SNF) method. Then, the graph isomorphic network (GIN) is used to extract the features with information about the internal structure of drug molecules. For target proteins, feature extraction is carried out using TextCNN to efficiently capture the features of target protein sequences. Three different divisions (CVD, CVP, CVT) are used on the standard dataset, and experiments are carried out separately to validate the performance of the model for drug-target interaction prediction. The experimental results show that our method achieves better results on AUC and AUPR. The docking results also show the superiority of the proposed model in predicting drug-target interactions.",1,"Detecting Drug-Target Interactions with Feature Similarity Fusion and Molecular Graphs. The key to drug discovery is the identification of a target and a corresponding drug compound. Effective identification of drug-target interactions facilitates the development of drug discovery. In this paper, drug similarity and target similarity are considered, and graphical representations are used to extract internal structural information and intermolecular interaction information about drugs and targets. First, drug similarity and target similarity are fused using the similarity network fusion (SNF) method. Then, the graph isomorphic network (GIN) is used to extract the features with information about the internal structure of drug molecules. For target proteins, feature extraction is carried out using TextCNN to efficiently capture the features of target protein sequences. Three different divisions (CVD, CVP, CVT) are used on the standard dataset, and experiments are carried out separately to validate the performance of the model for drug-target interaction prediction. The experimental results show that our method achieves better results on AUC and AUPR. The docking results also show the superiority of the proposed model in predicting drug-target interactions."
