Title,PMID,Abstract,Regression,text
TeM-DTBA: time-efficient drug target binding affinity prediction using multiple modalities with Lasso feature selection.,37777631,"Drug discovery, especially virtual screening and drug repositioning, can be accelerated through deeper understanding and prediction of Drug Target Interactions (DTIs). The advancement of deep learning as well as the time and financial costs associated with conventional wet-lab experiments have made computational methods for DTI prediction more popular. However, the majority of these computational methods handle the DTI problem as a binary classification task, ignoring the quantitative binding affinity that determines the drug efficacy to their target proteins. Moreover, computational space as well as execution time of the model is often ignored over accuracy. To address these challenges, we introduce a novel method, called Time-efficient Multimodal Drug Target Binding Affinity (TeM-DTBA), which predicts the binding affinity between drugs and targets by fusing different modalities based on compound structures and target sequences. We employ the Lasso feature selection method, which lowers the dimensionality of feature vectors and speeds up the proposed model training time by more than 50%. The results from two benchmark datasets demonstrate that our method outperforms state-of-the-art methods in terms of performance. The mean squared errors of 18.8% and 23.19%, achieved on the KIBA and Davis datasets, respectively, suggest that our method is more accurate in predicting drug-target binding affinity.",1,"TeM-DTBA: time-efficient drug target binding affinity prediction using multiple modalities with Lasso feature selection. Drug discovery, especially virtual screening and drug repositioning, can be accelerated through deeper understanding and prediction of Drug Target Interactions (DTIs). The advancement of deep learning as well as the time and financial costs associated with conventional wet-lab experiments have made computational methods for DTI prediction more popular. However, the majority of these computational methods handle the DTI problem as a binary classification task, ignoring the quantitative binding affinity that determines the drug efficacy to their target proteins. Moreover, computational space as well as execution time of the model is often ignored over accuracy. To address these challenges, we introduce a novel method, called Time-efficient Multimodal Drug Target Binding Affinity (TeM-DTBA), which predicts the binding affinity between drugs and targets by fusing different modalities based on compound structures and target sequences. We employ the Lasso feature selection method, which lowers the dimensionality of feature vectors and speeds up the proposed model training time by more than 50%. The results from two benchmark datasets demonstrate that our method outperforms state-of-the-art methods in terms of performance. The mean squared errors of 18.8% and 23.19%, achieved on the KIBA and Davis datasets, respectively, suggest that our method is more accurate in predicting drug-target binding affinity."
Drug-target interaction prediction with tree-ensemble learning and output space reconstruction.,32033537,"Computational prediction of drug-target interactions (DTI) is vital for drug discovery. The experimental identification of interactions between drugs and target proteins is very onerous. Modern technologies have mitigated the problem, leveraging the development of new drugs. However, drug development remains extremely expensive and time consuming. Therefore, in silico DTI predictions based on machine learning can alleviate the burdensome task of drug development. Many machine learning approaches have been proposed over the years for DTI prediction. Nevertheless, prediction accuracy and efficiency are persisting problems that still need to be tackled. Here, we propose a new learning method which addresses DTI prediction as a multi-output prediction task by learning ensembles of multi-output bi-clustering trees (eBICT) on reconstructed networks. In our setting, the nodes of a DTI network (drugs and proteins) are represented by features (background information). The interactions between the nodes of a DTI network are modeled as an interaction matrix and compose the output space in our problem. The proposed approach integrates background information from both drug and target protein spaces into the same global network framework. We performed an empirical evaluation, comparing the proposed approach to state of the art DTI prediction methods and demonstrated the effectiveness of the proposed approach in different prediction settings. For evaluation purposes, we used several benchmark datasets that represent drug-protein networks. We show that output space reconstruction can boost the predictive performance of tree-ensemble learning methods, yielding more accurate DTI predictions. We proposed a new DTI prediction method where bi-clustering trees are built on reconstructed networks. Building tree-ensemble learning models with output space reconstruction leads to superior prediction results, while preserving the advantages of tree-ensembles, such as scalability, interpretability and inductive setting.",0,"Drug-target interaction prediction with tree-ensemble learning and output space reconstruction. Computational prediction of drug-target interactions (DTI) is vital for drug discovery. The experimental identification of interactions between drugs and target proteins is very onerous. Modern technologies have mitigated the problem, leveraging the development of new drugs. However, drug development remains extremely expensive and time consuming. Therefore, in silico DTI predictions based on machine learning can alleviate the burdensome task of drug development. Many machine learning approaches have been proposed over the years for DTI prediction. Nevertheless, prediction accuracy and efficiency are persisting problems that still need to be tackled. Here, we propose a new learning method which addresses DTI prediction as a multi-output prediction task by learning ensembles of multi-output bi-clustering trees (eBICT) on reconstructed networks. In our setting, the nodes of a DTI network (drugs and proteins) are represented by features (background information). The interactions between the nodes of a DTI network are modeled as an interaction matrix and compose the output space in our problem. The proposed approach integrates background information from both drug and target protein spaces into the same global network framework. We performed an empirical evaluation, comparing the proposed approach to state of the art DTI prediction methods and demonstrated the effectiveness of the proposed approach in different prediction settings. For evaluation purposes, we used several benchmark datasets that represent drug-protein networks. We show that output space reconstruction can boost the predictive performance of tree-ensemble learning methods, yielding more accurate DTI predictions. We proposed a new DTI prediction method where bi-clustering trees are built on reconstructed networks. Building tree-ensemble learning models with output space reconstruction leads to superior prediction results, while preserving the advantages of tree-ensembles, such as scalability, interpretability and inductive setting."
Mitigating cold-start problems in drug-target affinity prediction with interaction knowledge transferring.,35788823,"Predicting the drug-target interaction is crucial for drug discovery as well as drug repurposing. Machine learning is commonly used in drug-target affinity (DTA) problem. However, the machine learning model faces the cold-start problem where the model performance drops when predicting the interaction of a novel drug or target. Previous works try to solve the cold start problem by learning the drug or target representation using unsupervised learning. While the drug or target representation can be learned in an unsupervised manner, it still lacks the interaction information, which is critical in drug-target interaction. To incorporate the interaction information into the drug and protein interaction, we proposed using transfer learning from chemical-chemical interaction (CCI) and protein-protein interaction (PPI) task to drug-target interaction task. The representation learned by CCI and PPI tasks can be transferred smoothly to the DTA task due to the similar nature of the tasks. The result on the DTA datasets shows that our proposed method has advantages compared to other pre-training methods in the DTA task.",1,"Mitigating cold-start problems in drug-target affinity prediction with interaction knowledge transferring. Predicting the drug-target interaction is crucial for drug discovery as well as drug repurposing. Machine learning is commonly used in drug-target affinity (DTA) problem. However, the machine learning model faces the cold-start problem where the model performance drops when predicting the interaction of a novel drug or target. Previous works try to solve the cold start problem by learning the drug or target representation using unsupervised learning. While the drug or target representation can be learned in an unsupervised manner, it still lacks the interaction information, which is critical in drug-target interaction. To incorporate the interaction information into the drug and protein interaction, we proposed using transfer learning from chemical-chemical interaction (CCI) and protein-protein interaction (PPI) task to drug-target interaction task. The representation learned by CCI and PPI tasks can be transferred smoothly to the DTA task due to the similar nature of the tasks. The result on the DTA datasets shows that our proposed method has advantages compared to other pre-training methods in the DTA task."
Matrix factorization with denoising autoencoders for prediction of drug-target interactions.,35871213,"Drug-target interaction is crucial in the discovery of new drugs. Computational methods can be used to identify new drug-target interactions at low costs and with reasonable accuracy. Recent studies pay more attention to machine-learning methods, ranging from matrix factorization to deep learning, in the DTI prediction. Since the interaction matrix is often extremely sparse, DTI prediction performance is significantly decreased with matrix factorization-based methods. Therefore, some matrix factorization methods utilize side information to address both the sparsity issue of the interaction matrix and the cold-start issue. By combining matrix factorization and autoencoders, we propose a hybrid DTI prediction model that simultaneously learn the hidden factors of drugs and targets from their side information and interaction matrix. The proposed method is composed of two steps: the pre-processing of the interaction matrix, and the hybrid model. We leverage the similarity matrices of both drugs and targets to address the sparsity problem of the interaction matrix. The comparison of our approach against other algorithms on the same reference datasets has shown good results regarding area under receiver operating characteristic curve and the area under precision-recall curve. More specifically, experimental results achieve high accuracy on golden standard datasets (e.g., Nuclear Receptors, GPCRs, Ion Channels, and Enzymes) when performed with five repetitions of tenfold cross-validation. Display graphical of the hybrid model of Matrix Factorization with Denoising Autoencoders with the help side information of drugs and targets for Prediction of Drug-Target Interactions.",0,"Matrix factorization with denoising autoencoders for prediction of drug-target interactions. Drug-target interaction is crucial in the discovery of new drugs. Computational methods can be used to identify new drug-target interactions at low costs and with reasonable accuracy. Recent studies pay more attention to machine-learning methods, ranging from matrix factorization to deep learning, in the DTI prediction. Since the interaction matrix is often extremely sparse, DTI prediction performance is significantly decreased with matrix factorization-based methods. Therefore, some matrix factorization methods utilize side information to address both the sparsity issue of the interaction matrix and the cold-start issue. By combining matrix factorization and autoencoders, we propose a hybrid DTI prediction model that simultaneously learn the hidden factors of drugs and targets from their side information and interaction matrix. The proposed method is composed of two steps: the pre-processing of the interaction matrix, and the hybrid model. We leverage the similarity matrices of both drugs and targets to address the sparsity problem of the interaction matrix. The comparison of our approach against other algorithms on the same reference datasets has shown good results regarding area under receiver operating characteristic curve and the area under precision-recall curve. More specifically, experimental results achieve high accuracy on golden standard datasets (e.g., Nuclear Receptors, GPCRs, Ion Channels, and Enzymes) when performed with five repetitions of tenfold cross-validation. Display graphical of the hybrid model of Matrix Factorization with Denoising Autoencoders with the help side information of drugs and targets for Prediction of Drug-Target Interactions."
DeepDTA: deep drug-target binding affinity prediction.,30423097,"The identification of novel drug-target (DT) interactions is a substantial part of the drug discovery process. Most of the computational methods that have been proposed to predict DT interactions have focused on binary classification, where the goal is to determine whether a DT pair interacts or not. However, protein-ligand interactions assume a continuum of binding strength values, also called binding affinity and predicting this value still remains a challenge. The increase in the affinity data available in DT knowledge-bases allows the use of advanced learning techniques such as deep learning architectures in the prediction of binding affinities. In this study, we propose a deep-learning based model that uses only sequence information of both targets and drugs to predict DT interaction binding affinities. The few studies that focus on DT binding affinity prediction use either 3D structures of protein-ligand complexes or 2D features of compounds. One novel approach used in this work is the modeling of protein sequences and compound 1D representations with convolutional neural networks (CNNs). The results show that the proposed deep learning based model that uses the 1D representations of targets and drugs is an effective approach for drug target binding affinity prediction. The model in which high-level representations of a drug and a target are constructed via CNNs achieved the best Concordance Index (CI) performance in one of our larger benchmark datasets, outperforming the KronRLS algorithm and SimBoost, a state-of-the-art method for DT binding affinity prediction. https://github.com/hkmztrk/DeepDTA. Supplementary data are available at Bioinformatics online.",1,"DeepDTA: deep drug-target binding affinity prediction. The identification of novel drug-target (DT) interactions is a substantial part of the drug discovery process. Most of the computational methods that have been proposed to predict DT interactions have focused on binary classification, where the goal is to determine whether a DT pair interacts or not. However, protein-ligand interactions assume a continuum of binding strength values, also called binding affinity and predicting this value still remains a challenge. The increase in the affinity data available in DT knowledge-bases allows the use of advanced learning techniques such as deep learning architectures in the prediction of binding affinities. In this study, we propose a deep-learning based model that uses only sequence information of both targets and drugs to predict DT interaction binding affinities. The few studies that focus on DT binding affinity prediction use either 3D structures of protein-ligand complexes or 2D features of compounds. One novel approach used in this work is the modeling of protein sequences and compound 1D representations with convolutional neural networks (CNNs). The results show that the proposed deep learning based model that uses the 1D representations of targets and drugs is an effective approach for drug target binding affinity prediction. The model in which high-level representations of a drug and a target are constructed via CNNs achieved the best Concordance Index (CI) performance in one of our larger benchmark datasets, outperforming the KronRLS algorithm and SimBoost, a state-of-the-art method for DT binding affinity prediction. https://github.com/hkmztrk/DeepDTA. Supplementary data are available at Bioinformatics online."
Drug-target binding affinity prediction using message passing neural network and self supervised learning.,37730555,"Drug-target binding affinity (DTA) prediction is important for the rapid development of drug discovery. Compared to traditional methods, deep learning methods provide a new way for DTA prediction to achieve good performance without much knowledge of the biochemical background. However, there are still room for improvement in DTA prediction: (1) only focusing on the information of the atom leads to an incomplete representation of the molecular graph; (2) the self-supervised learning method could be introduced for protein representation. In this paper, a DTA prediction model using the deep learning method is proposed, which uses an undirected-CMPNN for molecular embedding and combines CPCProt and MLM models for protein embedding. An attention mechanism is introduced to discover the important part of the protein sequence. The proposed method is evaluated on the datasets Ki and Davis, and the model outperformed other deep learning methods. The proposed model improves the performance of the DTA prediction, which provides a novel strategy for deep learning-based virtual screening methods.",0,"Drug-target binding affinity prediction using message passing neural network and self supervised learning. Drug-target binding affinity (DTA) prediction is important for the rapid development of drug discovery. Compared to traditional methods, deep learning methods provide a new way for DTA prediction to achieve good performance without much knowledge of the biochemical background. However, there are still room for improvement in DTA prediction: (1) only focusing on the information of the atom leads to an incomplete representation of the molecular graph; (2) the self-supervised learning method could be introduced for protein representation. In this paper, a DTA prediction model using the deep learning method is proposed, which uses an undirected-CMPNN for molecular embedding and combines CPCProt and MLM models for protein embedding. An attention mechanism is introduced to discover the important part of the protein sequence. The proposed method is evaluated on the datasets Ki and Davis, and the model outperformed other deep learning methods. The proposed model improves the performance of the DTA prediction, which provides a novel strategy for deep learning-based virtual screening methods."
Drug-target binding affinity prediction method based on a deep graph neural network.,36650765,"The development of new drugs is a long and costly process, Computer-aided drug design reduces development costs while computationally shortening the new drug development cycle, in which DTA (Drug-Target binding Affinity) prediction is a key step to screen out potential drugs. With the development of deep learning, various types of deep learning models have achieved notable performance in a wide range of fields. Most current related studies focus on extracting the sequence features of molecules while ignoring the valuable structural information; they employ sequence data that represent only the elemental composition of molecules without considering the molecular structure maps that contain structural information. In this paper, we use graph neural networks to predict DTA based on corresponding graph data of drugs and proteins, and we achieve competitive performance on two benchmark datasets, Davis and KIBA. In particular, an MSE of 0.227 and CI of 0.895 were obtained on Davis, and an MSE of 0.127 and CI of 0.903 were obtained on KIBA.",1,"Drug-target binding affinity prediction method based on a deep graph neural network. The development of new drugs is a long and costly process, Computer-aided drug design reduces development costs while computationally shortening the new drug development cycle, in which DTA (Drug-Target binding Affinity) prediction is a key step to screen out potential drugs. With the development of deep learning, various types of deep learning models have achieved notable performance in a wide range of fields. Most current related studies focus on extracting the sequence features of molecules while ignoring the valuable structural information; they employ sequence data that represent only the elemental composition of molecules without considering the molecular structure maps that contain structural information. In this paper, we use graph neural networks to predict DTA based on corresponding graph data of drugs and proteins, and we achieve competitive performance on two benchmark datasets, Davis and KIBA. In particular, an MSE of 0.227 and CI of 0.895 were obtained on Davis, and an MSE of 0.127 and CI of 0.903 were obtained on KIBA."
GANsDTA: Predicting Drug-Target Binding Affinity Using GANs.,31993067,"The computational prediction of interactions between drugs and targets is a standing challenge in drug discovery. State-of-the-art methods for drug-target interaction prediction are primarily based on supervised machine learning with known label information. However, in biomedicine, obtaining labeled training data is an expensive and a laborious process. This paper proposes a semi-supervised generative adversarial networks (GANs)-based method to predict binding affinity. Our method comprises two parts, two GANs for feature extraction and a regression network for prediction. The semi-supervised mechanism allows our model to learn proteins drugs features of both labeled and unlabeled data. We evaluate the performance of our method using multiple public datasets. Experimental results demonstrate that our method achieves competitive performance while utilizing freely available unlabeled data. Our results suggest that utilizing such unlabeled data can considerably help improve performance in various biomedical relation extraction processes, for example, Drug-Target interaction and protein-protein interaction, particularly when only limited labeled data are available in such tasks. To our best knowledge, this is the first semi-supervised GANs-based method to predict binding affinity.",1,"GANsDTA: Predicting Drug-Target Binding Affinity Using GANs. The computational prediction of interactions between drugs and targets is a standing challenge in drug discovery. State-of-the-art methods for drug-target interaction prediction are primarily based on supervised machine learning with known label information. However, in biomedicine, obtaining labeled training data is an expensive and a laborious process. This paper proposes a semi-supervised generative adversarial networks (GANs)-based method to predict binding affinity. Our method comprises two parts, two GANs for feature extraction and a regression network for prediction. The semi-supervised mechanism allows our model to learn proteins drugs features of both labeled and unlabeled data. We evaluate the performance of our method using multiple public datasets. Experimental results demonstrate that our method achieves competitive performance while utilizing freely available unlabeled data. Our results suggest that utilizing such unlabeled data can considerably help improve performance in various biomedical relation extraction processes, for example, Drug-Target interaction and protein-protein interaction, particularly when only limited labeled data are available in such tasks. To our best knowledge, this is the first semi-supervised GANs-based method to predict binding affinity."
