Title,PMID,Abstract,Docking,text
Matrix factorization with denoising autoencoders for prediction of drug-target interactions.,35871213,"Drug-target interaction is crucial in the discovery of new drugs. Computational methods can be used to identify new drug-target interactions at low costs and with reasonable accuracy. Recent studies pay more attention to machine-learning methods, ranging from matrix factorization to deep learning, in the DTI prediction. Since the interaction matrix is often extremely sparse, DTI prediction performance is significantly decreased with matrix factorization-based methods. Therefore, some matrix factorization methods utilize side information to address both the sparsity issue of the interaction matrix and the cold-start issue. By combining matrix factorization and autoencoders, we propose a hybrid DTI prediction model that simultaneously learn the hidden factors of drugs and targets from their side information and interaction matrix. The proposed method is composed of two steps: the pre-processing of the interaction matrix, and the hybrid model. We leverage the similarity matrices of both drugs and targets to address the sparsity problem of the interaction matrix. The comparison of our approach against other algorithms on the same reference datasets has shown good results regarding area under receiver operating characteristic curve and the area under precision-recall curve. More specifically, experimental results achieve high accuracy on golden standard datasets (e.g., Nuclear Receptors, GPCRs, Ion Channels, and Enzymes) when performed with five repetitions of tenfold cross-validation. Display graphical of the hybrid model of Matrix Factorization with Denoising Autoencoders with the help side information of drugs and targets for Prediction of Drug-Target Interactions.",0,"Matrix factorization with denoising autoencoders for prediction of drug-target interactions. Drug-target interaction is crucial in the discovery of new drugs. Computational methods can be used to identify new drug-target interactions at low costs and with reasonable accuracy. Recent studies pay more attention to machine-learning methods, ranging from matrix factorization to deep learning, in the DTI prediction. Since the interaction matrix is often extremely sparse, DTI prediction performance is significantly decreased with matrix factorization-based methods. Therefore, some matrix factorization methods utilize side information to address both the sparsity issue of the interaction matrix and the cold-start issue. By combining matrix factorization and autoencoders, we propose a hybrid DTI prediction model that simultaneously learn the hidden factors of drugs and targets from their side information and interaction matrix. The proposed method is composed of two steps: the pre-processing of the interaction matrix, and the hybrid model. We leverage the similarity matrices of both drugs and targets to address the sparsity problem of the interaction matrix. The comparison of our approach against other algorithms on the same reference datasets has shown good results regarding area under receiver operating characteristic curve and the area under precision-recall curve. More specifically, experimental results achieve high accuracy on golden standard datasets (e.g., Nuclear Receptors, GPCRs, Ion Channels, and Enzymes) when performed with five repetitions of tenfold cross-validation. Display graphical of the hybrid model of Matrix Factorization with Denoising Autoencoders with the help side information of drugs and targets for Prediction of Drug-Target Interactions."
PPDTS: Predicting potential drug-target interactions based on network similarity.,34783172,"Identification of drug-target interactions (DTIs) has great practical importance in the drug discovery process for known diseases. However, only a small proportion of DTIs in these databases has been verified experimentally, and the computational methods for predicting the interactions remain challenging. As a result, some effective computational models have become increasingly popular for predicting DTIs. In this work, the authors predict potential DTIs from the local structure of drug-target associations' network, which is different from the traditional global network similarity methods based on structure and ligand. A novel method called PPDTS is proposed to predict DTIs. First, according to the DTIs' network local structure, the known DTIs are converted into a binary network. Second, the Resource Allocation algorithm is used to obtain a drug-drug similarity network and a target-target similarity network. Third, a Collaborative Filtering algorithm is used with the known drug-target topology information to obtain similarity scores. Fourth, the linear combination of drug-target similarity model and the target-drug similarity model are innovatively proposed to obtain the final prediction results. Finally, the experimental performance of PPDTS has proved to be higher than that of the previously mentioned four popular network-based similarity methods, which is validated in different experimental datasets. Some of the predicted results can be supported in UniProt and DrugBank databases.",0,"PPDTS: Predicting potential drug-target interactions based on network similarity. Identification of drug-target interactions (DTIs) has great practical importance in the drug discovery process for known diseases. However, only a small proportion of DTIs in these databases has been verified experimentally, and the computational methods for predicting the interactions remain challenging. As a result, some effective computational models have become increasingly popular for predicting DTIs. In this work, the authors predict potential DTIs from the local structure of drug-target associations' network, which is different from the traditional global network similarity methods based on structure and ligand. A novel method called PPDTS is proposed to predict DTIs. First, according to the DTIs' network local structure, the known DTIs are converted into a binary network. Second, the Resource Allocation algorithm is used to obtain a drug-drug similarity network and a target-target similarity network. Third, a Collaborative Filtering algorithm is used with the known drug-target topology information to obtain similarity scores. Fourth, the linear combination of drug-target similarity model and the target-drug similarity model are innovatively proposed to obtain the final prediction results. Finally, the experimental performance of PPDTS has proved to be higher than that of the previously mentioned four popular network-based similarity methods, which is validated in different experimental datasets. Some of the predicted results can be supported in UniProt and DrugBank databases."
Identifying potential drug-target interactions based on ensemble deep learning.,37396659,"Drug-target interaction prediction is one important step in drug research and development. Experimental methods are time consuming and laborious. In this study, we developed a novel DTI prediction method called EnGDD by combining initial feature acquisition, dimensional reduction, and DTI classification based on Gradient boosting neural network, Deep neural network, and Deep Forest. EnGDD was compared with seven stat-of-the-art DTI prediction methods (BLM-NII, NRLMF, WNNGIP, NEDTP, DTi2Vec, RoFDT, and MolTrans) on the nuclear receptor, GPCR, ion channel, and enzyme datasets under cross validations on drugs, targets, and drug-target pairs, respectively. EnGDD computed the best recall, accuracy, F1-score, AUC, and AUPR under the majority of conditions, demonstrating its powerful DTI identification performance. EnGDD predicted that D00182 and hsa2099, D07871 and hsa1813, DB00599 and hsa2562, D00002 and hsa10935 have a higher interaction probabilities among unknown drug-target pairs and may be potential DTIs on the four datasets, respectively. In particular, D00002 (Nadide) was identified to interact with hsa10935 (Mitochondrial peroxiredoxin3) whose up-regulation might be used to treat neurodegenerative diseases. Finally, EnGDD was used to find possible drug targets for Parkinson's disease and Alzheimer's disease after confirming its DTI identification performance. The results show that D01277, D04641, and D08969 may be applied to the treatment of Parkinson's disease through targeting hsa1813 (dopamine receptor D2) and D02173, D02558, and D03822 may be the clues of treatment for patients with Alzheimer's disease through targeting hsa5743 (prostaglandinendoperoxide synthase 2). The above prediction results need further biomedical validation. We anticipate that our proposed EnGDD model can help discover potential therapeutic clues for various diseases including neurodegenerative diseases.",0,"Identifying potential drug-target interactions based on ensemble deep learning. Drug-target interaction prediction is one important step in drug research and development. Experimental methods are time consuming and laborious. In this study, we developed a novel DTI prediction method called EnGDD by combining initial feature acquisition, dimensional reduction, and DTI classification based on Gradient boosting neural network, Deep neural network, and Deep Forest. EnGDD was compared with seven stat-of-the-art DTI prediction methods (BLM-NII, NRLMF, WNNGIP, NEDTP, DTi2Vec, RoFDT, and MolTrans) on the nuclear receptor, GPCR, ion channel, and enzyme datasets under cross validations on drugs, targets, and drug-target pairs, respectively. EnGDD computed the best recall, accuracy, F1-score, AUC, and AUPR under the majority of conditions, demonstrating its powerful DTI identification performance. EnGDD predicted that D00182 and hsa2099, D07871 and hsa1813, DB00599 and hsa2562, D00002 and hsa10935 have a higher interaction probabilities among unknown drug-target pairs and may be potential DTIs on the four datasets, respectively. In particular, D00002 (Nadide) was identified to interact with hsa10935 (Mitochondrial peroxiredoxin3) whose up-regulation might be used to treat neurodegenerative diseases. Finally, EnGDD was used to find possible drug targets for Parkinson's disease and Alzheimer's disease after confirming its DTI identification performance. The results show that D01277, D04641, and D08969 may be applied to the treatment of Parkinson's disease through targeting hsa1813 (dopamine receptor D2) and D02173, D02558, and D03822 may be the clues of treatment for patients with Alzheimer's disease through targeting hsa5743 (prostaglandinendoperoxide synthase 2). The above prediction results need further biomedical validation. We anticipate that our proposed EnGDD model can help discover potential therapeutic clues for various diseases including neurodegenerative diseases."
Mitigating cold-start problems in drug-target affinity prediction with interaction knowledge transferring.,35788823,"Predicting the drug-target interaction is crucial for drug discovery as well as drug repurposing. Machine learning is commonly used in drug-target affinity (DTA) problem. However, the machine learning model faces the cold-start problem where the model performance drops when predicting the interaction of a novel drug or target. Previous works try to solve the cold start problem by learning the drug or target representation using unsupervised learning. While the drug or target representation can be learned in an unsupervised manner, it still lacks the interaction information, which is critical in drug-target interaction. To incorporate the interaction information into the drug and protein interaction, we proposed using transfer learning from chemical-chemical interaction (CCI) and protein-protein interaction (PPI) task to drug-target interaction task. The representation learned by CCI and PPI tasks can be transferred smoothly to the DTA task due to the similar nature of the tasks. The result on the DTA datasets shows that our proposed method has advantages compared to other pre-training methods in the DTA task.",0,"Mitigating cold-start problems in drug-target affinity prediction with interaction knowledge transferring. Predicting the drug-target interaction is crucial for drug discovery as well as drug repurposing. Machine learning is commonly used in drug-target affinity (DTA) problem. However, the machine learning model faces the cold-start problem where the model performance drops when predicting the interaction of a novel drug or target. Previous works try to solve the cold start problem by learning the drug or target representation using unsupervised learning. While the drug or target representation can be learned in an unsupervised manner, it still lacks the interaction information, which is critical in drug-target interaction. To incorporate the interaction information into the drug and protein interaction, we proposed using transfer learning from chemical-chemical interaction (CCI) and protein-protein interaction (PPI) task to drug-target interaction task. The representation learned by CCI and PPI tasks can be transferred smoothly to the DTA task due to the similar nature of the tasks. The result on the DTA datasets shows that our proposed method has advantages compared to other pre-training methods in the DTA task."
DEDTI versus IEDTI: efficient and predictive models of drug-target interactions.,37286613,"Drug repurposing is an active area of research that aims to decrease the cost and time of drug development. Most of those efforts are primarily concerned with the prediction of drug-target interactions. Many evaluation models, from matrix factorization to more cutting-edge deep neural networks, have come to the scene to identify such relations. Some predictive models are devoted to the prediction's quality, and others are devoted to the efficiency of the predictive models, e.g., embedding generation. In this work, we propose new representations of drugs and targets useful for more prediction and analysis. Using these representations, we propose two inductive, deep network models of IEDTI and DEDTI for drug-target interaction prediction. Both of them use the accumulation of new representations. The IEDTI takes advantage of triplet and maps the input accumulated similarity features into meaningful embedding corresponding vectors. Then, it applies a deep predictive model to each drug-target pair to evaluate their interaction. The DEDTI directly uses the accumulated similarity feature vectors of drugs and targets and applies a predictive model on each pair to identify their interactions. We have done a comprehensive simulation on the DTINet dataset as well as gold standard datasets, and the results show that DEDTI outperforms IEDTI and the state-of-the-art models. In addition, we conduct a docking study on new predicted interactions between two drug-target pairs, and the results confirm acceptable drug-target binding affinity between both predicted pairs.",1,"DEDTI versus IEDTI: efficient and predictive models of drug-target interactions. Drug repurposing is an active area of research that aims to decrease the cost and time of drug development. Most of those efforts are primarily concerned with the prediction of drug-target interactions. Many evaluation models, from matrix factorization to more cutting-edge deep neural networks, have come to the scene to identify such relations. Some predictive models are devoted to the prediction's quality, and others are devoted to the efficiency of the predictive models, e.g., embedding generation. In this work, we propose new representations of drugs and targets useful for more prediction and analysis. Using these representations, we propose two inductive, deep network models of IEDTI and DEDTI for drug-target interaction prediction. Both of them use the accumulation of new representations. The IEDTI takes advantage of triplet and maps the input accumulated similarity features into meaningful embedding corresponding vectors. Then, it applies a deep predictive model to each drug-target pair to evaluate their interaction. The DEDTI directly uses the accumulated similarity feature vectors of drugs and targets and applies a predictive model on each pair to identify their interactions. We have done a comprehensive simulation on the DTINet dataset as well as gold standard datasets, and the results show that DEDTI outperforms IEDTI and the state-of-the-art models. In addition, we conduct a docking study on new predicted interactions between two drug-target pairs, and the results confirm acceptable drug-target binding affinity between both predicted pairs."
AttentionDTA: Drug-Target Binding Affinity Prediction by Sequence-Based Deep Learning With Attention Mechanism.,35471889,"The identification of drug-target relations (DTRs) is substantial in drug development. A large number of methods treat DTRs as drug-target interactions (DTIs), a binary classification problem. The main drawback of these methods are the lack of reliable negative samples and the absence of many important aspects of DTR, including their dose dependence and quantitative affinities. With increasing number of publications of drug-protein binding affinity data recently, DTRs prediction can be viewed as a regression problem of drug-target affinities (DTAs) which reflects how tightly the drug binds to the target and can present more detailed and specific information than DTIs. The growth of affinity data enables the use of deep learning architectures, which have been shown to be among the state-of-the-art methods in binding affinity prediction. Although relatively effective, due to the black-box nature of deep learning, these models are less biologically interpretable. In this study, we proposed a deep learning-based model, named AttentionDTA, which uses attention mechanism to predict DTAs. Different from the models using 3D structures of drug-target complexes or graph representation of drugs and proteins, the novelty of our work is to use attention mechanism to focus on key subsequences which are important in drug and protein sequences when predicting its affinity. We use two separate one-dimensional Convolution Neural Networks (1D-CNNs) to extract the semantic information of drug's SMILES string and protein's amino acid sequence. Furthermore, a two-side multi-head attention mechanism is developed and embedded to our model to explore the relationship between drug features and protein features. We evaluate our model on three established DTA benchmark datasets, Davis, Metz, and KIBA. AttentionDTA outperforms the state-of-the-art deep learning methods under different evaluation metrics. The results show that the attention-based model can effectively extract protein features related to drug information and drug features related to protein information to better predict drug target affinities. It is worth mentioning that we test our model on IC50 dataset, which provides the binding sites between drugs and proteins, to evaluate the ability of our model to locate binding sites. Finally, we visualize the attention weight to demonstrate the biological significance of the model. The source code of AttentionDTA can be downloaded from https://github.com/zhaoqichang/AttentionDTA_TCBB.",0,"AttentionDTA: Drug-Target Binding Affinity Prediction by Sequence-Based Deep Learning With Attention Mechanism. The identification of drug-target relations (DTRs) is substantial in drug development. A large number of methods treat DTRs as drug-target interactions (DTIs), a binary classification problem. The main drawback of these methods are the lack of reliable negative samples and the absence of many important aspects of DTR, including their dose dependence and quantitative affinities. With increasing number of publications of drug-protein binding affinity data recently, DTRs prediction can be viewed as a regression problem of drug-target affinities (DTAs) which reflects how tightly the drug binds to the target and can present more detailed and specific information than DTIs. The growth of affinity data enables the use of deep learning architectures, which have been shown to be among the state-of-the-art methods in binding affinity prediction. Although relatively effective, due to the black-box nature of deep learning, these models are less biologically interpretable. In this study, we proposed a deep learning-based model, named AttentionDTA, which uses attention mechanism to predict DTAs. Different from the models using 3D structures of drug-target complexes or graph representation of drugs and proteins, the novelty of our work is to use attention mechanism to focus on key subsequences which are important in drug and protein sequences when predicting its affinity. We use two separate one-dimensional Convolution Neural Networks (1D-CNNs) to extract the semantic information of drug's SMILES string and protein's amino acid sequence. Furthermore, a two-side multi-head attention mechanism is developed and embedded to our model to explore the relationship between drug features and protein features. We evaluate our model on three established DTA benchmark datasets, Davis, Metz, and KIBA. AttentionDTA outperforms the state-of-the-art deep learning methods under different evaluation metrics. The results show that the attention-based model can effectively extract protein features related to drug information and drug features related to protein information to better predict drug target affinities. It is worth mentioning that we test our model on IC50 dataset, which provides the binding sites between drugs and proteins, to evaluate the ability of our model to locate binding sites. Finally, we visualize the attention weight to demonstrate the biological significance of the model. The source code of AttentionDTA can be downloaded from https://github.com/zhaoqichang/AttentionDTA_TCBB."
Co-VAE: Drug-Target Binding Affinity Prediction by Co-Regularized Variational Autoencoders.,34652996,"Identifying drug-target interactions has been a key step in drug discovery. Many computational methods have been proposed to directly determine whether drugs and targets can interact or not. Drug-target binding affinity is another type of data which could show the strength of the binding interaction between a drug and a target. However, it is more challenging to predict drug-target binding affinity, and thus a very few studies follow this line. In our work, we propose a novel co-regularized variational autoencoders (Co-VAE) to predict drug-target binding affinity based on drug structures and target sequences. The Co-VAE model consists of two VAEs for generating drug SMILES strings and target sequences, respectively, and a co-regularization part for generating the binding affinities. We theoretically prove that the Co-VAE model is to maximize the lower bound of the joint likelihood of drug, protein and their affinity. The Co-VAE could predict drug-target affinity and generate new drugs which share similar targets with the input drugs. The experimental results on two datasets show that the Co-VAE could predict drug-target affinity better than existing affinity prediction methods such as DeepDTA and DeepAffinity, and could generate more new valid drugs than existing methods such as GAN and VAE.",0,"Co-VAE: Drug-Target Binding Affinity Prediction by Co-Regularized Variational Autoencoders. Identifying drug-target interactions has been a key step in drug discovery. Many computational methods have been proposed to directly determine whether drugs and targets can interact or not. Drug-target binding affinity is another type of data which could show the strength of the binding interaction between a drug and a target. However, it is more challenging to predict drug-target binding affinity, and thus a very few studies follow this line. In our work, we propose a novel co-regularized variational autoencoders (Co-VAE) to predict drug-target binding affinity based on drug structures and target sequences. The Co-VAE model consists of two VAEs for generating drug SMILES strings and target sequences, respectively, and a co-regularization part for generating the binding affinities. We theoretically prove that the Co-VAE model is to maximize the lower bound of the joint likelihood of drug, protein and their affinity. The Co-VAE could predict drug-target affinity and generate new drugs which share similar targets with the input drugs. The experimental results on two datasets show that the Co-VAE could predict drug-target affinity better than existing affinity prediction methods such as DeepDTA and DeepAffinity, and could generate more new valid drugs than existing methods such as GAN and VAE."
