Title,PMID,Abstract,Attention-based,text
GEFA: Early Fusion Approach in Drug-Target Affinity Prediction.,34197324,"Predicting the interaction between a compound and a target is crucial for rapid drug repurposing. Deep learning has been successfully applied in drug-target affinity (DTA)problem. However, previous deep learning-based methods ignore modeling the direct interactions between drug and protein residues. This would lead to inaccurate learning of target representation which may change due to the drug binding effects. In addition, previous DTA methods learn protein representation solely based on a small number of protein sequences in DTA datasets while neglecting the use of proteins outside of the DTA datasets. We propose GEFA (Graph Early Fusion Affinity), a novel graph-in-graph neural network with attention mechanism to address the changes in target representation because of the binding effects. Specifically, a drug is modeled as a graph of atoms, which then serves as a node in a larger graph of residues-drug complex. The resulting model is an expressive deep nested graph neural network. We also use pre-trained protein representation powered by the recent effort of learning contextualized protein representation. The experiments are conducted under different settings to evaluate scenarios such as novel drugs or targets. The results demonstrate the effectiveness of the pre-trained protein embedding and the advantages our GEFA in modeling the nested graph for drug-target interaction.",1,"GEFA: Early Fusion Approach in Drug-Target Affinity Prediction. Predicting the interaction between a compound and a target is crucial for rapid drug repurposing. Deep learning has been successfully applied in drug-target affinity (DTA)problem. However, previous deep learning-based methods ignore modeling the direct interactions between drug and protein residues. This would lead to inaccurate learning of target representation which may change due to the drug binding effects. In addition, previous DTA methods learn protein representation solely based on a small number of protein sequences in DTA datasets while neglecting the use of proteins outside of the DTA datasets. We propose GEFA (Graph Early Fusion Affinity), a novel graph-in-graph neural network with attention mechanism to address the changes in target representation because of the binding effects. Specifically, a drug is modeled as a graph of atoms, which then serves as a node in a larger graph of residues-drug complex. The resulting model is an expressive deep nested graph neural network. We also use pre-trained protein representation powered by the recent effort of learning contextualized protein representation. The experiments are conducted under different settings to evaluate scenarios such as novel drugs or targets. The results demonstrate the effectiveness of the pre-trained protein embedding and the advantages our GEFA in modeling the nested graph for drug-target interaction."
Pred-binding: large-scale protein-ligand binding affinity prediction.,26888050,"Drug target interactions (DTIs) are crucial in pharmacology and drug discovery. Presently, experimental determination of compound-protein interactions remains challenging because of funding investment and difficulties of purifying proteins. In this study, we proposed two in silico models based on support vector machine (SVM) and random forest (RF), using 1589 molecular descriptors and 1080 protein descriptors in 9948 ligand-protein pairs to predict DTIs that were quantified by Ki values. The cross-validation coefficient of determination of 0.6079 for SVM and 0.6267 for RF were obtained, respectively. In addition, the two-dimensional (2D) autocorrelation, topological charge indices and three-dimensional (3D)-MoRSE descriptors of compounds, the autocorrelation descriptors and the amphiphilic pseudo-amino acid composition of protein are found most important for Ki predictions. These models provide a new opportunity for the prediction of ligand-receptor interactions that will facilitate the target discovery and toxicity evaluation in drug development.",0,"Pred-binding: large-scale protein-ligand binding affinity prediction. Drug target interactions (DTIs) are crucial in pharmacology and drug discovery. Presently, experimental determination of compound-protein interactions remains challenging because of funding investment and difficulties of purifying proteins. In this study, we proposed two in silico models based on support vector machine (SVM) and random forest (RF), using 1589 molecular descriptors and 1080 protein descriptors in 9948 ligand-protein pairs to predict DTIs that were quantified by Ki values. The cross-validation coefficient of determination of 0.6079 for SVM and 0.6267 for RF were obtained, respectively. In addition, the two-dimensional (2D) autocorrelation, topological charge indices and three-dimensional (3D)-MoRSE descriptors of compounds, the autocorrelation descriptors and the amphiphilic pseudo-amino acid composition of protein are found most important for Ki predictions. These models provide a new opportunity for the prediction of ligand-receptor interactions that will facilitate the target discovery and toxicity evaluation in drug development."
BindingSite-AugmentedDTA: enabling a next-generation pipeline for interpretable prediction models in drug repurposing.,37096593,"While research into drug-target interaction (DTI) prediction is fairly mature, generalizability and interpretability are not always addressed in the existing works in this field. In this paper, we propose a deep learning (DL)-based framework, called BindingSite-AugmentedDTA, which improves drug-target affinity (DTA) predictions by reducing the search space of potential-binding sites of the protein, thus making the binding affinity prediction more efficient and accurate. Our BindingSite-AugmentedDTA is highly generalizable as it can be integrated with any DL-based regression model, while it significantly improves their prediction performance. Also, unlike many existing models, our model is highly interpretable due to its architecture and self-attention mechanism, which can provide a deeper understanding of its underlying prediction mechanism by mapping attention weights back to protein-binding sites. The computational results confirm that our framework can enhance the prediction performance of seven state-of-the-art DTA prediction algorithms in terms of four widely used evaluation metrics, including concordance index, mean squared error, modified squared correlation coefficient ($r^2_m$) and the area under the precision curve. We also contribute to three benchmark drug-traget interaction datasets by including additional information on 3D structure of all proteins contained in those datasets, which include the two most commonly used datasets, namely Kiba and Davis, as well as the data from IDG-DREAM drug-kinase binding prediction challenge. Furthermore, we experimentally validate the practical potential of our proposed framework through in-lab experiments. The relatively high agreement between computationally predicted and experimentally observed binding interactions supports the potential of our framework as the next-generation pipeline for prediction models in drug repurposing.",1,"BindingSite-AugmentedDTA: enabling a next-generation pipeline for interpretable prediction models in drug repurposing. While research into drug-target interaction (DTI) prediction is fairly mature, generalizability and interpretability are not always addressed in the existing works in this field. In this paper, we propose a deep learning (DL)-based framework, called BindingSite-AugmentedDTA, which improves drug-target affinity (DTA) predictions by reducing the search space of potential-binding sites of the protein, thus making the binding affinity prediction more efficient and accurate. Our BindingSite-AugmentedDTA is highly generalizable as it can be integrated with any DL-based regression model, while it significantly improves their prediction performance. Also, unlike many existing models, our model is highly interpretable due to its architecture and self-attention mechanism, which can provide a deeper understanding of its underlying prediction mechanism by mapping attention weights back to protein-binding sites. The computational results confirm that our framework can enhance the prediction performance of seven state-of-the-art DTA prediction algorithms in terms of four widely used evaluation metrics, including concordance index, mean squared error, modified squared correlation coefficient ($r^2_m$) and the area under the precision curve. We also contribute to three benchmark drug-traget interaction datasets by including additional information on 3D structure of all proteins contained in those datasets, which include the two most commonly used datasets, namely Kiba and Davis, as well as the data from IDG-DREAM drug-kinase binding prediction challenge. Furthermore, we experimentally validate the practical potential of our proposed framework through in-lab experiments. The relatively high agreement between computationally predicted and experimentally observed binding interactions supports the potential of our framework as the next-generation pipeline for prediction models in drug repurposing."
Uncovering New Drug Properties in Target-Based Drug-Drug Similarity Networks.,32947845,"Despite recent advances in bioinformatics, systems biology, and machine learning, the accurate prediction of drug properties remains an open problem. Indeed, because the biological environment is a complex system, the traditional approach-based on knowledge about the chemical structures-can not fully explain the nature of interactions between drugs and biological targets. Consequently, in this paper, we propose an unsupervised machine learning approach that uses the information we know about drug-target interactions to infer drug properties. To this end, we define drug similarity based on drug-target interactions and build a weighted Drug-Drug Similarity Network according to the drug-drug similarity relationships. Using an energy-model network layout, we generate drug communities associated with specific, dominant drug properties. DrugBank confirms the properties of 59.52% of the drugs in these communities, and 26.98% are existing drug repositioning hints we reconstruct with our DDSN approach. The remaining 13.49% of the drugs seem not to match the dominant pharmacologic property; thus, we consider them potential drug repurposing hints. The resources required to test all these repurposing hints are considerable. Therefore we introduce a mechanism of prioritization based on the betweenness/degree node centrality. Using betweenness/degree as an indicator of drug repurposing potential, we select Azelaic acid and Meprobamate as a possible antineoplastic and antifungal, respectively. Finally, we use a test procedure based on molecular docking to analyze Azelaic acid and Meprobamate's repurposing.",0,"Uncovering New Drug Properties in Target-Based Drug-Drug Similarity Networks. Despite recent advances in bioinformatics, systems biology, and machine learning, the accurate prediction of drug properties remains an open problem. Indeed, because the biological environment is a complex system, the traditional approach-based on knowledge about the chemical structures-can not fully explain the nature of interactions between drugs and biological targets. Consequently, in this paper, we propose an unsupervised machine learning approach that uses the information we know about drug-target interactions to infer drug properties. To this end, we define drug similarity based on drug-target interactions and build a weighted Drug-Drug Similarity Network according to the drug-drug similarity relationships. Using an energy-model network layout, we generate drug communities associated with specific, dominant drug properties. DrugBank confirms the properties of 59.52% of the drugs in these communities, and 26.98% are existing drug repositioning hints we reconstruct with our DDSN approach. The remaining 13.49% of the drugs seem not to match the dominant pharmacologic property; thus, we consider them potential drug repurposing hints. The resources required to test all these repurposing hints are considerable. Therefore we introduce a mechanism of prioritization based on the betweenness/degree node centrality. Using betweenness/degree as an indicator of drug repurposing potential, we select Azelaic acid and Meprobamate as a possible antineoplastic and antifungal, respectively. Finally, we use a test procedure based on molecular docking to analyze Azelaic acid and Meprobamate's repurposing."
MultiscaleDTA: A multiscale-based method with a self-attention mechanism for drug-target binding affinity prediction.,36155250,"The task of predicting drug-target affinity (DTA) plays an increasingly important role in the early stage of in silico drug discovery and development. Currently, a variety of machine learning-based methods have been presented for DTA prediction and achieved outstanding performance, which is beneficial for speeding up the development of new drugs. However, most convolutional neural networks (CNNs) based methods ignore the significance of information from CNN layers with different scales for DTA prediction. In addition, each feature provides different contributions to the final task. Therefore, in this study, we propose a novel end-to-end deep learning-based framework, MultiscaleDTA, to predict drug-target binding affinity. MultiscaleDTA incorporates multi-scale CNNs and a self-attention mechanism to capture multi-scale and comprehensive features for characterizing the intrinsic properties of drugs and targets. Extensive experimental results on both regression and binary classification tasks demonstrate that MultiscaleDTA achieves competitive performance compared to state-of-the-art methods.",1,"MultiscaleDTA: A multiscale-based method with a self-attention mechanism for drug-target binding affinity prediction. The task of predicting drug-target affinity (DTA) plays an increasingly important role in the early stage of in silico drug discovery and development. Currently, a variety of machine learning-based methods have been presented for DTA prediction and achieved outstanding performance, which is beneficial for speeding up the development of new drugs. However, most convolutional neural networks (CNNs) based methods ignore the significance of information from CNN layers with different scales for DTA prediction. In addition, each feature provides different contributions to the final task. Therefore, in this study, we propose a novel end-to-end deep learning-based framework, MultiscaleDTA, to predict drug-target binding affinity. MultiscaleDTA incorporates multi-scale CNNs and a self-attention mechanism to capture multi-scale and comprehensive features for characterizing the intrinsic properties of drugs and targets. Extensive experimental results on both regression and binary classification tasks demonstrate that MultiscaleDTA achieves competitive performance compared to state-of-the-art methods."
Protein-ligand binding affinity prediction with edge awareness and supervised attention.,36691617,"Accurate prediction of protein-ligand binding affinity is crucial in structure-based drug design but remains some challenges even with recent advances in deep learning: (1) Existing methods neglect the edge information in protein and ligand structure data; (2) current attention mechanisms struggle to capture true binding interactions in the small dataset. Herein, we proposed SEGSA_DTA, a SuperEdge Graph convolution-based and Supervised Attention-based Drug-Target Affinity prediction method, where the super edge graph convolution can comprehensively utilize node and edge information and the multi-supervised attention module can efficiently learn the attention distribution consistent with real protein-ligand interactions. Results on the multiple datasets show that SEGSA_DTA outperforms current state-of-the-art methods. We also applied SEGSA_DTA in repurposing FDA-approved drugs to identify potential coronavirus disease 2019 (COVID-19) treatments. Besides, by using SHapley Additive exPlanations (SHAP), we found that SEGSA_DTA is interpretable and further provides a new quantitative analytical solution for structure-based lead optimization.",1,"Protein-ligand binding affinity prediction with edge awareness and supervised attention. Accurate prediction of protein-ligand binding affinity is crucial in structure-based drug design but remains some challenges even with recent advances in deep learning: (1) Existing methods neglect the edge information in protein and ligand structure data; (2) current attention mechanisms struggle to capture true binding interactions in the small dataset. Herein, we proposed SEGSA_DTA, a SuperEdge Graph convolution-based and Supervised Attention-based Drug-Target Affinity prediction method, where the super edge graph convolution can comprehensively utilize node and edge information and the multi-supervised attention module can efficiently learn the attention distribution consistent with real protein-ligand interactions. Results on the multiple datasets show that SEGSA_DTA outperforms current state-of-the-art methods. We also applied SEGSA_DTA in repurposing FDA-approved drugs to identify potential coronavirus disease 2019 (COVID-19) treatments. Besides, by using SHapley Additive exPlanations (SHAP), we found that SEGSA_DTA is interpretable and further provides a new quantitative analytical solution for structure-based lead optimization."
PPDTS: Predicting potential drug-target interactions based on network similarity.,34783172,"Identification of drug-target interactions (DTIs) has great practical importance in the drug discovery process for known diseases. However, only a small proportion of DTIs in these databases has been verified experimentally, and the computational methods for predicting the interactions remain challenging. As a result, some effective computational models have become increasingly popular for predicting DTIs. In this work, the authors predict potential DTIs from the local structure of drug-target associations' network, which is different from the traditional global network similarity methods based on structure and ligand. A novel method called PPDTS is proposed to predict DTIs. First, according to the DTIs' network local structure, the known DTIs are converted into a binary network. Second, the Resource Allocation algorithm is used to obtain a drug-drug similarity network and a target-target similarity network. Third, a Collaborative Filtering algorithm is used with the known drug-target topology information to obtain similarity scores. Fourth, the linear combination of drug-target similarity model and the target-drug similarity model are innovatively proposed to obtain the final prediction results. Finally, the experimental performance of PPDTS has proved to be higher than that of the previously mentioned four popular network-based similarity methods, which is validated in different experimental datasets. Some of the predicted results can be supported in UniProt and DrugBank databases.",0,"PPDTS: Predicting potential drug-target interactions based on network similarity. Identification of drug-target interactions (DTIs) has great practical importance in the drug discovery process for known diseases. However, only a small proportion of DTIs in these databases has been verified experimentally, and the computational methods for predicting the interactions remain challenging. As a result, some effective computational models have become increasingly popular for predicting DTIs. In this work, the authors predict potential DTIs from the local structure of drug-target associations' network, which is different from the traditional global network similarity methods based on structure and ligand. A novel method called PPDTS is proposed to predict DTIs. First, according to the DTIs' network local structure, the known DTIs are converted into a binary network. Second, the Resource Allocation algorithm is used to obtain a drug-drug similarity network and a target-target similarity network. Third, a Collaborative Filtering algorithm is used with the known drug-target topology information to obtain similarity scores. Fourth, the linear combination of drug-target similarity model and the target-drug similarity model are innovatively proposed to obtain the final prediction results. Finally, the experimental performance of PPDTS has proved to be higher than that of the previously mentioned four popular network-based similarity methods, which is validated in different experimental datasets. Some of the predicted results can be supported in UniProt and DrugBank databases."
Identifying drug-target interactions based on graph convolutional network and deep neural network.,32367110,"Identification of new drug-target interactions (DTIs) is an important but a time-consuming and costly step in drug discovery. In recent years, to mitigate these drawbacks, researchers have sought to identify DTIs using computational approaches. However, most existing methods construct drug networks and target networks separately, and then predict novel DTIs based on known associations between the drugs and targets without accounting for associations between drug-protein pairs (DPPs). To incorporate the associations between DPPs into DTI modeling, we built a DPP network based on multiple drugs and proteins in which DPPs are the nodes and the associations between DPPs are the edges of the network. We then propose a novel learning-based framework, 'graph convolutional network (GCN)-DTI', for DTI identification. The model first uses a graph convolutional network to learn the features for each DPP. Second, using the feature representation as an input, it uses a deep neural network to predict the final label. The results of our analysis show that the proposed framework outperforms some state-of-the-art approaches by a large margin.",0,"Identifying drug-target interactions based on graph convolutional network and deep neural network. Identification of new drug-target interactions (DTIs) is an important but a time-consuming and costly step in drug discovery. In recent years, to mitigate these drawbacks, researchers have sought to identify DTIs using computational approaches. However, most existing methods construct drug networks and target networks separately, and then predict novel DTIs based on known associations between the drugs and targets without accounting for associations between drug-protein pairs (DPPs). To incorporate the associations between DPPs into DTI modeling, we built a DPP network based on multiple drugs and proteins in which DPPs are the nodes and the associations between DPPs are the edges of the network. We then propose a novel learning-based framework, 'graph convolutional network (GCN)-DTI', for DTI identification. The model first uses a graph convolutional network to learn the features for each DPP. Second, using the feature representation as an input, it uses a deep neural network to predict the final label. The results of our analysis show that the proposed framework outperforms some state-of-the-art approaches by a large margin."
CSatDTA: Prediction of Drug-Target Binding Affinity Using Convolution Model with Self-Attention.,35955587,"Drug discovery, which aids to identify potential novel treatments, entails a broad range of fields of science, including chemistry, pharmacology, and biology. In the early stages of drug development, predicting drug-target affinity is crucial. The proposed model, the prediction of drug-target affinity using a convolution model with self-attention (CSatDTA), applies convolution-based self-attention mechanisms to the molecular drug and target sequences to predict drug-target affinity (DTA) effectively, unlike previous convolution methods, which exhibit significant limitations related to this aspect. The convolutional neural network (CNN) only works on a particular region of information, excluding comprehensive details. Self-attention, on the other hand, is a relatively recent technique for capturing long-range interactions that has been used primarily in sequence modeling tasks. The results of comparative experiments show that CSatDTA surpasses previous sequence-based or other approaches and has outstanding retention abilities.",1,"CSatDTA: Prediction of Drug-Target Binding Affinity Using Convolution Model with Self-Attention. Drug discovery, which aids to identify potential novel treatments, entails a broad range of fields of science, including chemistry, pharmacology, and biology. In the early stages of drug development, predicting drug-target affinity is crucial. The proposed model, the prediction of drug-target affinity using a convolution model with self-attention (CSatDTA), applies convolution-based self-attention mechanisms to the molecular drug and target sequences to predict drug-target affinity (DTA) effectively, unlike previous convolution methods, which exhibit significant limitations related to this aspect. The convolutional neural network (CNN) only works on a particular region of information, excluding comprehensive details. Self-attention, on the other hand, is a relatively recent technique for capturing long-range interactions that has been used primarily in sequence modeling tasks. The results of comparative experiments show that CSatDTA surpasses previous sequence-based or other approaches and has outstanding retention abilities."
