Title,PMID,Abstract,Regression,text
Fine-grained selective similarity integration for drug-target interaction prediction.,36907663,"The discovery of drug-target interactions (DTIs) is a pivotal process in pharmaceutical development. Computational approaches are a promising and efficient alternative to tedious and costly wet-lab experiments for predicting novel DTIs from numerous candidates. Recently, with the availability of abundant heterogeneous biological information from diverse data sources, computational methods have been able to leverage multiple drug and target similarities to boost the performance of DTI prediction. Similarity integration is an effective and flexible strategy to extract crucial information across complementary similarity views, providing a compressed input for any similarity-based DTI prediction model. However, existing similarity integration methods filter and fuse similarities from a global perspective, neglecting the utility of similarity views for each drug and target. In this study, we propose a Fine-Grained Selective similarity integration approach, called FGS, which employs a local interaction consistency-based weight matrix to capture and exploit the importance of similarities at a finer granularity in both similarity selection and combination steps. We evaluate FGS on five DTI prediction datasets under various prediction settings. Experimental results show that our method not only outperforms similarity integration competitors with comparable computational costs, but also achieves better prediction performance than state-of-the-art DTI prediction approaches by collaborating with conventional base models. Furthermore, case studies on the analysis of similarity weights and on the verification of novel predictions confirm the practical ability of FGS.",0,"Fine-grained selective similarity integration for drug-target interaction prediction. The discovery of drug-target interactions (DTIs) is a pivotal process in pharmaceutical development. Computational approaches are a promising and efficient alternative to tedious and costly wet-lab experiments for predicting novel DTIs from numerous candidates. Recently, with the availability of abundant heterogeneous biological information from diverse data sources, computational methods have been able to leverage multiple drug and target similarities to boost the performance of DTI prediction. Similarity integration is an effective and flexible strategy to extract crucial information across complementary similarity views, providing a compressed input for any similarity-based DTI prediction model. However, existing similarity integration methods filter and fuse similarities from a global perspective, neglecting the utility of similarity views for each drug and target. In this study, we propose a Fine-Grained Selective similarity integration approach, called FGS, which employs a local interaction consistency-based weight matrix to capture and exploit the importance of similarities at a finer granularity in both similarity selection and combination steps. We evaluate FGS on five DTI prediction datasets under various prediction settings. Experimental results show that our method not only outperforms similarity integration competitors with comparable computational costs, but also achieves better prediction performance than state-of-the-art DTI prediction approaches by collaborating with conventional base models. Furthermore, case studies on the analysis of similarity weights and on the verification of novel predictions confirm the practical ability of FGS."
GraphDTA: predicting drug-target binding affinity with graph neural networks.,33119053,"The development of new drugs is costly, time consuming and often accompanied with safety issues. Drug repurposing can avoid the expensive and lengthy process of drug development by finding new uses for already approved drugs. In order to repurpose drugs effectively, it is useful to know which proteins are targeted by which drugs. Computational models that estimate the interaction strength of new drug-target pairs have the potential to expedite drug repurposing. Several models have been proposed for this task. However, these models represent the drugs as strings, which is not a natural way to represent molecules. We propose a new model called GraphDTA that represents drugs as graphs and uses graph neural networks to predict drug-target affinity. We show that graph neural networks not only predict drug-target affinity better than non-deep learning models, but also outperform competing deep learning methods. Our results confirm that deep learning models are appropriate for drug-target binding affinity prediction, and that representing drugs as graphs can lead to further improvements. The proposed models are implemented in Python. Related data, pre-trained models and source code are publicly available at https://github.com/thinng/GraphDTA. All scripts and data needed to reproduce the post hoc statistical analysis are available from https://doi.org/10.5281/zenodo.3603523. Supplementary data are available at Bioinformatics online.",1,"GraphDTA: predicting drug-target binding affinity with graph neural networks. The development of new drugs is costly, time consuming and often accompanied with safety issues. Drug repurposing can avoid the expensive and lengthy process of drug development by finding new uses for already approved drugs. In order to repurpose drugs effectively, it is useful to know which proteins are targeted by which drugs. Computational models that estimate the interaction strength of new drug-target pairs have the potential to expedite drug repurposing. Several models have been proposed for this task. However, these models represent the drugs as strings, which is not a natural way to represent molecules. We propose a new model called GraphDTA that represents drugs as graphs and uses graph neural networks to predict drug-target affinity. We show that graph neural networks not only predict drug-target affinity better than non-deep learning models, but also outperform competing deep learning methods. Our results confirm that deep learning models are appropriate for drug-target binding affinity prediction, and that representing drugs as graphs can lead to further improvements. The proposed models are implemented in Python. Related data, pre-trained models and source code are publicly available at https://github.com/thinng/GraphDTA. All scripts and data needed to reproduce the post hoc statistical analysis are available from https://doi.org/10.5281/zenodo.3603523. Supplementary data are available at Bioinformatics online."
MOKPE: drug-target interaction prediction via manifold optimization based kernel preserving embedding.,37407927,"In many applications of bioinformatics, data stem from distinct heterogeneous sources. One of the well-known examples is the identification of drug-target interactions (DTIs), which is of significant importance in drug discovery. In this paper, we propose a novel framework, manifold optimization based kernel preserving embedding (MOKPE), to efficiently solve the problem of modeling heterogeneous data. Our model projects heterogeneous drug and target data into a unified embedding space by preserving drug-target interactions and drug-drug, target-target similarities simultaneously. We performed ten replications of ten-fold cross validation on four different drug-target interaction network data sets for predicting DTIs for previously unseen drugs. The classification evaluation metrics showed better or comparable performance compared to previous similarity-based state-of-the-art methods. We also evaluated MOKPE on predicting unknown DTIs of a given network. Our implementation of the proposed algorithm in R together with the scripts that replicate the reported experiments is publicly available at https://github.com/ocbinatli/mokpe .",0,"MOKPE: drug-target interaction prediction via manifold optimization based kernel preserving embedding. In many applications of bioinformatics, data stem from distinct heterogeneous sources. One of the well-known examples is the identification of drug-target interactions (DTIs), which is of significant importance in drug discovery. In this paper, we propose a novel framework, manifold optimization based kernel preserving embedding (MOKPE), to efficiently solve the problem of modeling heterogeneous data. Our model projects heterogeneous drug and target data into a unified embedding space by preserving drug-target interactions and drug-drug, target-target similarities simultaneously. We performed ten replications of ten-fold cross validation on four different drug-target interaction network data sets for predicting DTIs for previously unseen drugs. The classification evaluation metrics showed better or comparable performance compared to previous similarity-based state-of-the-art methods. We also evaluated MOKPE on predicting unknown DTIs of a given network. Our implementation of the proposed algorithm in R together with the scripts that replicate the reported experiments is publicly available at https://github.com/ocbinatli/mokpe ."
Multimodal contrastive representation learning for drug-target binding affinity prediction.,37952703,"In the biomedical field, the efficacy of most drugs is demonstrated by their interactions with targets, meanwhile, accurate prediction of the strength of drug-target binding is extremely important for drug development efforts. Traditional bioassay-based drug-target binding affinity (DTA) prediction methods cannot meet the needs of drug R&D in the era of big data. Recent years we have witnessed significant success on deep learning-based models for drug-target binding affinity prediction task. However, these models only considered a single modality of drug and target information, and some valuable information was not fully utilized. In fact, the information of different modalities of drug and target can complement each other, and more valuable information can be obtained by fusing the information of different modalities. In this paper, we introduce a multimodal information fusion model for DTA prediction that is called FMDTA, which fully considers drug/target information in both string and graph modalities and balances the feature representations of different modalities by a contrastive learning approach. In addition, we exploited the alignment information of drug atoms and target residues to capture the positional information of string patterns, which can extract more useful feature information in SMILES and target sequences. Experimental results on two benchmark datasets show that FMDTA outperforms the state-of-the-art model, demonstrating the feasibility and excellent feature capture capability of FMDTA. The code of FMDTA and the data are available at: https://github.com/bestdoubleLin/FMDTA.",1,"Multimodal contrastive representation learning for drug-target binding affinity prediction. In the biomedical field, the efficacy of most drugs is demonstrated by their interactions with targets, meanwhile, accurate prediction of the strength of drug-target binding is extremely important for drug development efforts. Traditional bioassay-based drug-target binding affinity (DTA) prediction methods cannot meet the needs of drug R&D in the era of big data. Recent years we have witnessed significant success on deep learning-based models for drug-target binding affinity prediction task. However, these models only considered a single modality of drug and target information, and some valuable information was not fully utilized. In fact, the information of different modalities of drug and target can complement each other, and more valuable information can be obtained by fusing the information of different modalities. In this paper, we introduce a multimodal information fusion model for DTA prediction that is called FMDTA, which fully considers drug/target information in both string and graph modalities and balances the feature representations of different modalities by a contrastive learning approach. In addition, we exploited the alignment information of drug atoms and target residues to capture the positional information of string patterns, which can extract more useful feature information in SMILES and target sequences. Experimental results on two benchmark datasets show that FMDTA outperforms the state-of-the-art model, demonstrating the feasibility and excellent feature capture capability of FMDTA. The code of FMDTA and the data are available at: https://github.com/bestdoubleLin/FMDTA."
Predicting affinity through homology (PATH): interpretable binding affinity prediction with persistent homology,38014181,"Accurate binding affinity prediction is crucial to structure-based drug design. Recent work used computational topology to obtain an effective representation of protein-ligand interactions. Although persistent homology encodes geometric features, previous works on binding affinity prediction using persistent homology employed uninterpretable machine learning models and failed to explain the underlying geometric and topological features that drive accurate binding affinity prediction. In this work, we propose a novel, interpretable algorithm for protein-ligand binding affinity prediction. Our algorithm achieves interpretability through an effective embedding of distances across bipartite matchings of the protein and ligand atoms into real-valued functions by summing Gaussians centered at features constructed by persistent homology. We name these functions <i>internuclear persistent contours (IPCs)</i> . Next, we introduce <i>persistence fingerprints</i> , a vector with 10 components that sketches the distances of different bipartite matching between protein and ligand atoms, refined from IPCs. Let the number of protein atoms in the protein-ligand complex be <i>n</i> , number of ligand atoms be <i>m</i> , and <i>ω</i> ≈ 2.4 be the matrix multiplication exponent. We show that for any 0 < <i>ε</i> < 1, after an 𝒪 ( <i>mn</i> log( <i>mn</i> )) preprocessing procedure, we can compute an <i>ε</i> -accurate approximation to the persistence fingerprint in 𝒪 ( <i>m</i> log <sup>6 <i>ω</i></sup> ( <i>m/""</i> )) time, independent of protein size. This is an improvement in time complexity by a factor of 𝒪 (( <i>m</i> + <i>n</i> ) <sup>3</sup> ) over any previous binding affinity prediction that uses persistent homology. We show that the representational power of persistence fingerprint generalizes to protein-ligand binding datasets beyond the training dataset. Then, we introduce <i>PATH</i> , Predicting Affinity Through Homology, an interpretable, small ensemble of shallow regression trees for binding affinity prediction from persistence fingerprints. We show that despite using 1,400-fold fewer features, PATH has comparable performance to a previous state-of-the-art binding affinity prediction algorithm that uses persistent homology features. Moreover, PATH has the advantage of being interpretable. Finally, we visualize the features captured by persistence fingerprint for variant HIV-1 protease complexes and show that persistence fingerprint captures binding-relevant structural mutations. The source code for PATH is released open-source as part of the osprey protein design software package.",1,"Predicting affinity through homology (PATH): interpretable binding affinity prediction with persistent homology Accurate binding affinity prediction is crucial to structure-based drug design. Recent work used computational topology to obtain an effective representation of protein-ligand interactions. Although persistent homology encodes geometric features, previous works on binding affinity prediction using persistent homology employed uninterpretable machine learning models and failed to explain the underlying geometric and topological features that drive accurate binding affinity prediction. In this work, we propose a novel, interpretable algorithm for protein-ligand binding affinity prediction. Our algorithm achieves interpretability through an effective embedding of distances across bipartite matchings of the protein and ligand atoms into real-valued functions by summing Gaussians centered at features constructed by persistent homology. We name these functions <i>internuclear persistent contours (IPCs)</i> . Next, we introduce <i>persistence fingerprints</i> , a vector with 10 components that sketches the distances of different bipartite matching between protein and ligand atoms, refined from IPCs. Let the number of protein atoms in the protein-ligand complex be <i>n</i> , number of ligand atoms be <i>m</i> , and <i>ω</i> ≈ 2.4 be the matrix multiplication exponent. We show that for any 0 < <i>ε</i> < 1, after an 𝒪 ( <i>mn</i> log( <i>mn</i> )) preprocessing procedure, we can compute an <i>ε</i> -accurate approximation to the persistence fingerprint in 𝒪 ( <i>m</i> log <sup>6 <i>ω</i></sup> ( <i>m/""</i> )) time, independent of protein size. This is an improvement in time complexity by a factor of 𝒪 (( <i>m</i> + <i>n</i> ) <sup>3</sup> ) over any previous binding affinity prediction that uses persistent homology. We show that the representational power of persistence fingerprint generalizes to protein-ligand binding datasets beyond the training dataset. Then, we introduce <i>PATH</i> , Predicting Affinity Through Homology, an interpretable, small ensemble of shallow regression trees for binding affinity prediction from persistence fingerprints. We show that despite using 1,400-fold fewer features, PATH has comparable performance to a previous state-of-the-art binding affinity prediction algorithm that uses persistent homology features. Moreover, PATH has the advantage of being interpretable. Finally, we visualize the features captured by persistence fingerprint for variant HIV-1 protease complexes and show that persistence fingerprint captures binding-relevant structural mutations. The source code for PATH is released open-source as part of the osprey protein design software package."
Identification of a minimum number of genes to predict triple-negative breast cancer subgroups from gene expression profiles.,36536459,"Triple-negative breast cancer (TNBC) is a very heterogeneous disease. Several gene expression and mutation profiling approaches were used to classify it, and all converged to the identification of distinct molecular subtypes, with some overlapping across different approaches. However, a standardised tool to routinely classify TNBC in the clinics and guide personalised treatment is lacking. We aimed at defining a specific gene signature for each of the six TNBC subtypes proposed by Lehman et al. in 2011 (basal-like 1 (BL1); basal-like 2 (BL2); mesenchymal (M); immunomodulatory (IM); mesenchymal stem-like (MSL); and luminal androgen receptor (LAR)), to be able to accurately predict them. Lehman's TNBCtype subtyping tool was applied to RNA-sequencing data from 482 TNBC (GSE164458), and a minimal subtype-specific gene signature was defined by combining two class comparison techniques with seven attribute selection methods. Several machine learning algorithms for subtype prediction were used, and the best classifier was applied on microarray data from 72 Italian TNBC and on the TNBC subset of the BRCA-TCGA data set. We identified two signatures with the 120 and 81 top up- and downregulated genes that define the six TNBC subtypes, with prediction accuracy ranging from 88.6 to 89.4%, and even improving after removal of the least important genes. Network analysis was used to identify highly interconnected genes within each subgroup. Two druggable matrix metalloproteinases were found in the BL1 and BL2 subsets, and several druggable targets were complementary to androgen receptor or aromatase in the LAR subset. Several secondary drug-target interactions were found among the upregulated genes in the M, IM and MSL subsets. Our study took full advantage of available TNBC data sets to stratify samples and genes into distinct subtypes, according to gene expression profiles. The development of a data mining approach to acquire a large amount of information from several data sets has allowed us to identify a well-determined minimal number of genes that may help in the recognition of TNBC subtypes. These genes, most of which have been previously found to be associated with breast cancer, have the potential to become novel diagnostic markers and/or therapeutic targets for specific TNBC subsets.",0,"Identification of a minimum number of genes to predict triple-negative breast cancer subgroups from gene expression profiles. Triple-negative breast cancer (TNBC) is a very heterogeneous disease. Several gene expression and mutation profiling approaches were used to classify it, and all converged to the identification of distinct molecular subtypes, with some overlapping across different approaches. However, a standardised tool to routinely classify TNBC in the clinics and guide personalised treatment is lacking. We aimed at defining a specific gene signature for each of the six TNBC subtypes proposed by Lehman et al. in 2011 (basal-like 1 (BL1); basal-like 2 (BL2); mesenchymal (M); immunomodulatory (IM); mesenchymal stem-like (MSL); and luminal androgen receptor (LAR)), to be able to accurately predict them. Lehman's TNBCtype subtyping tool was applied to RNA-sequencing data from 482 TNBC (GSE164458), and a minimal subtype-specific gene signature was defined by combining two class comparison techniques with seven attribute selection methods. Several machine learning algorithms for subtype prediction were used, and the best classifier was applied on microarray data from 72 Italian TNBC and on the TNBC subset of the BRCA-TCGA data set. We identified two signatures with the 120 and 81 top up- and downregulated genes that define the six TNBC subtypes, with prediction accuracy ranging from 88.6 to 89.4%, and even improving after removal of the least important genes. Network analysis was used to identify highly interconnected genes within each subgroup. Two druggable matrix metalloproteinases were found in the BL1 and BL2 subsets, and several druggable targets were complementary to androgen receptor or aromatase in the LAR subset. Several secondary drug-target interactions were found among the upregulated genes in the M, IM and MSL subsets. Our study took full advantage of available TNBC data sets to stratify samples and genes into distinct subtypes, according to gene expression profiles. The development of a data mining approach to acquire a large amount of information from several data sets has allowed us to identify a well-determined minimal number of genes that may help in the recognition of TNBC subtypes. These genes, most of which have been previously found to be associated with breast cancer, have the potential to become novel diagnostic markers and/or therapeutic targets for specific TNBC subsets."
