Title,PMID,Abstract,Docking,text
Uncovering New Drug Properties in Target-Based Drug-Drug Similarity Networks.,32947845,"Despite recent advances in bioinformatics, systems biology, and machine learning, the accurate prediction of drug properties remains an open problem. Indeed, because the biological environment is a complex system, the traditional approach-based on knowledge about the chemical structures-can not fully explain the nature of interactions between drugs and biological targets. Consequently, in this paper, we propose an unsupervised machine learning approach that uses the information we know about drug-target interactions to infer drug properties. To this end, we define drug similarity based on drug-target interactions and build a weighted Drug-Drug Similarity Network according to the drug-drug similarity relationships. Using an energy-model network layout, we generate drug communities associated with specific, dominant drug properties. DrugBank confirms the properties of 59.52% of the drugs in these communities, and 26.98% are existing drug repositioning hints we reconstruct with our DDSN approach. The remaining 13.49% of the drugs seem not to match the dominant pharmacologic property; thus, we consider them potential drug repurposing hints. The resources required to test all these repurposing hints are considerable. Therefore we introduce a mechanism of prioritization based on the betweenness/degree node centrality. Using betweenness/degree as an indicator of drug repurposing potential, we select Azelaic acid and Meprobamate as a possible antineoplastic and antifungal, respectively. Finally, we use a test procedure based on molecular docking to analyze Azelaic acid and Meprobamate's repurposing.",1,"Uncovering New Drug Properties in Target-Based Drug-Drug Similarity Networks. Despite recent advances in bioinformatics, systems biology, and machine learning, the accurate prediction of drug properties remains an open problem. Indeed, because the biological environment is a complex system, the traditional approach-based on knowledge about the chemical structures-can not fully explain the nature of interactions between drugs and biological targets. Consequently, in this paper, we propose an unsupervised machine learning approach that uses the information we know about drug-target interactions to infer drug properties. To this end, we define drug similarity based on drug-target interactions and build a weighted Drug-Drug Similarity Network according to the drug-drug similarity relationships. Using an energy-model network layout, we generate drug communities associated with specific, dominant drug properties. DrugBank confirms the properties of 59.52% of the drugs in these communities, and 26.98% are existing drug repositioning hints we reconstruct with our DDSN approach. The remaining 13.49% of the drugs seem not to match the dominant pharmacologic property; thus, we consider them potential drug repurposing hints. The resources required to test all these repurposing hints are considerable. Therefore we introduce a mechanism of prioritization based on the betweenness/degree node centrality. Using betweenness/degree as an indicator of drug repurposing potential, we select Azelaic acid and Meprobamate as a possible antineoplastic and antifungal, respectively. Finally, we use a test procedure based on molecular docking to analyze Azelaic acid and Meprobamate's repurposing."
MSPEDTI: Prediction of Drug-Target Interactions via Molecular Structure with Protein Evolutionary Information.,35625468,"The key to new drug discovery and development is first and foremost the search for molecular targets of drugs, thus advancing drug discovery and drug repositioning. However, traditional drug-target interactions (DTIs) is a costly, lengthy, high-risk, and low-success-rate system project. Therefore, more and more pharmaceutical companies are trying to use computational technologies to screen existing drug molecules and mine new drugs, leading to accelerating new drug development. In the current study, we designed a deep learning computational model MSPEDTI based on <b>M</b>olecular <b>S</b>tructure and <b>P</b>rotein <b>E</b>volutionary to predict the potential <b>DTI</b>s. The model first fuses protein evolutionary information and drug structure information, then a deep learning convolutional neural network (CNN) to mine its hidden features, and finally accurately predicts the associated DTIs by extreme learning machine (ELM). In cross-validation experiments, MSPEDTI achieved 94.19%, 90.95%, 87.95%, and 86.11% prediction accuracy in the gold-standard datasets enzymes, ion channels, G-protein-coupled receptors (GPCRs), and nuclear receptors, respectively. MSPEDTI showed its competitive ability in ablation experiments and comparison with previous excellent methods. Additionally, 7 of 10 potential DTIs predicted by MSPEDTI were substantiated by the classical database. These excellent outcomes demonstrate the ability of MSPEDTI to provide reliable drug candidate targets and strongly facilitate the development of drug repositioning and drug development.",0,"MSPEDTI: Prediction of Drug-Target Interactions via Molecular Structure with Protein Evolutionary Information. The key to new drug discovery and development is first and foremost the search for molecular targets of drugs, thus advancing drug discovery and drug repositioning. However, traditional drug-target interactions (DTIs) is a costly, lengthy, high-risk, and low-success-rate system project. Therefore, more and more pharmaceutical companies are trying to use computational technologies to screen existing drug molecules and mine new drugs, leading to accelerating new drug development. In the current study, we designed a deep learning computational model MSPEDTI based on <b>M</b>olecular <b>S</b>tructure and <b>P</b>rotein <b>E</b>volutionary to predict the potential <b>DTI</b>s. The model first fuses protein evolutionary information and drug structure information, then a deep learning convolutional neural network (CNN) to mine its hidden features, and finally accurately predicts the associated DTIs by extreme learning machine (ELM). In cross-validation experiments, MSPEDTI achieved 94.19%, 90.95%, 87.95%, and 86.11% prediction accuracy in the gold-standard datasets enzymes, ion channels, G-protein-coupled receptors (GPCRs), and nuclear receptors, respectively. MSPEDTI showed its competitive ability in ablation experiments and comparison with previous excellent methods. Additionally, 7 of 10 potential DTIs predicted by MSPEDTI were substantiated by the classical database. These excellent outcomes demonstrate the ability of MSPEDTI to provide reliable drug candidate targets and strongly facilitate the development of drug repositioning and drug development."
Structural insight into the binding of C60-derivatives with enoyl-pyruvate transferase from Helicobacter pylori.,28729760,Helicobacter pylori (H. pylori) is a human pathogen associated with acute gastritis and peptic ulcer. The MurA enzyme is an important drug target for the identification of ligands with improved efficacy and acceptable pharmaco-kinetic properties. We developed a homology model of H. Pylori MurA followed by refinement and molecular dynamics (MD) simulations. A total of 16 C60-derivatives were docked and its docking score were compared. Some of the known inhibitors were also similarly characterized and compared. Results show that five out of the sixteen C60-derivatives have good binding score. The MMPBSA analysis for the top five C60- derivatives shows good binding energy. This study reports the interaction patterns of selected C60 derivatives and MurA enzyme towards fullerene-based drug discovery.,1,Structural insight into the binding of C60-derivatives with enoyl-pyruvate transferase from Helicobacter pylori. Helicobacter pylori (H. pylori) is a human pathogen associated with acute gastritis and peptic ulcer. The MurA enzyme is an important drug target for the identification of ligands with improved efficacy and acceptable pharmaco-kinetic properties. We developed a homology model of H. Pylori MurA followed by refinement and molecular dynamics (MD) simulations. A total of 16 C60-derivatives were docked and its docking score were compared. Some of the known inhibitors were also similarly characterized and compared. Results show that five out of the sixteen C60-derivatives have good binding score. The MMPBSA analysis for the top five C60- derivatives shows good binding energy. This study reports the interaction patterns of selected C60 derivatives and MurA enzyme towards fullerene-based drug discovery.
Multiview network embedding for drug-target Interactions prediction by consistent and complementary information preserving.,35262678,"Accurate prediction of drug-target interactions (DTIs) can reduce the cost and time of drug repositioning and drug discovery. Many current methods integrate information from multiple data sources of drug and target to improve DTIs prediction accuracy. However, these methods do not consider the complex relationship between different data sources. In this study, we propose a novel computational framework, called MccDTI, to predict the potential DTIs by multiview network embedding, which can integrate the heterogenous information of drug and target. MccDTI learns high-quality low-dimensional representations of drug and target by preserving the consistent and complementary information between multiview networks. Then MccDTI adopts matrix completion scheme for DTIs prediction based on drug and target representations. Experimental results on two datasets show that the prediction accuracy of MccDTI outperforms four state-of-the-art methods for DTIs prediction. Moreover, literature verification for DTIs prediction shows that MccDTI can predict the reliable potential DTIs. These results indicate that MccDTI can provide a powerful tool to predict new DTIs and accelerate drug discovery. The code and data are available at: https://github.com/ShangCS/MccDTI.",0,"Multiview network embedding for drug-target Interactions prediction by consistent and complementary information preserving. Accurate prediction of drug-target interactions (DTIs) can reduce the cost and time of drug repositioning and drug discovery. Many current methods integrate information from multiple data sources of drug and target to improve DTIs prediction accuracy. However, these methods do not consider the complex relationship between different data sources. In this study, we propose a novel computational framework, called MccDTI, to predict the potential DTIs by multiview network embedding, which can integrate the heterogenous information of drug and target. MccDTI learns high-quality low-dimensional representations of drug and target by preserving the consistent and complementary information between multiview networks. Then MccDTI adopts matrix completion scheme for DTIs prediction based on drug and target representations. Experimental results on two datasets show that the prediction accuracy of MccDTI outperforms four state-of-the-art methods for DTIs prediction. Moreover, literature verification for DTIs prediction shows that MccDTI can predict the reliable potential DTIs. These results indicate that MccDTI can provide a powerful tool to predict new DTIs and accelerate drug discovery. The code and data are available at: https://github.com/ShangCS/MccDTI."
DeepDTA: deep drug-target binding affinity prediction.,30423097,"The identification of novel drug-target (DT) interactions is a substantial part of the drug discovery process. Most of the computational methods that have been proposed to predict DT interactions have focused on binary classification, where the goal is to determine whether a DT pair interacts or not. However, protein-ligand interactions assume a continuum of binding strength values, also called binding affinity and predicting this value still remains a challenge. The increase in the affinity data available in DT knowledge-bases allows the use of advanced learning techniques such as deep learning architectures in the prediction of binding affinities. In this study, we propose a deep-learning based model that uses only sequence information of both targets and drugs to predict DT interaction binding affinities. The few studies that focus on DT binding affinity prediction use either 3D structures of protein-ligand complexes or 2D features of compounds. One novel approach used in this work is the modeling of protein sequences and compound 1D representations with convolutional neural networks (CNNs). The results show that the proposed deep learning based model that uses the 1D representations of targets and drugs is an effective approach for drug target binding affinity prediction. The model in which high-level representations of a drug and a target are constructed via CNNs achieved the best Concordance Index (CI) performance in one of our larger benchmark datasets, outperforming the KronRLS algorithm and SimBoost, a state-of-the-art method for DT binding affinity prediction. https://github.com/hkmztrk/DeepDTA. Supplementary data are available at Bioinformatics online.",0,"DeepDTA: deep drug-target binding affinity prediction. The identification of novel drug-target (DT) interactions is a substantial part of the drug discovery process. Most of the computational methods that have been proposed to predict DT interactions have focused on binary classification, where the goal is to determine whether a DT pair interacts or not. However, protein-ligand interactions assume a continuum of binding strength values, also called binding affinity and predicting this value still remains a challenge. The increase in the affinity data available in DT knowledge-bases allows the use of advanced learning techniques such as deep learning architectures in the prediction of binding affinities. In this study, we propose a deep-learning based model that uses only sequence information of both targets and drugs to predict DT interaction binding affinities. The few studies that focus on DT binding affinity prediction use either 3D structures of protein-ligand complexes or 2D features of compounds. One novel approach used in this work is the modeling of protein sequences and compound 1D representations with convolutional neural networks (CNNs). The results show that the proposed deep learning based model that uses the 1D representations of targets and drugs is an effective approach for drug target binding affinity prediction. The model in which high-level representations of a drug and a target are constructed via CNNs achieved the best Concordance Index (CI) performance in one of our larger benchmark datasets, outperforming the KronRLS algorithm and SimBoost, a state-of-the-art method for DT binding affinity prediction. https://github.com/hkmztrk/DeepDTA. Supplementary data are available at Bioinformatics online."
Identification of Ellagic acid analogues as potent inhibitor of protein Kinase CK2:A chemopreventive role in oral Cancer.,25780276,"Over expression of Protein kinase (CK2) suppresses apoptosis induced by a variety of agents, whereas down-regulation of CK2 sensitizes cells to induction of apoptosis. In this study, we have built quantitative structure activity relationship (QSAR) models, which were trained and tested on experimentally verified 38 enzyme׳s inhibitors having inhibitory value IC50 in µM. These inhibitors were docked at the active site of CK2 (PDB id: 2ZJW) using AutoDock software, which resulted in energy-based descriptors such as binding energy, intermol energy, torsional energy, internal energy and docking energy. For QSAR modeling, Multiple Linear Regression (MLR) model was engendered using energy-based descriptors yielding correlation coefficient r(2) of 0.4645. To assess the predictive performance of QSAR models, different cross-validation procedures were adopted. Our results suggests that ligand-receptor binding interactions for CK2 employing QSAR modeling seems to be a promising approach for prediction of IC50 value of a new ligand molecule against CK2.Further, twenty analogues of ellagic acid were docked with CK2 structure. After docking, two compounds CID 46229200 and CID 10003463 had lower docking energy even lower than standard control Ellagic acid with CK2 was selected as potent candidate drugs for Oral cancer. The biological activity of two compounds in terms of IC50 was predicted based on QSAR model, which could be used as a guideline for anticancerous activity of compounds before their synthesis.",1,"Identification of Ellagic acid analogues as potent inhibitor of protein Kinase CK2:A chemopreventive role in oral Cancer. Over expression of Protein kinase (CK2) suppresses apoptosis induced by a variety of agents, whereas down-regulation of CK2 sensitizes cells to induction of apoptosis. In this study, we have built quantitative structure activity relationship (QSAR) models, which were trained and tested on experimentally verified 38 enzyme׳s inhibitors having inhibitory value IC50 in µM. These inhibitors were docked at the active site of CK2 (PDB id: 2ZJW) using AutoDock software, which resulted in energy-based descriptors such as binding energy, intermol energy, torsional energy, internal energy and docking energy. For QSAR modeling, Multiple Linear Regression (MLR) model was engendered using energy-based descriptors yielding correlation coefficient r(2) of 0.4645. To assess the predictive performance of QSAR models, different cross-validation procedures were adopted. Our results suggests that ligand-receptor binding interactions for CK2 employing QSAR modeling seems to be a promising approach for prediction of IC50 value of a new ligand molecule against CK2.Further, twenty analogues of ellagic acid were docked with CK2 structure. After docking, two compounds CID 46229200 and CID 10003463 had lower docking energy even lower than standard control Ellagic acid with CK2 was selected as potent candidate drugs for Oral cancer. The biological activity of two compounds in terms of IC50 was predicted based on QSAR model, which could be used as a guideline for anticancerous activity of compounds before their synthesis."
GANsDTA: Predicting Drug-Target Binding Affinity Using GANs.,31993067,"The computational prediction of interactions between drugs and targets is a standing challenge in drug discovery. State-of-the-art methods for drug-target interaction prediction are primarily based on supervised machine learning with known label information. However, in biomedicine, obtaining labeled training data is an expensive and a laborious process. This paper proposes a semi-supervised generative adversarial networks (GANs)-based method to predict binding affinity. Our method comprises two parts, two GANs for feature extraction and a regression network for prediction. The semi-supervised mechanism allows our model to learn proteins drugs features of both labeled and unlabeled data. We evaluate the performance of our method using multiple public datasets. Experimental results demonstrate that our method achieves competitive performance while utilizing freely available unlabeled data. Our results suggest that utilizing such unlabeled data can considerably help improve performance in various biomedical relation extraction processes, for example, Drug-Target interaction and protein-protein interaction, particularly when only limited labeled data are available in such tasks. To our best knowledge, this is the first semi-supervised GANs-based method to predict binding affinity.",0,"GANsDTA: Predicting Drug-Target Binding Affinity Using GANs. The computational prediction of interactions between drugs and targets is a standing challenge in drug discovery. State-of-the-art methods for drug-target interaction prediction are primarily based on supervised machine learning with known label information. However, in biomedicine, obtaining labeled training data is an expensive and a laborious process. This paper proposes a semi-supervised generative adversarial networks (GANs)-based method to predict binding affinity. Our method comprises two parts, two GANs for feature extraction and a regression network for prediction. The semi-supervised mechanism allows our model to learn proteins drugs features of both labeled and unlabeled data. We evaluate the performance of our method using multiple public datasets. Experimental results demonstrate that our method achieves competitive performance while utilizing freely available unlabeled data. Our results suggest that utilizing such unlabeled data can considerably help improve performance in various biomedical relation extraction processes, for example, Drug-Target interaction and protein-protein interaction, particularly when only limited labeled data are available in such tasks. To our best knowledge, this is the first semi-supervised GANs-based method to predict binding affinity."
PharmDock: a pharmacophore-based docking program.,24739488,"Background: Protein-based pharmacophore models are enriched with the information of potential interactions between ligands and the protein target. We have shown in a previous study that protein-based pharmacophore models can be applied for ligand pose prediction and pose ranking. In this publication, we present a new pharmacophore-based docking program PharmDock that combines pose sampling and ranking based on optimized protein-based pharmacophore models with local optimization using an empirical scoring function. Results: Tests of PharmDock on ligand pose prediction, binding affinity estimation, compound ranking and virtual screening yielded comparable or better performance to existing and widely used docking programs. The docking program comes with an easy-to-use GUI within PyMOL. Two features have been incorporated in the program suite that allow for user-defined guidance of the docking process based on previous experimental data. Docking with those features demonstrated superior performance compared to unbiased docking. Conclusion: A protein pharmacophore-based docking program, PharmDock, has been made available with a PyMOL plugin. PharmDock and the PyMOL plugin are freely available from http://people.pharmacy.purdue.edu/~mlill/software/pharmdock.",1,"PharmDock: a pharmacophore-based docking program. Background: Protein-based pharmacophore models are enriched with the information of potential interactions between ligands and the protein target. We have shown in a previous study that protein-based pharmacophore models can be applied for ligand pose prediction and pose ranking. In this publication, we present a new pharmacophore-based docking program PharmDock that combines pose sampling and ranking based on optimized protein-based pharmacophore models with local optimization using an empirical scoring function. Results: Tests of PharmDock on ligand pose prediction, binding affinity estimation, compound ranking and virtual screening yielded comparable or better performance to existing and widely used docking programs. The docking program comes with an easy-to-use GUI within PyMOL. Two features have been incorporated in the program suite that allow for user-defined guidance of the docking process based on previous experimental data. Docking with those features demonstrated superior performance compared to unbiased docking. Conclusion: A protein pharmacophore-based docking program, PharmDock, has been made available with a PyMOL plugin. PharmDock and the PyMOL plugin are freely available from http://people.pharmacy.purdue.edu/~mlill/software/pharmdock."
