Title,PMID,Abstract,Cross-validation,text
Discovery of Potential Flavonoid Inhibitors Against COVID-19 3CL Proteinase Based on Virtual Screening Strategy.,33134310,"The outbreak of 2019 novel coronavirus (COVID-19) has caused serious threat to public health. Discovery of new anti-COVID-19 drugs is urgently needed. Fortunately, the crystal structure of COVID-19 3CL proteinase was recently resolved. The proteinase has been identified as a promising target for drug discovery in this crisis. Here, a dataset including 2030 natural compounds was screened and refined based on the machine learning and molecular docking. The performance of six machine learning (ML) methods of predicting active coronavirus inhibitors had achieved satisfactory accuracy, especially, the AUC (Area Under ROC Curve) scores with fivefold cross-validation of Logistic Regression (LR) reached up to 0.976. Comprehensive ML prediction and molecular docking results accounted for the compound Rutin, which was approved by NMPA (National Medical Products Administration), exhibited the best AUC and the most promising binding affinity compared to other compounds. Therefore, Rutin might be a promising agent in anti-COVID-19 drugs development.",1,"Discovery of Potential Flavonoid Inhibitors Against COVID-19 3CL Proteinase Based on Virtual Screening Strategy. The outbreak of 2019 novel coronavirus (COVID-19) has caused serious threat to public health. Discovery of new anti-COVID-19 drugs is urgently needed. Fortunately, the crystal structure of COVID-19 3CL proteinase was recently resolved. The proteinase has been identified as a promising target for drug discovery in this crisis. Here, a dataset including 2030 natural compounds was screened and refined based on the machine learning and molecular docking. The performance of six machine learning (ML) methods of predicting active coronavirus inhibitors had achieved satisfactory accuracy, especially, the AUC (Area Under ROC Curve) scores with fivefold cross-validation of Logistic Regression (LR) reached up to 0.976. Comprehensive ML prediction and molecular docking results accounted for the compound Rutin, which was approved by NMPA (National Medical Products Administration), exhibited the best AUC and the most promising binding affinity compared to other compounds. Therefore, Rutin might be a promising agent in anti-COVID-19 drugs development."
MOKPE: drug-target interaction prediction via manifold optimization based kernel preserving embedding.,37407927,"In many applications of bioinformatics, data stem from distinct heterogeneous sources. One of the well-known examples is the identification of drug-target interactions (DTIs), which is of significant importance in drug discovery. In this paper, we propose a novel framework, manifold optimization based kernel preserving embedding (MOKPE), to efficiently solve the problem of modeling heterogeneous data. Our model projects heterogeneous drug and target data into a unified embedding space by preserving drug-target interactions and drug-drug, target-target similarities simultaneously. We performed ten replications of ten-fold cross validation on four different drug-target interaction network data sets for predicting DTIs for previously unseen drugs. The classification evaluation metrics showed better or comparable performance compared to previous similarity-based state-of-the-art methods. We also evaluated MOKPE on predicting unknown DTIs of a given network. Our implementation of the proposed algorithm in R together with the scripts that replicate the reported experiments is publicly available at https://github.com/ocbinatli/mokpe .",1,"MOKPE: drug-target interaction prediction via manifold optimization based kernel preserving embedding. In many applications of bioinformatics, data stem from distinct heterogeneous sources. One of the well-known examples is the identification of drug-target interactions (DTIs), which is of significant importance in drug discovery. In this paper, we propose a novel framework, manifold optimization based kernel preserving embedding (MOKPE), to efficiently solve the problem of modeling heterogeneous data. Our model projects heterogeneous drug and target data into a unified embedding space by preserving drug-target interactions and drug-drug, target-target similarities simultaneously. We performed ten replications of ten-fold cross validation on four different drug-target interaction network data sets for predicting DTIs for previously unseen drugs. The classification evaluation metrics showed better or comparable performance compared to previous similarity-based state-of-the-art methods. We also evaluated MOKPE on predicting unknown DTIs of a given network. Our implementation of the proposed algorithm in R together with the scripts that replicate the reported experiments is publicly available at https://github.com/ocbinatli/mokpe ."
BiComp-DTA: Drug-target binding affinity prediction through complementary biological-related and compression-based featurization approach.,37000857,"Drug-target binding affinity prediction plays a key role in the early stage of drug discovery. Numerous experimental and data-driven approaches have been developed for predicting drug-target binding affinity. However, experimental methods highly rely on the limited structural-related information from drug-target pairs, domain knowledge, and time-consuming assays. On the other hand, learning-based methods have shown an acceptable prediction performance. However, most of them utilize several simple and complex types of proteins and drug compounds data, ranging from the protein sequences to the topology of a graph representation of drug compounds, employing multiple deep neural networks for encoding and feature extraction, and so, leads to the computational overheads. In this study, we propose a unified measure for protein sequence encoding, named BiComp, which provides compression-based and evolutionary-related features from the protein sequences. Specifically, we employ Normalized Compression Distance and Smith-Waterman measures for capturing complementary information from the algorithmic information theory and biological domains, respectively. We utilize the proposed measure to encode the input proteins feeding a new deep neural network-based method for drug-target binding affinity prediction, named BiComp-DTA. BiComp-DTA is evaluated utilizing four benchmark datasets for drug-target binding affinity prediction. Compared to the state-of-the-art methods, which employ complex models for protein encoding and feature extraction, BiComp-DTA provides superior efficiency in terms of accuracy, runtime, and the number of trainable parameters. The latter achievement facilitates execution of BiComp-DTA on a normal desktop computer in a fast fashion. As a comparative study, we evaluate BiComp's efficiency against its components for drug-target binding affinity prediction. The results have shown superior accuracy of BiComp due to the orthogonality and complementary nature of Smith-Waterman and Normalized Compression Distance measures for protein sequences. Such a protein sequence encoding provides efficient representation with no need for multiple sources of information, deep domain knowledge, and complex neural networks.",0,"BiComp-DTA: Drug-target binding affinity prediction through complementary biological-related and compression-based featurization approach. Drug-target binding affinity prediction plays a key role in the early stage of drug discovery. Numerous experimental and data-driven approaches have been developed for predicting drug-target binding affinity. However, experimental methods highly rely on the limited structural-related information from drug-target pairs, domain knowledge, and time-consuming assays. On the other hand, learning-based methods have shown an acceptable prediction performance. However, most of them utilize several simple and complex types of proteins and drug compounds data, ranging from the protein sequences to the topology of a graph representation of drug compounds, employing multiple deep neural networks for encoding and feature extraction, and so, leads to the computational overheads. In this study, we propose a unified measure for protein sequence encoding, named BiComp, which provides compression-based and evolutionary-related features from the protein sequences. Specifically, we employ Normalized Compression Distance and Smith-Waterman measures for capturing complementary information from the algorithmic information theory and biological domains, respectively. We utilize the proposed measure to encode the input proteins feeding a new deep neural network-based method for drug-target binding affinity prediction, named BiComp-DTA. BiComp-DTA is evaluated utilizing four benchmark datasets for drug-target binding affinity prediction. Compared to the state-of-the-art methods, which employ complex models for protein encoding and feature extraction, BiComp-DTA provides superior efficiency in terms of accuracy, runtime, and the number of trainable parameters. The latter achievement facilitates execution of BiComp-DTA on a normal desktop computer in a fast fashion. As a comparative study, we evaluate BiComp's efficiency against its components for drug-target binding affinity prediction. The results have shown superior accuracy of BiComp due to the orthogonality and complementary nature of Smith-Waterman and Normalized Compression Distance measures for protein sequences. Such a protein sequence encoding provides efficient representation with no need for multiple sources of information, deep domain knowledge, and complex neural networks."
Computational prediction of the effect of amino acid changes on the binding affinity between SARS-CoV-2 spike RBD and human ACE2.,34588290,"The association of the receptor binding domain (RBD) of severe acute respiratory syndrome coronavirus 2 (SARS-CoV-2) spike protein with human angiotensin-converting enzyme 2 (hACE2) represents the first required step for cellular entry. SARS-CoV-2 has continued to evolve with the emergence of several novel variants, and amino acid changes in the RBD have been implicated with increased fitness and potential for immune evasion. Reliably predicting the effect of amino acid changes on the ability of the RBD to interact more strongly with the hACE2 can help assess the implications for public health and the potential for spillover and adaptation into other animals. Here, we introduce a two-step framework that first relies on 48 independent 4-ns molecular dynamics (MD) trajectories of RBD-hACE2 variants to collect binding energy terms decomposed into Coulombic, covalent, van der Waals, lipophilic, generalized Born solvation, hydrogen bonding, π-π packing, and self-contact correction terms. The second step implements a neural network to classify and quantitatively predict binding affinity changes using the decomposed energy terms as descriptors. The computational base achieves a validation accuracy of 82.8% for classifying single-amino acid substitution variants of the RBD as worsening or improving binding affinity for hACE2 and a correlation coefficient of 0.73 between predicted and experimentally calculated changes in binding affinities. Both metrics are calculated using a fivefold cross-validation test. Our method thus sets up a framework for screening binding affinity changes caused by unknown single- and multiple-amino acid changes offering a valuable tool to predict host adaptation of SARS-CoV-2 variants toward tighter hACE2 binding.",1,"Computational prediction of the effect of amino acid changes on the binding affinity between SARS-CoV-2 spike RBD and human ACE2. The association of the receptor binding domain (RBD) of severe acute respiratory syndrome coronavirus 2 (SARS-CoV-2) spike protein with human angiotensin-converting enzyme 2 (hACE2) represents the first required step for cellular entry. SARS-CoV-2 has continued to evolve with the emergence of several novel variants, and amino acid changes in the RBD have been implicated with increased fitness and potential for immune evasion. Reliably predicting the effect of amino acid changes on the ability of the RBD to interact more strongly with the hACE2 can help assess the implications for public health and the potential for spillover and adaptation into other animals. Here, we introduce a two-step framework that first relies on 48 independent 4-ns molecular dynamics (MD) trajectories of RBD-hACE2 variants to collect binding energy terms decomposed into Coulombic, covalent, van der Waals, lipophilic, generalized Born solvation, hydrogen bonding, π-π packing, and self-contact correction terms. The second step implements a neural network to classify and quantitatively predict binding affinity changes using the decomposed energy terms as descriptors. The computational base achieves a validation accuracy of 82.8% for classifying single-amino acid substitution variants of the RBD as worsening or improving binding affinity for hACE2 and a correlation coefficient of 0.73 between predicted and experimentally calculated changes in binding affinities. Both metrics are calculated using a fivefold cross-validation test. Our method thus sets up a framework for screening binding affinity changes caused by unknown single- and multiple-amino acid changes offering a valuable tool to predict host adaptation of SARS-CoV-2 variants toward tighter hACE2 binding."
"Prediction of In-silico ADME Properties of 1,2-O-Isopropylidene Aldohexose Derivatives.",25276190,"Retention behaviour of molecules mostly depends on their chemical structure. Retention data of biologically active molecules could be an indirect relationship between their structure and biological or pharmacological activity, since the molecular structure affects their behaviour in all pharmacokinetic stages. In the present paper, retention parameters (R M (0)) of biologically active 1,2-O-isopropylidene aldohexose derivatives, obtained by normal-phase thin-layer chromatography (NP TLC), were correlated with selected physicochemical properties relevant to pharmacokinetics, i.e. absorption, distribution, metabolism, and elimination (ADME) properties. Conducted correlation analysis showed high dependence between R M (0) and blood brain barrier penetration, skin permeability, enzyme inhibition, binding affinity to nuclear receptor ligand and G protein-coupled receptors, as well as lipophilicity (expressed as Hansh-Leo's parameter Clog P). The statistical validity of the established polynomial dependence of the second degree between R M (0) and mentioned ADME properties was confirmed by standard statistical measures and leave-one-out cross-validation method. On the basis of in-silico calculated ADME properties and retention data, the similarity between studied molecules was examined using principal component analysis (PCA). The obtained results indicate the possibility of predicting ADME properties of studied compounds on the basis of their retention data (R M (0)). These preliminary results could be treated as guideline for selecting new 1,2-O-isopropylidene aldohexose derivatives as drug candidates.",1,"Prediction of In-silico ADME Properties of 1,2-O-Isopropylidene Aldohexose Derivatives. Retention behaviour of molecules mostly depends on their chemical structure. Retention data of biologically active molecules could be an indirect relationship between their structure and biological or pharmacological activity, since the molecular structure affects their behaviour in all pharmacokinetic stages. In the present paper, retention parameters (R M (0)) of biologically active 1,2-O-isopropylidene aldohexose derivatives, obtained by normal-phase thin-layer chromatography (NP TLC), were correlated with selected physicochemical properties relevant to pharmacokinetics, i.e. absorption, distribution, metabolism, and elimination (ADME) properties. Conducted correlation analysis showed high dependence between R M (0) and blood brain barrier penetration, skin permeability, enzyme inhibition, binding affinity to nuclear receptor ligand and G protein-coupled receptors, as well as lipophilicity (expressed as Hansh-Leo's parameter Clog P). The statistical validity of the established polynomial dependence of the second degree between R M (0) and mentioned ADME properties was confirmed by standard statistical measures and leave-one-out cross-validation method. On the basis of in-silico calculated ADME properties and retention data, the similarity between studied molecules was examined using principal component analysis (PCA). The obtained results indicate the possibility of predicting ADME properties of studied compounds on the basis of their retention data (R M (0)). These preliminary results could be treated as guideline for selecting new 1,2-O-isopropylidene aldohexose derivatives as drug candidates."
Identifying Patient Populations in Texts Describing Drug Approvals Through Deep Learning-Based Information Extraction: Development of a Natural Language Processing Algorithm.,37347514,"Background: New drug treatments are regularly approved, and it is challenging to remain up-to-date in this rapidly changing environment. Fast and accurate visualization is important to allow a global understanding of the drug market. Automation of this information extraction provides a helpful starting point for the subject matter expert, helps to mitigate human errors, and saves time. Objective: We aimed to semiautomate disease population extraction from the free text of oncology drug approval descriptions from the BioMedTracker database for 6 selected drug targets. More specifically, we intended to extract (1) line of therapy, (2) stage of cancer of the patient population described in the approval, and (3) the clinical trials that provide evidence for the approval. We aimed to use these results in downstream applications, aiding the searchability of relevant content against related drug project sources. Methods: We fine-tuned a state-of-the-art deep learning model, Bidirectional Encoder Representations from Transformers, for each of the 3 desired outputs. We independently applied rule-based text mining approaches. We compared the performances of deep learning and rule-based approaches and selected the best method, which was then applied to new entries. The results were manually curated by a subject matter expert and then used to train new models. Results: The training data set is currently small (433 entries) and will enlarge over time when new approval descriptions become available or if a choice is made to take another drug target into account. The deep learning models achieved 61% and 56% 5-fold cross-validated accuracies for line of therapy and stage of cancer, respectively, which were treated as classification tasks. Trial identification is treated as a named entity recognition task, and the 5-fold cross-validated F1-score is currently 87%. Although the scores of the classification tasks could seem low, the models comprise 5 classes each, and such scores are a marked improvement when compared to random classification. Moreover, we expect improved performance as the input data set grows, since deep learning models need to be trained on a large enough amount of data to be able to learn the task they are taught. The rule-based approach achieved 60% and 74% 5-fold cross-validated accuracies for line of therapy and stage of cancer, respectively. No attempt was made to define a rule-based approach for trial identification. Conclusions: We developed a natural language processing algorithm that is currently assisting subject matter experts in disease population extraction, which supports health authority approvals. This algorithm achieves semiautomation, enabling subject matter experts to leverage the results for deeper analysis and to accelerate information retrieval in a crowded clinical environment such as oncology.",1,"Identifying Patient Populations in Texts Describing Drug Approvals Through Deep Learning-Based Information Extraction: Development of a Natural Language Processing Algorithm. Background: New drug treatments are regularly approved, and it is challenging to remain up-to-date in this rapidly changing environment. Fast and accurate visualization is important to allow a global understanding of the drug market. Automation of this information extraction provides a helpful starting point for the subject matter expert, helps to mitigate human errors, and saves time. Objective: We aimed to semiautomate disease population extraction from the free text of oncology drug approval descriptions from the BioMedTracker database for 6 selected drug targets. More specifically, we intended to extract (1) line of therapy, (2) stage of cancer of the patient population described in the approval, and (3) the clinical trials that provide evidence for the approval. We aimed to use these results in downstream applications, aiding the searchability of relevant content against related drug project sources. Methods: We fine-tuned a state-of-the-art deep learning model, Bidirectional Encoder Representations from Transformers, for each of the 3 desired outputs. We independently applied rule-based text mining approaches. We compared the performances of deep learning and rule-based approaches and selected the best method, which was then applied to new entries. The results were manually curated by a subject matter expert and then used to train new models. Results: The training data set is currently small (433 entries) and will enlarge over time when new approval descriptions become available or if a choice is made to take another drug target into account. The deep learning models achieved 61% and 56% 5-fold cross-validated accuracies for line of therapy and stage of cancer, respectively, which were treated as classification tasks. Trial identification is treated as a named entity recognition task, and the 5-fold cross-validated F1-score is currently 87%. Although the scores of the classification tasks could seem low, the models comprise 5 classes each, and such scores are a marked improvement when compared to random classification. Moreover, we expect improved performance as the input data set grows, since deep learning models need to be trained on a large enough amount of data to be able to learn the task they are taught. The rule-based approach achieved 60% and 74% 5-fold cross-validated accuracies for line of therapy and stage of cancer, respectively. No attempt was made to define a rule-based approach for trial identification. Conclusions: We developed a natural language processing algorithm that is currently assisting subject matter experts in disease population extraction, which supports health authority approvals. This algorithm achieves semiautomation, enabling subject matter experts to leverage the results for deeper analysis and to accelerate information retrieval in a crowded clinical environment such as oncology."
