Title,PMID,Abstract,Attention-based,text
Sequence-based prediction of protein binding regions and drug-target interactions.,35135622,"Identifying drug-target interactions (DTIs) is important for drug discovery. However, searching all drug-target spaces poses a major bottleneck. Therefore, recently many deep learning models have been proposed to address this problem. However, the developers of these deep learning models have neglected interpretability in model construction, which is closely related to a model's performance. We hypothesized that training a model to predict important regions on a protein sequence would increase DTI prediction performance and provide a more interpretable model. Consequently, we constructed a deep learning model, named Highlights on Target Sequences (HoTS), which predicts binding regions (BRs) between a protein sequence and a drug ligand, as well as DTIs between them. To train the model, we collected complexes of protein-ligand interactions and protein sequences of binding sites and pretrained the model to predict BRs for a given protein sequence-ligand pair via object detection employing transformers. After pretraining the BR prediction, we trained the model to predict DTIs from a compound token designed to assign attention to BRs. We confirmed that training the BRs prediction model indeed improved the DTI prediction performance. The proposed HoTS model showed good performance in BR prediction on independent test datasets even though it does not use 3D structure information in its prediction. Furthermore, the HoTS model achieved the best performance in DTI prediction on test datasets. Additional analysis confirmed the appropriate attention for BRs and the importance of transformers in BR and DTI prediction. The source code is available on GitHub ( https://github.com/GIST-CSBL/HoTS ).",1,"Sequence-based prediction of protein binding regions and drug-target interactions. Identifying drug-target interactions (DTIs) is important for drug discovery. However, searching all drug-target spaces poses a major bottleneck. Therefore, recently many deep learning models have been proposed to address this problem. However, the developers of these deep learning models have neglected interpretability in model construction, which is closely related to a model's performance. We hypothesized that training a model to predict important regions on a protein sequence would increase DTI prediction performance and provide a more interpretable model. Consequently, we constructed a deep learning model, named Highlights on Target Sequences (HoTS), which predicts binding regions (BRs) between a protein sequence and a drug ligand, as well as DTIs between them. To train the model, we collected complexes of protein-ligand interactions and protein sequences of binding sites and pretrained the model to predict BRs for a given protein sequence-ligand pair via object detection employing transformers. After pretraining the BR prediction, we trained the model to predict DTIs from a compound token designed to assign attention to BRs. We confirmed that training the BRs prediction model indeed improved the DTI prediction performance. The proposed HoTS model showed good performance in BR prediction on independent test datasets even though it does not use 3D structure information in its prediction. Furthermore, the HoTS model achieved the best performance in DTI prediction on test datasets. Additional analysis confirmed the appropriate attention for BRs and the importance of transformers in BR and DTI prediction. The source code is available on GitHub ( https://github.com/GIST-CSBL/HoTS )."
A Robust Drug-Target Interaction Prediction Framework with Capsule Network and Transfer Learning.,37762364,"Drug-target interactions (DTIs) are considered a crucial component of drug design and drug discovery. To date, many computational methods were developed for drug-target interactions, but they are insufficiently informative for accurately predicting DTIs due to the lack of experimentally verified negative datasets, inaccurate molecular feature representation, and ineffective DTI classifiers. Therefore, we address the limitations of randomly selecting negative DTI data from unknown drug-target pairs by establishing two experimentally validated datasets and propose a capsule network-based framework called CapBM-DTI to capture hierarchical relationships of drugs and targets, which adopts pre-trained bidirectional encoder representations from transformers (BERT) for contextual sequence feature extraction from target proteins through transfer learning and the message-passing neural network (MPNN) for the 2-D graph feature extraction of compounds to accurately and robustly identify drug-target interactions. We compared the performance of CapBM-DTI with state-of-the-art methods using four experimentally validated DTI datasets of different sizes, including human (<i>Homo sapiens</i>) and worm (<i>Caenorhabditis elegans</i>) species datasets, as well as three subsets (new compounds, new proteins, and new pairs). Our results demonstrate that the proposed model achieved robust performance and powerful generalization ability in all experiments. The case study on treating COVID-19 demonstrates the applicability of the model in virtual screening.",1,"A Robust Drug-Target Interaction Prediction Framework with Capsule Network and Transfer Learning. Drug-target interactions (DTIs) are considered a crucial component of drug design and drug discovery. To date, many computational methods were developed for drug-target interactions, but they are insufficiently informative for accurately predicting DTIs due to the lack of experimentally verified negative datasets, inaccurate molecular feature representation, and ineffective DTI classifiers. Therefore, we address the limitations of randomly selecting negative DTI data from unknown drug-target pairs by establishing two experimentally validated datasets and propose a capsule network-based framework called CapBM-DTI to capture hierarchical relationships of drugs and targets, which adopts pre-trained bidirectional encoder representations from transformers (BERT) for contextual sequence feature extraction from target proteins through transfer learning and the message-passing neural network (MPNN) for the 2-D graph feature extraction of compounds to accurately and robustly identify drug-target interactions. We compared the performance of CapBM-DTI with state-of-the-art methods using four experimentally validated DTI datasets of different sizes, including human (<i>Homo sapiens</i>) and worm (<i>Caenorhabditis elegans</i>) species datasets, as well as three subsets (new compounds, new proteins, and new pairs). Our results demonstrate that the proposed model achieved robust performance and powerful generalization ability in all experiments. The case study on treating COVID-19 demonstrates the applicability of the model in virtual screening."
BiComp-DTA: Drug-target binding affinity prediction through complementary biological-related and compression-based featurization approach.,37000857,"Drug-target binding affinity prediction plays a key role in the early stage of drug discovery. Numerous experimental and data-driven approaches have been developed for predicting drug-target binding affinity. However, experimental methods highly rely on the limited structural-related information from drug-target pairs, domain knowledge, and time-consuming assays. On the other hand, learning-based methods have shown an acceptable prediction performance. However, most of them utilize several simple and complex types of proteins and drug compounds data, ranging from the protein sequences to the topology of a graph representation of drug compounds, employing multiple deep neural networks for encoding and feature extraction, and so, leads to the computational overheads. In this study, we propose a unified measure for protein sequence encoding, named BiComp, which provides compression-based and evolutionary-related features from the protein sequences. Specifically, we employ Normalized Compression Distance and Smith-Waterman measures for capturing complementary information from the algorithmic information theory and biological domains, respectively. We utilize the proposed measure to encode the input proteins feeding a new deep neural network-based method for drug-target binding affinity prediction, named BiComp-DTA. BiComp-DTA is evaluated utilizing four benchmark datasets for drug-target binding affinity prediction. Compared to the state-of-the-art methods, which employ complex models for protein encoding and feature extraction, BiComp-DTA provides superior efficiency in terms of accuracy, runtime, and the number of trainable parameters. The latter achievement facilitates execution of BiComp-DTA on a normal desktop computer in a fast fashion. As a comparative study, we evaluate BiComp's efficiency against its components for drug-target binding affinity prediction. The results have shown superior accuracy of BiComp due to the orthogonality and complementary nature of Smith-Waterman and Normalized Compression Distance measures for protein sequences. Such a protein sequence encoding provides efficient representation with no need for multiple sources of information, deep domain knowledge, and complex neural networks.",0,"BiComp-DTA: Drug-target binding affinity prediction through complementary biological-related and compression-based featurization approach. Drug-target binding affinity prediction plays a key role in the early stage of drug discovery. Numerous experimental and data-driven approaches have been developed for predicting drug-target binding affinity. However, experimental methods highly rely on the limited structural-related information from drug-target pairs, domain knowledge, and time-consuming assays. On the other hand, learning-based methods have shown an acceptable prediction performance. However, most of them utilize several simple and complex types of proteins and drug compounds data, ranging from the protein sequences to the topology of a graph representation of drug compounds, employing multiple deep neural networks for encoding and feature extraction, and so, leads to the computational overheads. In this study, we propose a unified measure for protein sequence encoding, named BiComp, which provides compression-based and evolutionary-related features from the protein sequences. Specifically, we employ Normalized Compression Distance and Smith-Waterman measures for capturing complementary information from the algorithmic information theory and biological domains, respectively. We utilize the proposed measure to encode the input proteins feeding a new deep neural network-based method for drug-target binding affinity prediction, named BiComp-DTA. BiComp-DTA is evaluated utilizing four benchmark datasets for drug-target binding affinity prediction. Compared to the state-of-the-art methods, which employ complex models for protein encoding and feature extraction, BiComp-DTA provides superior efficiency in terms of accuracy, runtime, and the number of trainable parameters. The latter achievement facilitates execution of BiComp-DTA on a normal desktop computer in a fast fashion. As a comparative study, we evaluate BiComp's efficiency against its components for drug-target binding affinity prediction. The results have shown superior accuracy of BiComp due to the orthogonality and complementary nature of Smith-Waterman and Normalized Compression Distance measures for protein sequences. Such a protein sequence encoding provides efficient representation with no need for multiple sources of information, deep domain knowledge, and complex neural networks."
GIFDTI: Prediction of Drug-Target Interactions Based on Global Molecular and Intermolecular Interaction Representation Learning.,36445997,"Drug discovery and drug repurposing often rely on the successful prediction of drug-target interactions (DTIs). Recent advances have shown great promise in applying deep learning to drug-target interaction prediction. One challenge in building deep learning-based models is to adequately represent drugs and proteins that encompass the fundamental local chemical environments and long-distance information among amino acids of proteins (or atoms of drugs). Another challenge is to efficiently model the intermolecular interactions between drugs and proteins, which plays vital roles in the DTIs. To this end, we propose a novel model, GIFDTI, which consists of three key components: the sequence feature extractor (CNNFormer), the global molecular feature extractor (GF), and the intermolecular interaction modeling module (IIF). Specifically, CNNFormer incorporates CNN and Transformer to capture the local patterns and encode the long-distance relationship among tokens (atoms or amino acids) in a sequence. Then, GF and IIF extract the global molecular features and the intermolecular interaction features, respectively. We evaluate GIFDTI on six realistic evaluation strategies and the results show it improves DTI prediction performance compared to state-of-the-art methods. Moreover, case studies confirm that our model can be a useful tool to accurately yield low-cost DTIs. The codes of GIFDTI are available at https://github.com/zhaoqichang/GIFDTI.",1,"GIFDTI: Prediction of Drug-Target Interactions Based on Global Molecular and Intermolecular Interaction Representation Learning. Drug discovery and drug repurposing often rely on the successful prediction of drug-target interactions (DTIs). Recent advances have shown great promise in applying deep learning to drug-target interaction prediction. One challenge in building deep learning-based models is to adequately represent drugs and proteins that encompass the fundamental local chemical environments and long-distance information among amino acids of proteins (or atoms of drugs). Another challenge is to efficiently model the intermolecular interactions between drugs and proteins, which plays vital roles in the DTIs. To this end, we propose a novel model, GIFDTI, which consists of three key components: the sequence feature extractor (CNNFormer), the global molecular feature extractor (GF), and the intermolecular interaction modeling module (IIF). Specifically, CNNFormer incorporates CNN and Transformer to capture the local patterns and encode the long-distance relationship among tokens (atoms or amino acids) in a sequence. Then, GF and IIF extract the global molecular features and the intermolecular interaction features, respectively. We evaluate GIFDTI on six realistic evaluation strategies and the results show it improves DTI prediction performance compared to state-of-the-art methods. Moreover, case studies confirm that our model can be a useful tool to accurately yield low-cost DTIs. The codes of GIFDTI are available at https://github.com/zhaoqichang/GIFDTI."
MSPEDTI: Prediction of Drug-Target Interactions via Molecular Structure with Protein Evolutionary Information.,35625468,"The key to new drug discovery and development is first and foremost the search for molecular targets of drugs, thus advancing drug discovery and drug repositioning. However, traditional drug-target interactions (DTIs) is a costly, lengthy, high-risk, and low-success-rate system project. Therefore, more and more pharmaceutical companies are trying to use computational technologies to screen existing drug molecules and mine new drugs, leading to accelerating new drug development. In the current study, we designed a deep learning computational model MSPEDTI based on <b>M</b>olecular <b>S</b>tructure and <b>P</b>rotein <b>E</b>volutionary to predict the potential <b>DTI</b>s. The model first fuses protein evolutionary information and drug structure information, then a deep learning convolutional neural network (CNN) to mine its hidden features, and finally accurately predicts the associated DTIs by extreme learning machine (ELM). In cross-validation experiments, MSPEDTI achieved 94.19%, 90.95%, 87.95%, and 86.11% prediction accuracy in the gold-standard datasets enzymes, ion channels, G-protein-coupled receptors (GPCRs), and nuclear receptors, respectively. MSPEDTI showed its competitive ability in ablation experiments and comparison with previous excellent methods. Additionally, 7 of 10 potential DTIs predicted by MSPEDTI were substantiated by the classical database. These excellent outcomes demonstrate the ability of MSPEDTI to provide reliable drug candidate targets and strongly facilitate the development of drug repositioning and drug development.",0,"MSPEDTI: Prediction of Drug-Target Interactions via Molecular Structure with Protein Evolutionary Information. The key to new drug discovery and development is first and foremost the search for molecular targets of drugs, thus advancing drug discovery and drug repositioning. However, traditional drug-target interactions (DTIs) is a costly, lengthy, high-risk, and low-success-rate system project. Therefore, more and more pharmaceutical companies are trying to use computational technologies to screen existing drug molecules and mine new drugs, leading to accelerating new drug development. In the current study, we designed a deep learning computational model MSPEDTI based on <b>M</b>olecular <b>S</b>tructure and <b>P</b>rotein <b>E</b>volutionary to predict the potential <b>DTI</b>s. The model first fuses protein evolutionary information and drug structure information, then a deep learning convolutional neural network (CNN) to mine its hidden features, and finally accurately predicts the associated DTIs by extreme learning machine (ELM). In cross-validation experiments, MSPEDTI achieved 94.19%, 90.95%, 87.95%, and 86.11% prediction accuracy in the gold-standard datasets enzymes, ion channels, G-protein-coupled receptors (GPCRs), and nuclear receptors, respectively. MSPEDTI showed its competitive ability in ablation experiments and comparison with previous excellent methods. Additionally, 7 of 10 potential DTIs predicted by MSPEDTI were substantiated by the classical database. These excellent outcomes demonstrate the ability of MSPEDTI to provide reliable drug candidate targets and strongly facilitate the development of drug repositioning and drug development."
VGAEDTI: drug-target interaction prediction based on variational inference and graph autoencoder.,37415176,"Accurate identification of Drug-Target Interactions (DTIs) plays a crucial role in many stages of drug development and drug repurposing. (i) Traditional methods do not consider the use of multi-source data and do not consider the complex relationship between data sources. (ii) How to better mine the hidden features of drug and target space from high-dimensional data, and better solve the accuracy and robustness of the model. To solve the above problems, a novel prediction model named VGAEDTI is proposed in this paper. We constructed a heterogeneous network with multiple sources of information using multiple types of drug and target dataIn order to obtain deeper features of drugs and targets, we use two different autoencoders. One is variational graph autoencoder (VGAE) which is used to infer feature representations from drug and target spaces. The second is graph autoencoder (GAE) propagating labels between known DTIs. Experimental results on two public datasets show that the prediction accuracy of VGAEDTI is better than that of six DTIs prediction methods. These results indicate that model can predict new DTIs and provide an effective tool for accelerating drug development and repurposing.",0,"VGAEDTI: drug-target interaction prediction based on variational inference and graph autoencoder. Accurate identification of Drug-Target Interactions (DTIs) plays a crucial role in many stages of drug development and drug repurposing. (i) Traditional methods do not consider the use of multi-source data and do not consider the complex relationship between data sources. (ii) How to better mine the hidden features of drug and target space from high-dimensional data, and better solve the accuracy and robustness of the model. To solve the above problems, a novel prediction model named VGAEDTI is proposed in this paper. We constructed a heterogeneous network with multiple sources of information using multiple types of drug and target dataIn order to obtain deeper features of drugs and targets, we use two different autoencoders. One is variational graph autoencoder (VGAE) which is used to infer feature representations from drug and target spaces. The second is graph autoencoder (GAE) propagating labels between known DTIs. Experimental results on two public datasets show that the prediction accuracy of VGAEDTI is better than that of six DTIs prediction methods. These results indicate that model can predict new DTIs and provide an effective tool for accelerating drug development and repurposing."
Multi-scaled self-attention for drug-target interaction prediction based on multi-granularity representation.,35922768,"Background: Drug-target interaction (DTI) prediction plays a crucial role in drug discovery. Although the advanced deep learning has shown promising results in predicting DTIs, it still needs improvements in two aspects: (1) encoding method, in which the existing encoding method, character encoding, overlooks chemical textual information of atoms with multiple characters and chemical functional groups; as well as (2) the architecture of deep model, which should focus on multiple chemical patterns in drug and target representations. Results: In this paper, we propose a multi-granularity multi-scaled self-attention (SAN) model by alleviating the above problems. Specifically, in process of encoding, we investigate a segmentation method for drug and protein sequences and then label the segmented groups as the multi-granularity representations. Moreover, in order to enhance the various local patterns in these multi-granularity representations, a multi-scaled SAN is built and exploited to generate deep representations of drugs and targets. Finally, our proposed model predicts DTIs based on the fusion of these deep representations. Our proposed model is evaluated on two benchmark datasets, KIBA and Davis. The experimental results reveal that our proposed model yields better prediction accuracy than strong baseline models. Conclusion: Our proposed multi-granularity encoding method and multi-scaled SAN model improve DTI prediction by encoding the chemical textual information of drugs and targets and extracting their various local patterns, respectively.",1,"Multi-scaled self-attention for drug-target interaction prediction based on multi-granularity representation. Background: Drug-target interaction (DTI) prediction plays a crucial role in drug discovery. Although the advanced deep learning has shown promising results in predicting DTIs, it still needs improvements in two aspects: (1) encoding method, in which the existing encoding method, character encoding, overlooks chemical textual information of atoms with multiple characters and chemical functional groups; as well as (2) the architecture of deep model, which should focus on multiple chemical patterns in drug and target representations. Results: In this paper, we propose a multi-granularity multi-scaled self-attention (SAN) model by alleviating the above problems. Specifically, in process of encoding, we investigate a segmentation method for drug and protein sequences and then label the segmented groups as the multi-granularity representations. Moreover, in order to enhance the various local patterns in these multi-granularity representations, a multi-scaled SAN is built and exploited to generate deep representations of drugs and targets. Finally, our proposed model predicts DTIs based on the fusion of these deep representations. Our proposed model is evaluated on two benchmark datasets, KIBA and Davis. The experimental results reveal that our proposed model yields better prediction accuracy than strong baseline models. Conclusion: Our proposed multi-granularity encoding method and multi-scaled SAN model improve DTI prediction by encoding the chemical textual information of drugs and targets and extracting their various local patterns, respectively."
