Title,PMID,Abstract,Deep Learning,text
AttentionDTA: Drug-Target Binding Affinity Prediction by Sequence-Based Deep Learning With Attention Mechanism.,35471889,"The identification of drug-target relations (DTRs) is substantial in drug development. A large number of methods treat DTRs as drug-target interactions (DTIs), a binary classification problem. The main drawback of these methods are the lack of reliable negative samples and the absence of many important aspects of DTR, including their dose dependence and quantitative affinities. With increasing number of publications of drug-protein binding affinity data recently, DTRs prediction can be viewed as a regression problem of drug-target affinities (DTAs) which reflects how tightly the drug binds to the target and can present more detailed and specific information than DTIs. The growth of affinity data enables the use of deep learning architectures, which have been shown to be among the state-of-the-art methods in binding affinity prediction. Although relatively effective, due to the black-box nature of deep learning, these models are less biologically interpretable. In this study, we proposed a deep learning-based model, named AttentionDTA, which uses attention mechanism to predict DTAs. Different from the models using 3D structures of drug-target complexes or graph representation of drugs and proteins, the novelty of our work is to use attention mechanism to focus on key subsequences which are important in drug and protein sequences when predicting its affinity. We use two separate one-dimensional Convolution Neural Networks (1D-CNNs) to extract the semantic information of drug's SMILES string and protein's amino acid sequence. Furthermore, a two-side multi-head attention mechanism is developed and embedded to our model to explore the relationship between drug features and protein features. We evaluate our model on three established DTA benchmark datasets, Davis, Metz, and KIBA. AttentionDTA outperforms the state-of-the-art deep learning methods under different evaluation metrics. The results show that the attention-based model can effectively extract protein features related to drug information and drug features related to protein information to better predict drug target affinities. It is worth mentioning that we test our model on IC50 dataset, which provides the binding sites between drugs and proteins, to evaluate the ability of our model to locate binding sites. Finally, we visualize the attention weight to demonstrate the biological significance of the model. The source code of AttentionDTA can be downloaded from https://github.com/zhaoqichang/AttentionDTA_TCBB.",1,"AttentionDTA: Drug-Target Binding Affinity Prediction by Sequence-Based Deep Learning With Attention Mechanism. The identification of drug-target relations (DTRs) is substantial in drug development. A large number of methods treat DTRs as drug-target interactions (DTIs), a binary classification problem. The main drawback of these methods are the lack of reliable negative samples and the absence of many important aspects of DTR, including their dose dependence and quantitative affinities. With increasing number of publications of drug-protein binding affinity data recently, DTRs prediction can be viewed as a regression problem of drug-target affinities (DTAs) which reflects how tightly the drug binds to the target and can present more detailed and specific information than DTIs. The growth of affinity data enables the use of deep learning architectures, which have been shown to be among the state-of-the-art methods in binding affinity prediction. Although relatively effective, due to the black-box nature of deep learning, these models are less biologically interpretable. In this study, we proposed a deep learning-based model, named AttentionDTA, which uses attention mechanism to predict DTAs. Different from the models using 3D structures of drug-target complexes or graph representation of drugs and proteins, the novelty of our work is to use attention mechanism to focus on key subsequences which are important in drug and protein sequences when predicting its affinity. We use two separate one-dimensional Convolution Neural Networks (1D-CNNs) to extract the semantic information of drug's SMILES string and protein's amino acid sequence. Furthermore, a two-side multi-head attention mechanism is developed and embedded to our model to explore the relationship between drug features and protein features. We evaluate our model on three established DTA benchmark datasets, Davis, Metz, and KIBA. AttentionDTA outperforms the state-of-the-art deep learning methods under different evaluation metrics. The results show that the attention-based model can effectively extract protein features related to drug information and drug features related to protein information to better predict drug target affinities. It is worth mentioning that we test our model on IC50 dataset, which provides the binding sites between drugs and proteins, to evaluate the ability of our model to locate binding sites. Finally, we visualize the attention weight to demonstrate the biological significance of the model. The source code of AttentionDTA can be downloaded from https://github.com/zhaoqichang/AttentionDTA_TCBB."
Deep drug-target binding affinity prediction with multiple attention blocks.,33866349,"Drug-target interaction (DTI) prediction has drawn increasing interest due to its substantial position in the drug discovery process. Many studies have introduced computational models to treat DTI prediction as a regression task, which directly predict the binding affinity of drug-target pairs. However, existing studies (i) ignore the essential correlations between atoms when encoding drug compounds and (ii) model the interaction of drug-target pairs simply by concatenation. Based on those observations, in this study, we propose an end-to-end model with multiple attention blocks to predict the binding affinity scores of drug-target pairs. Our proposed model offers the abilities to (i) encode the correlations between atoms by a relation-aware self-attention block and (ii) model the interaction of drug representations and target representations by the multi-head attention block. Experimental results of DTI prediction on two benchmark datasets show our approach outperforms existing methods, which are benefit from the correlation information encoded by the relation-aware self-attention block and the interaction information extracted by the multi-head attention block. Moreover, we conduct the experiments on the effects of max relative position length and find out the best max relative position length value $k \in \{3, 5\}$. Furthermore, we apply our model to predict the binding affinity of Corona Virus Disease 2019 (COVID-19)-related genome sequences and $3137$ FDA-approved drugs.",1,"Deep drug-target binding affinity prediction with multiple attention blocks. Drug-target interaction (DTI) prediction has drawn increasing interest due to its substantial position in the drug discovery process. Many studies have introduced computational models to treat DTI prediction as a regression task, which directly predict the binding affinity of drug-target pairs. However, existing studies (i) ignore the essential correlations between atoms when encoding drug compounds and (ii) model the interaction of drug-target pairs simply by concatenation. Based on those observations, in this study, we propose an end-to-end model with multiple attention blocks to predict the binding affinity scores of drug-target pairs. Our proposed model offers the abilities to (i) encode the correlations between atoms by a relation-aware self-attention block and (ii) model the interaction of drug representations and target representations by the multi-head attention block. Experimental results of DTI prediction on two benchmark datasets show our approach outperforms existing methods, which are benefit from the correlation information encoded by the relation-aware self-attention block and the interaction information extracted by the multi-head attention block. Moreover, we conduct the experiments on the effects of max relative position length and find out the best max relative position length value $k \in \{3, 5\}$. Furthermore, we apply our model to predict the binding affinity of Corona Virus Disease 2019 (COVID-19)-related genome sequences and $3137$ FDA-approved drugs."
Affinity2Vec: drug-target binding affinity prediction through representation learning,35306525,"Drug-target interaction (DTI) prediction plays a crucial role in drug repositioning and virtual drug screening. Most DTI prediction methods cast the problem as a binary classification task to predict if interactions exist or as a regression task to predict continuous values that indicate a drug's ability to bind to a specific target. The regression-based methods provide insight beyond the binary relationship. However, most of these methods require the three-dimensional (3D) structural information of targets which are still not generally available to the targets. Despite this bottleneck, only a few methods address the drug-target binding affinity (DTBA) problem from a non-structure-based approach to avoid the 3D structure limitations. Here we propose Affinity2Vec, as a novel regression-based method that formulates the entire task as a graph-based problem. To develop this method, we constructed a weighted heterogeneous graph that integrates data from several sources, including drug-drug similarity, target-target similarity, and drug-target binding affinities. Affinity2Vec further combines several computational techniques from feature representation learning, graph mining, and machine learning to generate or extract features, build the model, and predict the binding affinity between the drug and the target with no 3D structural data. We conducted extensive experiments to evaluate and demonstrate the robustness and efficiency of the proposed method on benchmark datasets used in state-of-the-art non-structured-based drug-target binding affinity studies. Affinity2Vec showed superior and competitive results compared to the state-of-the-art methods based on several evaluation metrics, including mean squared error, rm2, concordance index, and area under the precision-recall curve.",0,"Affinity2Vec: drug-target binding affinity prediction through representation learning Drug-target interaction (DTI) prediction plays a crucial role in drug repositioning and virtual drug screening. Most DTI prediction methods cast the problem as a binary classification task to predict if interactions exist or as a regression task to predict continuous values that indicate a drug's ability to bind to a specific target. The regression-based methods provide insight beyond the binary relationship. However, most of these methods require the three-dimensional (3D) structural information of targets which are still not generally available to the targets. Despite this bottleneck, only a few methods address the drug-target binding affinity (DTBA) problem from a non-structure-based approach to avoid the 3D structure limitations. Here we propose Affinity2Vec, as a novel regression-based method that formulates the entire task as a graph-based problem. To develop this method, we constructed a weighted heterogeneous graph that integrates data from several sources, including drug-drug similarity, target-target similarity, and drug-target binding affinities. Affinity2Vec further combines several computational techniques from feature representation learning, graph mining, and machine learning to generate or extract features, build the model, and predict the binding affinity between the drug and the target with no 3D structural data. We conducted extensive experiments to evaluate and demonstrate the robustness and efficiency of the proposed method on benchmark datasets used in state-of-the-art non-structured-based drug-target binding affinity studies. Affinity2Vec showed superior and competitive results compared to the state-of-the-art methods based on several evaluation metrics, including mean squared error, rm2, concordance index, and area under the precision-recall curve."
GEFA: Early Fusion Approach in Drug-Target Affinity Prediction.,34197324,"Predicting the interaction between a compound and a target is crucial for rapid drug repurposing. Deep learning has been successfully applied in drug-target affinity (DTA)problem. However, previous deep learning-based methods ignore modeling the direct interactions between drug and protein residues. This would lead to inaccurate learning of target representation which may change due to the drug binding effects. In addition, previous DTA methods learn protein representation solely based on a small number of protein sequences in DTA datasets while neglecting the use of proteins outside of the DTA datasets. We propose GEFA (Graph Early Fusion Affinity), a novel graph-in-graph neural network with attention mechanism to address the changes in target representation because of the binding effects. Specifically, a drug is modeled as a graph of atoms, which then serves as a node in a larger graph of residues-drug complex. The resulting model is an expressive deep nested graph neural network. We also use pre-trained protein representation powered by the recent effort of learning contextualized protein representation. The experiments are conducted under different settings to evaluate scenarios such as novel drugs or targets. The results demonstrate the effectiveness of the pre-trained protein embedding and the advantages our GEFA in modeling the nested graph for drug-target interaction.",1,"GEFA: Early Fusion Approach in Drug-Target Affinity Prediction. Predicting the interaction between a compound and a target is crucial for rapid drug repurposing. Deep learning has been successfully applied in drug-target affinity (DTA)problem. However, previous deep learning-based methods ignore modeling the direct interactions between drug and protein residues. This would lead to inaccurate learning of target representation which may change due to the drug binding effects. In addition, previous DTA methods learn protein representation solely based on a small number of protein sequences in DTA datasets while neglecting the use of proteins outside of the DTA datasets. We propose GEFA (Graph Early Fusion Affinity), a novel graph-in-graph neural network with attention mechanism to address the changes in target representation because of the binding effects. Specifically, a drug is modeled as a graph of atoms, which then serves as a node in a larger graph of residues-drug complex. The resulting model is an expressive deep nested graph neural network. We also use pre-trained protein representation powered by the recent effort of learning contextualized protein representation. The experiments are conducted under different settings to evaluate scenarios such as novel drugs or targets. The results demonstrate the effectiveness of the pre-trained protein embedding and the advantages our GEFA in modeling the nested graph for drug-target interaction."
DTI-SNNFRA: Drug-target interaction prediction by shared nearest neighbors and fuzzy-rough approximation.,33606741,"In-silico prediction of repurposable drugs is an effective drug discovery strategy that supplements de-nevo drug discovery from scratch. Reduced development time, less cost and absence of severe side effects are significant advantages of using drug repositioning. Most recent and most advanced artificial intelligence (AI) approaches have boosted drug repurposing in terms of throughput and accuracy enormously. However, with the growing number of drugs, targets and their massive interactions produce imbalanced data which may not be suitable as input to the classification model directly. Here, we have proposed DTI-SNNFRA, a framework for predicting drug-target interaction (DTI), based on shared nearest neighbour (SNN) and fuzzy-rough approximation (FRA). It uses sampling techniques to collectively reduce the vast search space covering the available drugs, targets and millions of interactions between them. DTI-SNNFRA operates in two stages: first, it uses SNN followed by a partitioning clustering for sampling the search space. Next, it computes the degree of fuzzy-rough approximations and proper degree threshold selection for the negative samples' undersampling from all possible interaction pairs between drugs and targets obtained in the first stage. Finally, classification is performed using the positive and selected negative samples. We have evaluated the efficacy of DTI-SNNFRA using AUC (Area under ROC Curve), Geometric Mean, and F1 Score. The model performs exceptionally well with a high prediction score of 0.95 for ROC-AUC. The predicted drug-target interactions are validated through an existing drug-target database (Connectivity Map (Cmap)).",0,"DTI-SNNFRA: Drug-target interaction prediction by shared nearest neighbors and fuzzy-rough approximation. In-silico prediction of repurposable drugs is an effective drug discovery strategy that supplements de-nevo drug discovery from scratch. Reduced development time, less cost and absence of severe side effects are significant advantages of using drug repositioning. Most recent and most advanced artificial intelligence (AI) approaches have boosted drug repurposing in terms of throughput and accuracy enormously. However, with the growing number of drugs, targets and their massive interactions produce imbalanced data which may not be suitable as input to the classification model directly. Here, we have proposed DTI-SNNFRA, a framework for predicting drug-target interaction (DTI), based on shared nearest neighbour (SNN) and fuzzy-rough approximation (FRA). It uses sampling techniques to collectively reduce the vast search space covering the available drugs, targets and millions of interactions between them. DTI-SNNFRA operates in two stages: first, it uses SNN followed by a partitioning clustering for sampling the search space. Next, it computes the degree of fuzzy-rough approximations and proper degree threshold selection for the negative samples' undersampling from all possible interaction pairs between drugs and targets obtained in the first stage. Finally, classification is performed using the positive and selected negative samples. We have evaluated the efficacy of DTI-SNNFRA using AUC (Area under ROC Curve), Geometric Mean, and F1 Score. The model performs exceptionally well with a high prediction score of 0.95 for ROC-AUC. The predicted drug-target interactions are validated through an existing drug-target database (Connectivity Map (Cmap))."
Docking with AutoDock4.,31452103,"AutoDock is one of the most popular receptor-ligand docking simulation programs. It was first released in the early 1990s and is in continuous development and adapted to specific protein targets. AutoDock has been applied to a wide range of biological systems. It has been used not only for protein-ligand docking simulation but also for the prediction of binding affinity with good correlation with experimental binding affinity for several protein systems. The latest version makes use of a semi-empirical force field to evaluate protein-ligand binding affinity and for selecting the lowest energy pose in docking simulation. AutoDock4.2.6 has an arsenal of four search algorithms to carry out docking simulation including simulated annealing, genetic algorithm, and Lamarckian algorithm. In this chapter, we describe a tutorial about how to perform docking with AutoDock4. We focus our simulations on the protein target cyclin-dependent kinase 2.",0,"Docking with AutoDock4. AutoDock is one of the most popular receptor-ligand docking simulation programs. It was first released in the early 1990s and is in continuous development and adapted to specific protein targets. AutoDock has been applied to a wide range of biological systems. It has been used not only for protein-ligand docking simulation but also for the prediction of binding affinity with good correlation with experimental binding affinity for several protein systems. The latest version makes use of a semi-empirical force field to evaluate protein-ligand binding affinity and for selecting the lowest energy pose in docking simulation. AutoDock4.2.6 has an arsenal of four search algorithms to carry out docking simulation including simulated annealing, genetic algorithm, and Lamarckian algorithm. In this chapter, we describe a tutorial about how to perform docking with AutoDock4. We focus our simulations on the protein target cyclin-dependent kinase 2."
Web-Based Tools for Polypharmacology Prediction.,30519952,"Drug promiscuity or polypharmacology is the ability of small molecules to interact with multiple protein targets simultaneously. In drug discovery, understanding the polypharmacology of potential drug molecules is crucial to improve their efficacy and safety, and to discover the new therapeutic potentials of existing drugs. Over the past decade, several computational methods have been developed to study the polypharmacology of small molecules, many of which are available as Web services. In this chapter, we review some of these Web tools focusing on ligand based approaches. We highlight in particular our recently developed polypharmacology browser (PPB) and its application for finding the side targets of a new inhibitor of the TRPV6 calcium channel.",0,"Web-Based Tools for Polypharmacology Prediction. Drug promiscuity or polypharmacology is the ability of small molecules to interact with multiple protein targets simultaneously. In drug discovery, understanding the polypharmacology of potential drug molecules is crucial to improve their efficacy and safety, and to discover the new therapeutic potentials of existing drugs. Over the past decade, several computational methods have been developed to study the polypharmacology of small molecules, many of which are available as Web services. In this chapter, we review some of these Web tools focusing on ligand based approaches. We highlight in particular our recently developed polypharmacology browser (PPB) and its application for finding the side targets of a new inhibitor of the TRPV6 calcium channel."
Application of Machine Learning Techniques in Drug-target Interactions Prediction.,33238865,"Drug-Target interactions are vital for drug design and drug repositioning. However, traditional lab experiments are both expensive and time-consuming. Various computational methods which applied machine learning techniques performed efficiently and effectively in the field. The machine learning methods can be divided into three categories basically: Supervised methods, Semi-Supervised methods and Unsupervised methods. We reviewed recent representative methods applying machine learning techniques of each category in DTIs and summarized a brief list of databases frequently used in drug discovery. In addition, we compared the advantages and limitations of these methods in each category. Every prediction model has both strengths and weaknesses and should be adopted in proper ways. Three major problems in DTIs prediction including the lack of nonreactive drug-target pairs data sets, over optimistic results due to the biases and the exploiting of regression models on DTIs prediction should be seriously considered.",0,"Application of Machine Learning Techniques in Drug-target Interactions Prediction. Drug-Target interactions are vital for drug design and drug repositioning. However, traditional lab experiments are both expensive and time-consuming. Various computational methods which applied machine learning techniques performed efficiently and effectively in the field. The machine learning methods can be divided into three categories basically: Supervised methods, Semi-Supervised methods and Unsupervised methods. We reviewed recent representative methods applying machine learning techniques of each category in DTIs and summarized a brief list of databases frequently used in drug discovery. In addition, we compared the advantages and limitations of these methods in each category. Every prediction model has both strengths and weaknesses and should be adopted in proper ways. Three major problems in DTIs prediction including the lack of nonreactive drug-target pairs data sets, over optimistic results due to the biases and the exploiting of regression models on DTIs prediction should be seriously considered."
