Title,PMID,Abstract,Cross-validation,text
Multimodal contrastive representation learning for drug-target binding affinity prediction.,37952703,"In the biomedical field, the efficacy of most drugs is demonstrated by their interactions with targets, meanwhile, accurate prediction of the strength of drug-target binding is extremely important for drug development efforts. Traditional bioassay-based drug-target binding affinity (DTA) prediction methods cannot meet the needs of drug R&D in the era of big data. Recent years we have witnessed significant success on deep learning-based models for drug-target binding affinity prediction task. However, these models only considered a single modality of drug and target information, and some valuable information was not fully utilized. In fact, the information of different modalities of drug and target can complement each other, and more valuable information can be obtained by fusing the information of different modalities. In this paper, we introduce a multimodal information fusion model for DTA prediction that is called FMDTA, which fully considers drug/target information in both string and graph modalities and balances the feature representations of different modalities by a contrastive learning approach. In addition, we exploited the alignment information of drug atoms and target residues to capture the positional information of string patterns, which can extract more useful feature information in SMILES and target sequences. Experimental results on two benchmark datasets show that FMDTA outperforms the state-of-the-art model, demonstrating the feasibility and excellent feature capture capability of FMDTA. The code of FMDTA and the data are available at: https://github.com/bestdoubleLin/FMDTA.",0,"Multimodal contrastive representation learning for drug-target binding affinity prediction. In the biomedical field, the efficacy of most drugs is demonstrated by their interactions with targets, meanwhile, accurate prediction of the strength of drug-target binding is extremely important for drug development efforts. Traditional bioassay-based drug-target binding affinity (DTA) prediction methods cannot meet the needs of drug R&D in the era of big data. Recent years we have witnessed significant success on deep learning-based models for drug-target binding affinity prediction task. However, these models only considered a single modality of drug and target information, and some valuable information was not fully utilized. In fact, the information of different modalities of drug and target can complement each other, and more valuable information can be obtained by fusing the information of different modalities. In this paper, we introduce a multimodal information fusion model for DTA prediction that is called FMDTA, which fully considers drug/target information in both string and graph modalities and balances the feature representations of different modalities by a contrastive learning approach. In addition, we exploited the alignment information of drug atoms and target residues to capture the positional information of string patterns, which can extract more useful feature information in SMILES and target sequences. Experimental results on two benchmark datasets show that FMDTA outperforms the state-of-the-art model, demonstrating the feasibility and excellent feature capture capability of FMDTA. The code of FMDTA and the data are available at: https://github.com/bestdoubleLin/FMDTA."
CSM-carbohydrate: protein-carbohydrate binding affinity prediction and docking scoring function.,34882232,"Protein-carbohydrate interactions are crucial for many cellular processes but can be challenging to biologically characterise. To improve our understanding and ability to model these molecular interactions, we used a carefully curated set of 370 protein-carbohydrate complexes with experimental structural and biophysical data in order to train and validate a new tool, cutoff scanning matrix (CSM)-carbohydrate, using machine learning algorithms to accurately predict their binding affinity and rank docking poses as a scoring function. Information on both protein and carbohydrate complementarity, in terms of shape and chemistry, was captured using graph-based structural signatures. Across both training and independent test sets, we achieved comparable Pearson's correlations of 0.72 under cross-validation [root mean square error (RMSE) of 1.58 Kcal/mol] and 0.67 on the independent test (RMSE of 1.72 Kcal/mol), providing confidence in the generalisability and robustness of the final model. Similar performance was obtained across mono-, di- and oligosaccharides, further highlighting the applicability of this approach to the study of larger complexes. We show CSM-carbohydrate significantly outperformed previous approaches and have implemented our method and make all data freely available through both a user-friendly web interface and application programming interface, to facilitate programmatic access at http://biosig.unimelb.edu.au/csm_carbohydrate/. We believe CSM-carbohydrate will be an invaluable tool for helping assess docking poses and the effects of mutations on protein-carbohydrate affinity, unravelling important aspects that drive binding recognition.",1,"CSM-carbohydrate: protein-carbohydrate binding affinity prediction and docking scoring function. Protein-carbohydrate interactions are crucial for many cellular processes but can be challenging to biologically characterise. To improve our understanding and ability to model these molecular interactions, we used a carefully curated set of 370 protein-carbohydrate complexes with experimental structural and biophysical data in order to train and validate a new tool, cutoff scanning matrix (CSM)-carbohydrate, using machine learning algorithms to accurately predict their binding affinity and rank docking poses as a scoring function. Information on both protein and carbohydrate complementarity, in terms of shape and chemistry, was captured using graph-based structural signatures. Across both training and independent test sets, we achieved comparable Pearson's correlations of 0.72 under cross-validation [root mean square error (RMSE) of 1.58 Kcal/mol] and 0.67 on the independent test (RMSE of 1.72 Kcal/mol), providing confidence in the generalisability and robustness of the final model. Similar performance was obtained across mono-, di- and oligosaccharides, further highlighting the applicability of this approach to the study of larger complexes. We show CSM-carbohydrate significantly outperformed previous approaches and have implemented our method and make all data freely available through both a user-friendly web interface and application programming interface, to facilitate programmatic access at http://biosig.unimelb.edu.au/csm_carbohydrate/. We believe CSM-carbohydrate will be an invaluable tool for helping assess docking poses and the effects of mutations on protein-carbohydrate affinity, unravelling important aspects that drive binding recognition."
Using BERT to identify drug-target interactions from whole PubMed.,35729494,"Drug-target interactions (DTIs) are critical for drug repurposing and elucidation of drug mechanisms, and are manually curated by large databases, such as ChEMBL, BindingDB, DrugBank and DrugTargetCommons. However, the number of curated articles likely constitutes only a fraction of all the articles that contain experimentally determined DTIs. Finding such articles and extracting the experimental information is a challenging task, and there is a pressing need for systematic approaches to assist the curation of DTIs. To this end, we applied Bidirectional Encoder Representations from Transformers (BERT) to identify such articles. Because DTI data intimately depends on the type of assays used to generate it, we also aimed to incorporate functions to predict the assay format. Our novel method identified 0.6 million articles (along with drug and protein information) which are not previously included in public DTI databases. Using 10-fold cross-validation, we obtained ~ 99% accuracy for identifying articles containing quantitative drug-target profiles. The F1 micro for the prediction of assay format is 88%, which leaves room for improvement in future studies. The BERT model in this study is robust and the proposed pipeline can be used to identify previously overlooked articles containing quantitative DTIs. Overall, our method provides a significant advancement in machine-assisted DTI extraction and curation. We expect it to be a useful addition to drug mechanism discovery and repurposing.",1,"Using BERT to identify drug-target interactions from whole PubMed. Drug-target interactions (DTIs) are critical for drug repurposing and elucidation of drug mechanisms, and are manually curated by large databases, such as ChEMBL, BindingDB, DrugBank and DrugTargetCommons. However, the number of curated articles likely constitutes only a fraction of all the articles that contain experimentally determined DTIs. Finding such articles and extracting the experimental information is a challenging task, and there is a pressing need for systematic approaches to assist the curation of DTIs. To this end, we applied Bidirectional Encoder Representations from Transformers (BERT) to identify such articles. Because DTI data intimately depends on the type of assays used to generate it, we also aimed to incorporate functions to predict the assay format. Our novel method identified 0.6 million articles (along with drug and protein information) which are not previously included in public DTI databases. Using 10-fold cross-validation, we obtained ~ 99% accuracy for identifying articles containing quantitative drug-target profiles. The F1 micro for the prediction of assay format is 88%, which leaves room for improvement in future studies. The BERT model in this study is robust and the proposed pipeline can be used to identify previously overlooked articles containing quantitative DTIs. Overall, our method provides a significant advancement in machine-assisted DTI extraction and curation. We expect it to be a useful addition to drug mechanism discovery and repurposing."
pLoc-mEuk: Predict subcellular localization of multi-label eukaryotic proteins by extracting the key GO information into general PseAAC.,28818512,"Many efforts have been made in predicting the subcellular localization of eukaryotic proteins, but most of the existing methods have the following two limitations: (1) their coverage scope is less than ten locations and hence many organelles in an eukaryotic cell cannot be covered, and (2) they can only be used to deal with single-label systems in which each of the constituent proteins has one and only one location. Actually, proteins with multiple locations are particularly interesting since they may have some exceptional functions very important for in-depth understanding the biological process in a cell and for selecting drug target as well. Although several predictors (such as 'Euk-mPLoc', 'Euk-PLoc 2.0' and 'iLoc-Euk') can cover up to 22 different location sites, and they also have the function to treat multi-labeled proteins, further efforts are needed to improve their prediction quality, particularly in enhancing the absolute true rate and in reducing the absolute false rate. Here we propose a new predictor called 'pLoc-mEuk' by extracting the key GO (Gene Ontology) information into the general PseAAC (Pseudo Amino Acid Composition). Rigorous cross-validations on a high-quality and stringent benchmark dataset have indicated that the proposed pLoc-mEuk predictor is remarkably superior to iLoc-Euk, the best of the aforementioned three predictors. To maximize the convenience of most experimental scientists, a user-friendly web-server for the new predictor has been established at http://www.jci-bioinfo.cn/pLoc-mEuk/, by which users can easily get their desired results without the need to go through the complicated mathematics involved.",1,"pLoc-mEuk: Predict subcellular localization of multi-label eukaryotic proteins by extracting the key GO information into general PseAAC. Many efforts have been made in predicting the subcellular localization of eukaryotic proteins, but most of the existing methods have the following two limitations: (1) their coverage scope is less than ten locations and hence many organelles in an eukaryotic cell cannot be covered, and (2) they can only be used to deal with single-label systems in which each of the constituent proteins has one and only one location. Actually, proteins with multiple locations are particularly interesting since they may have some exceptional functions very important for in-depth understanding the biological process in a cell and for selecting drug target as well. Although several predictors (such as 'Euk-mPLoc', 'Euk-PLoc 2.0' and 'iLoc-Euk') can cover up to 22 different location sites, and they also have the function to treat multi-labeled proteins, further efforts are needed to improve their prediction quality, particularly in enhancing the absolute true rate and in reducing the absolute false rate. Here we propose a new predictor called 'pLoc-mEuk' by extracting the key GO (Gene Ontology) information into the general PseAAC (Pseudo Amino Acid Composition). Rigorous cross-validations on a high-quality and stringent benchmark dataset have indicated that the proposed pLoc-mEuk predictor is remarkably superior to iLoc-Euk, the best of the aforementioned three predictors. To maximize the convenience of most experimental scientists, a user-friendly web-server for the new predictor has been established at http://www.jci-bioinfo.cn/pLoc-mEuk/, by which users can easily get their desired results without the need to go through the complicated mathematics involved."
A Framework for Improving the Generalizability of Drug-Target Affinity Prediction Models.,37988395,"<b>Statistical models that accurately predict the binding affinity of an input ligand-protein pair can greatly accelerate drug discovery. Such models are trained on available ligand-protein interaction data sets, which may contain biases that lead the predictor models to learn data set-specific, spurious patterns instead of generalizable relationships. This leads the prediction performances of these models to drop dramatically for previously unseen biomolecules. Various approaches that aim to improve model generalizability either have limited applicability or introduce the risk of degrading overall prediction performance. In this article, we present DebiasedDTA, a novel training framework for drug-target affinity (DTA) prediction models that addresses data set biases to improve the generalizability of such models. DebiasedDTA relies on reweighting the training samples to achieve robust generalization, and is thus applicable to most DTA prediction models. Extensive experiments with different biomolecule representations, model architectures, and data sets demonstrate that DebiasedDTA achieves improved generalizability in predicting drug-target affinities.</b>",0,"A Framework for Improving the Generalizability of Drug-Target Affinity Prediction Models. <b>Statistical models that accurately predict the binding affinity of an input ligand-protein pair can greatly accelerate drug discovery. Such models are trained on available ligand-protein interaction data sets, which may contain biases that lead the predictor models to learn data set-specific, spurious patterns instead of generalizable relationships. This leads the prediction performances of these models to drop dramatically for previously unseen biomolecules. Various approaches that aim to improve model generalizability either have limited applicability or introduce the risk of degrading overall prediction performance. In this article, we present DebiasedDTA, a novel training framework for drug-target affinity (DTA) prediction models that addresses data set biases to improve the generalizability of such models. DebiasedDTA relies on reweighting the training samples to achieve robust generalization, and is thus applicable to most DTA prediction models. Extensive experiments with different biomolecule representations, model architectures, and data sets demonstrate that DebiasedDTA achieves improved generalizability in predicting drug-target affinities.</b>"
Moonlighting protein prediction using physico-chemical and evolutional properties via machine learning methods.,34030624,"Background: Moonlighting proteins (MPs) are a subclass of multifunctional proteins in which more than one independent or usually distinct function occurs in a single polypeptide chain. Identification of unknown cellular processes, understanding novel protein mechanisms, improving the prediction of protein functions, and gaining information about protein evolution are the main reasons to study MPs. They also play an important role in disease pathways and drug-target discovery. Since detecting MPs experimentally is quite a challenge, most of them are detected randomly. Therefore, introducing an appropriate computational approach to predict MPs seems reasonable. Results: In this study, we introduced a competent model for detecting moonlighting and non-MPs through extracted features from protein sequences. We attempted to set up a well-judged scheme for detecting outlier proteins. Consequently, 37 distinct feature vectors were utilized to study each protein's impact on detecting MPs. Furthermore, 8 different classification methods were assessed to find the best performance. To detect outliers, each one of the classifications was executed 100 times by tenfold cross-validation on feature vectors; proteins which misclassified 90 times or more were grouped. This process was applied to every single feature vector and eventually the intersection of these groups was determined as the outlier proteins. The results of tenfold cross-validation on a dataset of 351 samples (containing 215 moonlighting and 136 non-moonlighting proteins) reveal that the SVM method on all feature vectors has the highest performance among all methods in this study and other available methods. Besides, the study of outliers showed that 57 of 351 proteins in the dataset could be an appropriate candidate for the outlier. Among the outlier proteins, there were non-MPs (such as P69797) that have been misclassified in 8 different classification methods with 16 different feature vectors. Because these proteins have been obtained by computational methods, the results of this study could reduce the likelihood of hypothesizing whether these proteins are non-moonlighting at all. Conclusions: MPs are difficult to be identified through experimentation. Using distinct feature vectors, our method enabled identification of novel moonlighting proteins. The study also pinpointed that a number of non-MPs are likely to be moonlighting.",1,"Moonlighting protein prediction using physico-chemical and evolutional properties via machine learning methods. Background: Moonlighting proteins (MPs) are a subclass of multifunctional proteins in which more than one independent or usually distinct function occurs in a single polypeptide chain. Identification of unknown cellular processes, understanding novel protein mechanisms, improving the prediction of protein functions, and gaining information about protein evolution are the main reasons to study MPs. They also play an important role in disease pathways and drug-target discovery. Since detecting MPs experimentally is quite a challenge, most of them are detected randomly. Therefore, introducing an appropriate computational approach to predict MPs seems reasonable. Results: In this study, we introduced a competent model for detecting moonlighting and non-MPs through extracted features from protein sequences. We attempted to set up a well-judged scheme for detecting outlier proteins. Consequently, 37 distinct feature vectors were utilized to study each protein's impact on detecting MPs. Furthermore, 8 different classification methods were assessed to find the best performance. To detect outliers, each one of the classifications was executed 100 times by tenfold cross-validation on feature vectors; proteins which misclassified 90 times or more were grouped. This process was applied to every single feature vector and eventually the intersection of these groups was determined as the outlier proteins. The results of tenfold cross-validation on a dataset of 351 samples (containing 215 moonlighting and 136 non-moonlighting proteins) reveal that the SVM method on all feature vectors has the highest performance among all methods in this study and other available methods. Besides, the study of outliers showed that 57 of 351 proteins in the dataset could be an appropriate candidate for the outlier. Among the outlier proteins, there were non-MPs (such as P69797) that have been misclassified in 8 different classification methods with 16 different feature vectors. Because these proteins have been obtained by computational methods, the results of this study could reduce the likelihood of hypothesizing whether these proteins are non-moonlighting at all. Conclusions: MPs are difficult to be identified through experimentation. Using distinct feature vectors, our method enabled identification of novel moonlighting proteins. The study also pinpointed that a number of non-MPs are likely to be moonlighting."
3D-QSAR and docking studies on ursolic acid derivatives for anticancer activity based on bladder cell line T24 targeting NF-kB pathway inhibition.,30261824,"Bladder cancer is the common reason for mortality worldwide, and its increasing rate announces as a significant area of research in drug designing. The side effects and toxicity of existing drugs and the consequence of gradual cancer cell resistance against the available therapy make the treatment poor. Globally, there is a continuous high demand to develop new, more potent, and easily affordable drugs against cancer. The current research article illustrates the application of developed three-dimensional quantitative structure-activity relationship (3D-QSAR) based on human bladder cancer cell line T24 in vitro anticancer activity. The derived QSAR model has been used for prediction of natural compounds and analogs with 80% similarity of the most active compound of the dataset. The developed model describes the structure-activity relationship for terpenes and their derivatives at the molecular level. The developed comparative molecular field analysis (CoMFA) model shows a satisfactory cross-validation correlation coefficient (q2) of 0.54 and a regression correlation coefficient (r2) of 0.86. In order to evaluate the compliance with electronic pharmacokinetic parameters, Lipinski's rule of five filter, absorption, distribution, metabolism, and excretion (ADME) and toxicity of predicted compounds have been calculated. Furthermore, molecular-docking study has been performed to prioritize these predicted compounds based on their docking score and binding pocket similarity through the identified potential anticancer targets. Finally, two compounds T9 and B42 have been identified as the best hit because these two fall within the standard limits of all filters and show a good binding affinity. Conclusively, all satisfactory results strongly suggest that the derived 3D-QSAR model and obtained candidate's binding structures are reasonable in the prediction of a new antagonist's activity. The strategy adopted in the present research is expected to be of immense importance and a great support in the identification and optimization of lead in the early and advance drug discovery.",1,"3D-QSAR and docking studies on ursolic acid derivatives for anticancer activity based on bladder cell line T24 targeting NF-kB pathway inhibition. Bladder cancer is the common reason for mortality worldwide, and its increasing rate announces as a significant area of research in drug designing. The side effects and toxicity of existing drugs and the consequence of gradual cancer cell resistance against the available therapy make the treatment poor. Globally, there is a continuous high demand to develop new, more potent, and easily affordable drugs against cancer. The current research article illustrates the application of developed three-dimensional quantitative structure-activity relationship (3D-QSAR) based on human bladder cancer cell line T24 in vitro anticancer activity. The derived QSAR model has been used for prediction of natural compounds and analogs with 80% similarity of the most active compound of the dataset. The developed model describes the structure-activity relationship for terpenes and their derivatives at the molecular level. The developed comparative molecular field analysis (CoMFA) model shows a satisfactory cross-validation correlation coefficient (q2) of 0.54 and a regression correlation coefficient (r2) of 0.86. In order to evaluate the compliance with electronic pharmacokinetic parameters, Lipinski's rule of five filter, absorption, distribution, metabolism, and excretion (ADME) and toxicity of predicted compounds have been calculated. Furthermore, molecular-docking study has been performed to prioritize these predicted compounds based on their docking score and binding pocket similarity through the identified potential anticancer targets. Finally, two compounds T9 and B42 have been identified as the best hit because these two fall within the standard limits of all filters and show a good binding affinity. Conclusively, all satisfactory results strongly suggest that the derived 3D-QSAR model and obtained candidate's binding structures are reasonable in the prediction of a new antagonist's activity. The strategy adopted in the present research is expected to be of immense importance and a great support in the identification and optimization of lead in the early and advance drug discovery."
