Title,PMID,Abstract,Deep Learning,text
Dynamic applicability domain (dAD): compound-target binding affinity estimates with local conformal prediction.,37594752,"Increasing efforts are being made in the field of machine learning to advance the learning of robust and accurate models from experimentally measured data and enable more efficient drug discovery processes. The prediction of binding affinity is one of the most frequent tasks of compound bioactivity modelling. Learned models for binding affinity prediction are assessed by their average performance on unseen samples, but point predictions are typically not provided with a rigorous confidence assessment. Approaches, such as the conformal predictor framework equip conventional models with a more rigorous assessment of confidence for individual point predictions. In this article, we extend the inductive conformal prediction framework for interaction data, in particular the compound-target binding affinity prediction task. The new framework is based on dynamically defined calibration sets that are specific for each testing pair and provides prediction assessment in the context of calibration pairs from its compound-target neighbourhood, enabling improved estimates based on the local properties of the prediction model. The effectiveness of the approach is benchmarked on several publicly available datasets and tested in realistic use-case scenarios with increasing levels of difficulty on a complex compound-target binding affinity space. We demonstrate that in such scenarios, novel approach combining applicability domain paradigm with conformal prediction framework, produces superior confidence assessment with valid and more informative prediction regions compared to other 'state-of-the-art' conformal prediction approaches. Dataset and the code are available on GitHub (https://github.com/mlkr-rbi/dAD).",0,"Dynamic applicability domain (dAD): compound-target binding affinity estimates with local conformal prediction. Increasing efforts are being made in the field of machine learning to advance the learning of robust and accurate models from experimentally measured data and enable more efficient drug discovery processes. The prediction of binding affinity is one of the most frequent tasks of compound bioactivity modelling. Learned models for binding affinity prediction are assessed by their average performance on unseen samples, but point predictions are typically not provided with a rigorous confidence assessment. Approaches, such as the conformal predictor framework equip conventional models with a more rigorous assessment of confidence for individual point predictions. In this article, we extend the inductive conformal prediction framework for interaction data, in particular the compound-target binding affinity prediction task. The new framework is based on dynamically defined calibration sets that are specific for each testing pair and provides prediction assessment in the context of calibration pairs from its compound-target neighbourhood, enabling improved estimates based on the local properties of the prediction model. The effectiveness of the approach is benchmarked on several publicly available datasets and tested in realistic use-case scenarios with increasing levels of difficulty on a complex compound-target binding affinity space. We demonstrate that in such scenarios, novel approach combining applicability domain paradigm with conformal prediction framework, produces superior confidence assessment with valid and more informative prediction regions compared to other 'state-of-the-art' conformal prediction approaches. Dataset and the code are available on GitHub (https://github.com/mlkr-rbi/dAD)."
Matrix factorization with denoising autoencoders for prediction of drug-target interactions.,35871213,"Drug-target interaction is crucial in the discovery of new drugs. Computational methods can be used to identify new drug-target interactions at low costs and with reasonable accuracy. Recent studies pay more attention to machine-learning methods, ranging from matrix factorization to deep learning, in the DTI prediction. Since the interaction matrix is often extremely sparse, DTI prediction performance is significantly decreased with matrix factorization-based methods. Therefore, some matrix factorization methods utilize side information to address both the sparsity issue of the interaction matrix and the cold-start issue. By combining matrix factorization and autoencoders, we propose a hybrid DTI prediction model that simultaneously learn the hidden factors of drugs and targets from their side information and interaction matrix. The proposed method is composed of two steps: the pre-processing of the interaction matrix, and the hybrid model. We leverage the similarity matrices of both drugs and targets to address the sparsity problem of the interaction matrix. The comparison of our approach against other algorithms on the same reference datasets has shown good results regarding area under receiver operating characteristic curve and the area under precision-recall curve. More specifically, experimental results achieve high accuracy on golden standard datasets (e.g., Nuclear Receptors, GPCRs, Ion Channels, and Enzymes) when performed with five repetitions of tenfold cross-validation. Display graphical of the hybrid model of Matrix Factorization with Denoising Autoencoders with the help side information of drugs and targets for Prediction of Drug-Target Interactions.",1,"Matrix factorization with denoising autoencoders for prediction of drug-target interactions. Drug-target interaction is crucial in the discovery of new drugs. Computational methods can be used to identify new drug-target interactions at low costs and with reasonable accuracy. Recent studies pay more attention to machine-learning methods, ranging from matrix factorization to deep learning, in the DTI prediction. Since the interaction matrix is often extremely sparse, DTI prediction performance is significantly decreased with matrix factorization-based methods. Therefore, some matrix factorization methods utilize side information to address both the sparsity issue of the interaction matrix and the cold-start issue. By combining matrix factorization and autoencoders, we propose a hybrid DTI prediction model that simultaneously learn the hidden factors of drugs and targets from their side information and interaction matrix. The proposed method is composed of two steps: the pre-processing of the interaction matrix, and the hybrid model. We leverage the similarity matrices of both drugs and targets to address the sparsity problem of the interaction matrix. The comparison of our approach against other algorithms on the same reference datasets has shown good results regarding area under receiver operating characteristic curve and the area under precision-recall curve. More specifically, experimental results achieve high accuracy on golden standard datasets (e.g., Nuclear Receptors, GPCRs, Ion Channels, and Enzymes) when performed with five repetitions of tenfold cross-validation. Display graphical of the hybrid model of Matrix Factorization with Denoising Autoencoders with the help side information of drugs and targets for Prediction of Drug-Target Interactions."
SAM-DTA: a sequence-agnostic model for drug-target binding affinity prediction.,36545795,"Drug-target binding affinity prediction is a fundamental task for drug discovery and has been studied for decades. Most methods follow the canonical paradigm that processes the inputs of the protein (target) and the ligand (drug) separately and then combines them together. In this study we demonstrate, surprisingly, that a model is able to achieve even superior performance without access to any protein-sequence-related information. Instead, a protein is characterized completely by the ligands that it interacts. Specifically, we treat different proteins separately, which are jointly trained in a multi-head manner, so as to learn a robust and universal representation of ligands that is generalizable across proteins. Empirical evidences show that the novel paradigm outperforms its competitive sequence-based counterpart, with the Mean Squared Error (MSE) of 0.4261 versus 0.7612 and the R-Square of 0.7984 versus 0.6570 compared with DeepAffinity. We also investigate the transfer learning scenario where unseen proteins are encountered after the initial training, and the cross-dataset evaluation for prospective studies. The results reveals the robustness of the proposed model in generalizing to unseen proteins as well as in predicting future data. Source codes and data are available at https://github.com/huzqatpku/SAM-DTA.",1,"SAM-DTA: a sequence-agnostic model for drug-target binding affinity prediction. Drug-target binding affinity prediction is a fundamental task for drug discovery and has been studied for decades. Most methods follow the canonical paradigm that processes the inputs of the protein (target) and the ligand (drug) separately and then combines them together. In this study we demonstrate, surprisingly, that a model is able to achieve even superior performance without access to any protein-sequence-related information. Instead, a protein is characterized completely by the ligands that it interacts. Specifically, we treat different proteins separately, which are jointly trained in a multi-head manner, so as to learn a robust and universal representation of ligands that is generalizable across proteins. Empirical evidences show that the novel paradigm outperforms its competitive sequence-based counterpart, with the Mean Squared Error (MSE) of 0.4261 versus 0.7612 and the R-Square of 0.7984 versus 0.6570 compared with DeepAffinity. We also investigate the transfer learning scenario where unseen proteins are encountered after the initial training, and the cross-dataset evaluation for prospective studies. The results reveals the robustness of the proposed model in generalizing to unseen proteins as well as in predicting future data. Source codes and data are available at https://github.com/huzqatpku/SAM-DTA."
Multitype Perception Method for Drug-Target Interaction Prediction.,37314917,"With the growing popularity of artificial intelligence in drug discovery, many deep-learning technologies have been used to automatically predict unknown drug-target interactions (DTIs). A unique challenge in using these technologies to predict DTI is fully exploiting the knowledge diversity across different interaction types, such as drug-drug, drug-target, drug-enzyme, drug-path, and drug-structure types. Unfortunately, existing methods tend to learn the specifical knowledge on each interaction type and they usually ignore the knowledge diversity across different interaction types. Therefore, we propose a multitype perception method (MPM) for DTI prediction by exploiting knowledge diversity across different link types. The method consists of two main components: a type perceptor and a multitype predictor. The type perceptor learns distinguished edge representations by retaining the specifical features across different interaction types; this maximizes the prediction performance for each interaction type. The multitype predictor calculates the type similarity between the type perceptor and predicted interactions, and the domain gate module is reconstructed to assign an adaptive weight to each type perceptor. Extensive experiments demonstrate that our proposed MPM outperforms the state-of-the-art methods in DTI prediction.",1,"Multitype Perception Method for Drug-Target Interaction Prediction. With the growing popularity of artificial intelligence in drug discovery, many deep-learning technologies have been used to automatically predict unknown drug-target interactions (DTIs). A unique challenge in using these technologies to predict DTI is fully exploiting the knowledge diversity across different interaction types, such as drug-drug, drug-target, drug-enzyme, drug-path, and drug-structure types. Unfortunately, existing methods tend to learn the specifical knowledge on each interaction type and they usually ignore the knowledge diversity across different interaction types. Therefore, we propose a multitype perception method (MPM) for DTI prediction by exploiting knowledge diversity across different link types. The method consists of two main components: a type perceptor and a multitype predictor. The type perceptor learns distinguished edge representations by retaining the specifical features across different interaction types; this maximizes the prediction performance for each interaction type. The multitype predictor calculates the type similarity between the type perceptor and predicted interactions, and the domain gate module is reconstructed to assign an adaptive weight to each type perceptor. Extensive experiments demonstrate that our proposed MPM outperforms the state-of-the-art methods in DTI prediction."
A Framework for Improving the Generalizability of Drug-Target Affinity Prediction Models.,37988395,"<b>Statistical models that accurately predict the binding affinity of an input ligand-protein pair can greatly accelerate drug discovery. Such models are trained on available ligand-protein interaction data sets, which may contain biases that lead the predictor models to learn data set-specific, spurious patterns instead of generalizable relationships. This leads the prediction performances of these models to drop dramatically for previously unseen biomolecules. Various approaches that aim to improve model generalizability either have limited applicability or introduce the risk of degrading overall prediction performance. In this article, we present DebiasedDTA, a novel training framework for drug-target affinity (DTA) prediction models that addresses data set biases to improve the generalizability of such models. DebiasedDTA relies on reweighting the training samples to achieve robust generalization, and is thus applicable to most DTA prediction models. Extensive experiments with different biomolecule representations, model architectures, and data sets demonstrate that DebiasedDTA achieves improved generalizability in predicting drug-target affinities.</b>",0,"A Framework for Improving the Generalizability of Drug-Target Affinity Prediction Models. <b>Statistical models that accurately predict the binding affinity of an input ligand-protein pair can greatly accelerate drug discovery. Such models are trained on available ligand-protein interaction data sets, which may contain biases that lead the predictor models to learn data set-specific, spurious patterns instead of generalizable relationships. This leads the prediction performances of these models to drop dramatically for previously unseen biomolecules. Various approaches that aim to improve model generalizability either have limited applicability or introduce the risk of degrading overall prediction performance. In this article, we present DebiasedDTA, a novel training framework for drug-target affinity (DTA) prediction models that addresses data set biases to improve the generalizability of such models. DebiasedDTA relies on reweighting the training samples to achieve robust generalization, and is thus applicable to most DTA prediction models. Extensive experiments with different biomolecule representations, model architectures, and data sets demonstrate that DebiasedDTA achieves improved generalizability in predicting drug-target affinities.</b>"
MSPEDTI: Prediction of Drug-Target Interactions via Molecular Structure with Protein Evolutionary Information.,35625468,"The key to new drug discovery and development is first and foremost the search for molecular targets of drugs, thus advancing drug discovery and drug repositioning. However, traditional drug-target interactions (DTIs) is a costly, lengthy, high-risk, and low-success-rate system project. Therefore, more and more pharmaceutical companies are trying to use computational technologies to screen existing drug molecules and mine new drugs, leading to accelerating new drug development. In the current study, we designed a deep learning computational model MSPEDTI based on <b>M</b>olecular <b>S</b>tructure and <b>P</b>rotein <b>E</b>volutionary to predict the potential <b>DTI</b>s. The model first fuses protein evolutionary information and drug structure information, then a deep learning convolutional neural network (CNN) to mine its hidden features, and finally accurately predicts the associated DTIs by extreme learning machine (ELM). In cross-validation experiments, MSPEDTI achieved 94.19%, 90.95%, 87.95%, and 86.11% prediction accuracy in the gold-standard datasets enzymes, ion channels, G-protein-coupled receptors (GPCRs), and nuclear receptors, respectively. MSPEDTI showed its competitive ability in ablation experiments and comparison with previous excellent methods. Additionally, 7 of 10 potential DTIs predicted by MSPEDTI were substantiated by the classical database. These excellent outcomes demonstrate the ability of MSPEDTI to provide reliable drug candidate targets and strongly facilitate the development of drug repositioning and drug development.",1,"MSPEDTI: Prediction of Drug-Target Interactions via Molecular Structure with Protein Evolutionary Information. The key to new drug discovery and development is first and foremost the search for molecular targets of drugs, thus advancing drug discovery and drug repositioning. However, traditional drug-target interactions (DTIs) is a costly, lengthy, high-risk, and low-success-rate system project. Therefore, more and more pharmaceutical companies are trying to use computational technologies to screen existing drug molecules and mine new drugs, leading to accelerating new drug development. In the current study, we designed a deep learning computational model MSPEDTI based on <b>M</b>olecular <b>S</b>tructure and <b>P</b>rotein <b>E</b>volutionary to predict the potential <b>DTI</b>s. The model first fuses protein evolutionary information and drug structure information, then a deep learning convolutional neural network (CNN) to mine its hidden features, and finally accurately predicts the associated DTIs by extreme learning machine (ELM). In cross-validation experiments, MSPEDTI achieved 94.19%, 90.95%, 87.95%, and 86.11% prediction accuracy in the gold-standard datasets enzymes, ion channels, G-protein-coupled receptors (GPCRs), and nuclear receptors, respectively. MSPEDTI showed its competitive ability in ablation experiments and comparison with previous excellent methods. Additionally, 7 of 10 potential DTIs predicted by MSPEDTI were substantiated by the classical database. These excellent outcomes demonstrate the ability of MSPEDTI to provide reliable drug candidate targets and strongly facilitate the development of drug repositioning and drug development."
How to approach machine learning-based prediction of drug/compound-target interactions.,36747300,"The identification of drug/compound-target interactions (DTIs) constitutes the basis of drug discovery, for which computational predictive approaches have been developed. As a relatively new data-driven paradigm, proteochemometric (PCM) modeling utilizes both protein and compound properties as a pair at the input level and processes them via statistical/machine learning. The representation of input samples (i.e., proteins and their ligands) in the form of quantitative feature vectors is crucial for the extraction of interaction-related properties during the artificial learning and subsequent prediction of DTIs. Lately, the representation learning approach, in which input samples are automatically featurized via training and applying a machine/deep learning model, has been utilized in biomedical sciences. In this study, we performed a comprehensive investigation of different computational approaches/techniques for protein featurization (including both conventional approaches and the novel learned embeddings), data preparation and exploration, machine learning-based modeling, and performance evaluation with the aim of achieving better data representations and more successful learning in DTI prediction. For this, we first constructed realistic and challenging benchmark datasets on small, medium, and large scales to be used as reliable gold standards for specific DTI modeling tasks. We developed and applied a network analysis-based splitting strategy to divide datasets into structurally different training and test folds. Using these datasets together with various featurization methods, we trained and tested DTI prediction models and evaluated their performance from different angles. Our main findings can be summarized under 3 items: (i) random splitting of datasets into train and test folds leads to near-complete data memorization and produce highly over-optimistic results, as a result, should be avoided, (ii) learned protein sequence embeddings work well in DTI prediction and offer high potential, despite interaction-related properties (e.g., structures) of proteins are unused during their self-supervised model training, and (iii) during the learning process, PCM models tend to rely heavily on compound features while partially ignoring protein features, primarily due to the inherent bias in DTI data, indicating the requirement for new and unbiased datasets. We hope this study will aid researchers in designing robust and high-performing data-driven DTI prediction systems that have real-world translational value in drug discovery.",1,"How to approach machine learning-based prediction of drug/compound-target interactions. The identification of drug/compound-target interactions (DTIs) constitutes the basis of drug discovery, for which computational predictive approaches have been developed. As a relatively new data-driven paradigm, proteochemometric (PCM) modeling utilizes both protein and compound properties as a pair at the input level and processes them via statistical/machine learning. The representation of input samples (i.e., proteins and their ligands) in the form of quantitative feature vectors is crucial for the extraction of interaction-related properties during the artificial learning and subsequent prediction of DTIs. Lately, the representation learning approach, in which input samples are automatically featurized via training and applying a machine/deep learning model, has been utilized in biomedical sciences. In this study, we performed a comprehensive investigation of different computational approaches/techniques for protein featurization (including both conventional approaches and the novel learned embeddings), data preparation and exploration, machine learning-based modeling, and performance evaluation with the aim of achieving better data representations and more successful learning in DTI prediction. For this, we first constructed realistic and challenging benchmark datasets on small, medium, and large scales to be used as reliable gold standards for specific DTI modeling tasks. We developed and applied a network analysis-based splitting strategy to divide datasets into structurally different training and test folds. Using these datasets together with various featurization methods, we trained and tested DTI prediction models and evaluated their performance from different angles. Our main findings can be summarized under 3 items: (i) random splitting of datasets into train and test folds leads to near-complete data memorization and produce highly over-optimistic results, as a result, should be avoided, (ii) learned protein sequence embeddings work well in DTI prediction and offer high potential, despite interaction-related properties (e.g., structures) of proteins are unused during their self-supervised model training, and (iii) during the learning process, PCM models tend to rely heavily on compound features while partially ignoring protein features, primarily due to the inherent bias in DTI data, indicating the requirement for new and unbiased datasets. We hope this study will aid researchers in designing robust and high-performing data-driven DTI prediction systems that have real-world translational value in drug discovery."
