Title,PMID,Abstract,Cross-validation,text
DTITR: End-to-end drug-target binding affinity prediction with transformers.,35777085,"The accurate identification of Drug-Target Interactions (DTIs) remains a critical turning point in drug discovery and understanding of the binding process. Despite recent advances in computational solutions to overcome the challenges of in vitro and in vivo experiments, most of the proposed in silico-based methods still focus on binary classification, overlooking the importance of characterizing DTIs with unbiased binding strength values to properly distinguish primary interactions from those with off-targets. Moreover, several of these methods usually simplify the entire interaction mechanism, neglecting the joint contribution of the individual units of each binding component and the interacting substructures involved, and have yet to focus on more explainable and interpretable architectures. In this study, we propose an end-to-end Transformer-based architecture for predicting drug-target binding affinity (DTA) using 1D raw sequential and structural data to represent the proteins and compounds. This architecture exploits self-attention layers to capture the biological and chemical context of the proteins and compounds, respectively, and cross-attention layers to exchange information and capture the pharmacological context of the DTIs. The results show that the proposed architecture is effective in predicting DTA, achieving superior performance in both correctly predicting the value of interaction strength and being able to correctly discriminate the rank order of binding strength compared to state-of-the-art baselines. The combination of multiple Transformer-Encoders was found to result in robust and discriminative aggregate representations of the proteins and compounds for binding affinity prediction, in which the addition of a Cross-Attention Transformer-Encoder was identified as an important block for improving the discriminative power of these representations. Overall, this research study validates the applicability of an end-to-end Transformer-based architecture in the context of drug discovery, capable of self-providing different levels of potential DTI and prediction understanding due to the nature of the attention blocks. The data and source code used in this study are available at: https://github.com/larngroup/DTITR.",0,"DTITR: End-to-end drug-target binding affinity prediction with transformers. The accurate identification of Drug-Target Interactions (DTIs) remains a critical turning point in drug discovery and understanding of the binding process. Despite recent advances in computational solutions to overcome the challenges of in vitro and in vivo experiments, most of the proposed in silico-based methods still focus on binary classification, overlooking the importance of characterizing DTIs with unbiased binding strength values to properly distinguish primary interactions from those with off-targets. Moreover, several of these methods usually simplify the entire interaction mechanism, neglecting the joint contribution of the individual units of each binding component and the interacting substructures involved, and have yet to focus on more explainable and interpretable architectures. In this study, we propose an end-to-end Transformer-based architecture for predicting drug-target binding affinity (DTA) using 1D raw sequential and structural data to represent the proteins and compounds. This architecture exploits self-attention layers to capture the biological and chemical context of the proteins and compounds, respectively, and cross-attention layers to exchange information and capture the pharmacological context of the DTIs. The results show that the proposed architecture is effective in predicting DTA, achieving superior performance in both correctly predicting the value of interaction strength and being able to correctly discriminate the rank order of binding strength compared to state-of-the-art baselines. The combination of multiple Transformer-Encoders was found to result in robust and discriminative aggregate representations of the proteins and compounds for binding affinity prediction, in which the addition of a Cross-Attention Transformer-Encoder was identified as an important block for improving the discriminative power of these representations. Overall, this research study validates the applicability of an end-to-end Transformer-based architecture in the context of drug discovery, capable of self-providing different levels of potential DTI and prediction understanding due to the nature of the attention blocks. The data and source code used in this study are available at: https://github.com/larngroup/DTITR."
Predicting affinity through homology (PATH): interpretable binding affinity prediction with persistent homology,38014181,"Accurate binding affinity prediction is crucial to structure-based drug design. Recent work used computational topology to obtain an effective representation of protein-ligand interactions. Although persistent homology encodes geometric features, previous works on binding affinity prediction using persistent homology employed uninterpretable machine learning models and failed to explain the underlying geometric and topological features that drive accurate binding affinity prediction. In this work, we propose a novel, interpretable algorithm for protein-ligand binding affinity prediction. Our algorithm achieves interpretability through an effective embedding of distances across bipartite matchings of the protein and ligand atoms into real-valued functions by summing Gaussians centered at features constructed by persistent homology. We name these functions <i>internuclear persistent contours (IPCs)</i> . Next, we introduce <i>persistence fingerprints</i> , a vector with 10 components that sketches the distances of different bipartite matching between protein and ligand atoms, refined from IPCs. Let the number of protein atoms in the protein-ligand complex be <i>n</i> , number of ligand atoms be <i>m</i> , and <i>ω</i> ≈ 2.4 be the matrix multiplication exponent. We show that for any 0 < <i>ε</i> < 1, after an 𝒪 ( <i>mn</i> log( <i>mn</i> )) preprocessing procedure, we can compute an <i>ε</i> -accurate approximation to the persistence fingerprint in 𝒪 ( <i>m</i> log <sup>6 <i>ω</i></sup> ( <i>m/""</i> )) time, independent of protein size. This is an improvement in time complexity by a factor of 𝒪 (( <i>m</i> + <i>n</i> ) <sup>3</sup> ) over any previous binding affinity prediction that uses persistent homology. We show that the representational power of persistence fingerprint generalizes to protein-ligand binding datasets beyond the training dataset. Then, we introduce <i>PATH</i> , Predicting Affinity Through Homology, an interpretable, small ensemble of shallow regression trees for binding affinity prediction from persistence fingerprints. We show that despite using 1,400-fold fewer features, PATH has comparable performance to a previous state-of-the-art binding affinity prediction algorithm that uses persistent homology features. Moreover, PATH has the advantage of being interpretable. Finally, we visualize the features captured by persistence fingerprint for variant HIV-1 protease complexes and show that persistence fingerprint captures binding-relevant structural mutations. The source code for PATH is released open-source as part of the osprey protein design software package.",0,"Predicting affinity through homology (PATH): interpretable binding affinity prediction with persistent homology Accurate binding affinity prediction is crucial to structure-based drug design. Recent work used computational topology to obtain an effective representation of protein-ligand interactions. Although persistent homology encodes geometric features, previous works on binding affinity prediction using persistent homology employed uninterpretable machine learning models and failed to explain the underlying geometric and topological features that drive accurate binding affinity prediction. In this work, we propose a novel, interpretable algorithm for protein-ligand binding affinity prediction. Our algorithm achieves interpretability through an effective embedding of distances across bipartite matchings of the protein and ligand atoms into real-valued functions by summing Gaussians centered at features constructed by persistent homology. We name these functions <i>internuclear persistent contours (IPCs)</i> . Next, we introduce <i>persistence fingerprints</i> , a vector with 10 components that sketches the distances of different bipartite matching between protein and ligand atoms, refined from IPCs. Let the number of protein atoms in the protein-ligand complex be <i>n</i> , number of ligand atoms be <i>m</i> , and <i>ω</i> ≈ 2.4 be the matrix multiplication exponent. We show that for any 0 < <i>ε</i> < 1, after an 𝒪 ( <i>mn</i> log( <i>mn</i> )) preprocessing procedure, we can compute an <i>ε</i> -accurate approximation to the persistence fingerprint in 𝒪 ( <i>m</i> log <sup>6 <i>ω</i></sup> ( <i>m/""</i> )) time, independent of protein size. This is an improvement in time complexity by a factor of 𝒪 (( <i>m</i> + <i>n</i> ) <sup>3</sup> ) over any previous binding affinity prediction that uses persistent homology. We show that the representational power of persistence fingerprint generalizes to protein-ligand binding datasets beyond the training dataset. Then, we introduce <i>PATH</i> , Predicting Affinity Through Homology, an interpretable, small ensemble of shallow regression trees for binding affinity prediction from persistence fingerprints. We show that despite using 1,400-fold fewer features, PATH has comparable performance to a previous state-of-the-art binding affinity prediction algorithm that uses persistent homology features. Moreover, PATH has the advantage of being interpretable. Finally, we visualize the features captured by persistence fingerprint for variant HIV-1 protease complexes and show that persistence fingerprint captures binding-relevant structural mutations. The source code for PATH is released open-source as part of the osprey protein design software package."
Docking with AutoDock4.,31452103,"AutoDock is one of the most popular receptor-ligand docking simulation programs. It was first released in the early 1990s and is in continuous development and adapted to specific protein targets. AutoDock has been applied to a wide range of biological systems. It has been used not only for protein-ligand docking simulation but also for the prediction of binding affinity with good correlation with experimental binding affinity for several protein systems. The latest version makes use of a semi-empirical force field to evaluate protein-ligand binding affinity and for selecting the lowest energy pose in docking simulation. AutoDock4.2.6 has an arsenal of four search algorithms to carry out docking simulation including simulated annealing, genetic algorithm, and Lamarckian algorithm. In this chapter, we describe a tutorial about how to perform docking with AutoDock4. We focus our simulations on the protein target cyclin-dependent kinase 2.",0,"Docking with AutoDock4. AutoDock is one of the most popular receptor-ligand docking simulation programs. It was first released in the early 1990s and is in continuous development and adapted to specific protein targets. AutoDock has been applied to a wide range of biological systems. It has been used not only for protein-ligand docking simulation but also for the prediction of binding affinity with good correlation with experimental binding affinity for several protein systems. The latest version makes use of a semi-empirical force field to evaluate protein-ligand binding affinity and for selecting the lowest energy pose in docking simulation. AutoDock4.2.6 has an arsenal of four search algorithms to carry out docking simulation including simulated annealing, genetic algorithm, and Lamarckian algorithm. In this chapter, we describe a tutorial about how to perform docking with AutoDock4. We focus our simulations on the protein target cyclin-dependent kinase 2."
Prediction of kinase-specific phosphorylation sites through an integrative model of protein context and sequence.,27507704,"Identifying kinase substrates and the specific phosphorylation sites they regulate is an important factor in understanding protein function regulation and signalling pathways. Computational prediction of kinase targets - assigning kinases to putative substrates, and selecting from protein sequence the sites that kinases can phosphorylate - requires the consideration of both the cellular context that kinases operate in, as well as their binding affinity. This consideration enables investigation of how phosphorylation influences a range of biological processes. We report here a novel probabilistic model for classifying kinase-specific phosphorylation sites from sequence across three model organisms: human, mouse and yeast. The model incorporates position-specific amino acid frequencies, and counts of co-occurring amino acids from kinase binding sites. We show how this model can be seamlessly integrated with protein interactions and cell-cycle abundance profiles. When evaluating the prediction accuracy of our method, PhosphoPICK, on an independent hold-out set of kinase-specific phosphorylation sites, it achieved an average specificity of 97%, with 32% sensitivity. We compared PhosphoPICK's ability, through cross-validation, to predict kinase-specific phosphorylation sites with alternative methods, and show that at high levels of specificity PhosphoPICK obtains greater sensitivity for most comparisons made. We investigated the relationship between kinase-specific phosphorylation sites and nuclear localisation signals. We show that kinases PKA, Akt1 and AurB have an over-representation of predicted binding sites at particular positions downstream from predicted nuclear localisation signals, demonstrating an important role for these kinases in regulating the nuclear import of proteins. PhosphoPICK is freely available as a web-service at http://bioinf.scmb.uq.edu.au/phosphopick.",1,"Prediction of kinase-specific phosphorylation sites through an integrative model of protein context and sequence. Identifying kinase substrates and the specific phosphorylation sites they regulate is an important factor in understanding protein function regulation and signalling pathways. Computational prediction of kinase targets - assigning kinases to putative substrates, and selecting from protein sequence the sites that kinases can phosphorylate - requires the consideration of both the cellular context that kinases operate in, as well as their binding affinity. This consideration enables investigation of how phosphorylation influences a range of biological processes. We report here a novel probabilistic model for classifying kinase-specific phosphorylation sites from sequence across three model organisms: human, mouse and yeast. The model incorporates position-specific amino acid frequencies, and counts of co-occurring amino acids from kinase binding sites. We show how this model can be seamlessly integrated with protein interactions and cell-cycle abundance profiles. When evaluating the prediction accuracy of our method, PhosphoPICK, on an independent hold-out set of kinase-specific phosphorylation sites, it achieved an average specificity of 97%, with 32% sensitivity. We compared PhosphoPICK's ability, through cross-validation, to predict kinase-specific phosphorylation sites with alternative methods, and show that at high levels of specificity PhosphoPICK obtains greater sensitivity for most comparisons made. We investigated the relationship between kinase-specific phosphorylation sites and nuclear localisation signals. We show that kinases PKA, Akt1 and AurB have an over-representation of predicted binding sites at particular positions downstream from predicted nuclear localisation signals, demonstrating an important role for these kinases in regulating the nuclear import of proteins. PhosphoPICK is freely available as a web-service at http://bioinf.scmb.uq.edu.au/phosphopick."
Predicted Biological Activity of Purchasable Chemical Space.,29193970,"Whereas 400 million distinct compounds are now purchasable within the span of a few weeks, the biological activities of most are unknown. To facilitate access to new chemistry for biology, we have combined the Similarity Ensemble Approach (SEA) with the maximum Tanimoto similarity to the nearest bioactive to predict activity for every commercially available molecule in ZINC. This method, which we label SEA+TC, outperforms both SEA and a naïve-Bayesian classifier via predictive performance on a 5-fold cross-validation of ChEMBL's bioactivity data set (version 21). Using this method, predictions for over 40% of compounds (>160 million) have either high significance (pSEA ≥ 40), high similarity (ECFP4MaxTc ≥ 0.4), or both, for one or more of 1382 targets well described by ligands in the literature. Using a further 1347 less-well-described targets, we predict activities for an additional 11 million compounds. To gauge whether these predictions are sensible, we investigate 75 predictions for 50 drugs lacking a binding affinity annotation in ChEMBL. The 535 million predictions for over 171 million compounds at 2629 targets are linked to purchasing information and evidence to support each prediction and are freely available via https://zinc15.docking.org and https://files.docking.org .",1,"Predicted Biological Activity of Purchasable Chemical Space. Whereas 400 million distinct compounds are now purchasable within the span of a few weeks, the biological activities of most are unknown. To facilitate access to new chemistry for biology, we have combined the Similarity Ensemble Approach (SEA) with the maximum Tanimoto similarity to the nearest bioactive to predict activity for every commercially available molecule in ZINC. This method, which we label SEA+TC, outperforms both SEA and a naïve-Bayesian classifier via predictive performance on a 5-fold cross-validation of ChEMBL's bioactivity data set (version 21). Using this method, predictions for over 40% of compounds (>160 million) have either high significance (pSEA ≥ 40), high similarity (ECFP4MaxTc ≥ 0.4), or both, for one or more of 1382 targets well described by ligands in the literature. Using a further 1347 less-well-described targets, we predict activities for an additional 11 million compounds. To gauge whether these predictions are sensible, we investigate 75 predictions for 50 drugs lacking a binding affinity annotation in ChEMBL. The 535 million predictions for over 171 million compounds at 2629 targets are linked to purchasing information and evidence to support each prediction and are freely available via https://zinc15.docking.org and https://files.docking.org ."
Drug Target Group Prediction with Multiple Drug Networks.,31267864,"Identification of drug-target interaction is essential in drug discovery. It is beneficial to predict unexpected therapeutic or adverse side effects of drugs. To date, several computational methods have been proposed to predict drug-target interactions because they are prompt and low-cost compared with traditional wet experiments. In this study, we investigated this problem in a different way. According to KEGG, drugs were classified into several groups based on their target proteins. A multi-label classification model was presented to assign drugs into correct target groups. To make full use of the known drug properties, five networks were constructed, each of which represented drug associations in one property. A powerful network embedding method, Mashup, was adopted to extract drug features from above-mentioned networks, based on which several machine learning algorithms, including RAndom k-labELsets (RAKEL) algorithm, Label Powerset (LP) algorithm and Support Vector Machine (SVM), were used to build the classification model. Tenfold cross-validation yielded the accuracy of 0.839, exact match of 0.816 and hamming loss of 0.037, indicating good performance of the model. The contribution of each network was also analyzed. Furthermore, the network model with multiple networks was found to be superior to the one with a single network and classic model, indicating the superiority of the proposed model.",1,"Drug Target Group Prediction with Multiple Drug Networks. Identification of drug-target interaction is essential in drug discovery. It is beneficial to predict unexpected therapeutic or adverse side effects of drugs. To date, several computational methods have been proposed to predict drug-target interactions because they are prompt and low-cost compared with traditional wet experiments. In this study, we investigated this problem in a different way. According to KEGG, drugs were classified into several groups based on their target proteins. A multi-label classification model was presented to assign drugs into correct target groups. To make full use of the known drug properties, five networks were constructed, each of which represented drug associations in one property. A powerful network embedding method, Mashup, was adopted to extract drug features from above-mentioned networks, based on which several machine learning algorithms, including RAndom k-labELsets (RAKEL) algorithm, Label Powerset (LP) algorithm and Support Vector Machine (SVM), were used to build the classification model. Tenfold cross-validation yielded the accuracy of 0.839, exact match of 0.816 and hamming loss of 0.037, indicating good performance of the model. The contribution of each network was also analyzed. Furthermore, the network model with multiple networks was found to be superior to the one with a single network and classic model, indicating the superiority of the proposed model."
Drug repurposing and prediction of multiple interaction types via graph embedding.,37193964,"Finding drugs that can interact with a specific target to induce a desired therapeutic outcome is key deliverable in drug discovery for targeted treatment. Therefore, both identifying new drug-target links, as well as delineating the type of drug interaction, are important in drug repurposing studies. A computational drug repurposing approach was proposed to predict novel drug-target interactions (DTIs), as well as to predict the type of interaction induced. The methodology is based on mining a heterogeneous graph that integrates drug-drug and protein-protein similarity networks, together with verified drug-disease and protein-disease associations. In order to extract appropriate features, the three-layer heterogeneous graph was mapped to low dimensional vectors using node embedding principles. The DTI prediction problem was formulated as a multi-label, multi-class classification task, aiming to determine drug modes of action. DTIs were defined by concatenating pairs of drug and target vectors extracted from graph embedding, which were used as input to classification via gradient boosted trees, where a model is trained to predict the type of interaction. After validating the prediction ability of DT2Vec+, a comprehensive analysis of all unknown DTIs was conducted to predict the degree and type of interaction. Finally, the model was applied to propose potential approved drugs to target cancer-specific biomarkers. DT2Vec+ showed promising results in predicting type of DTI, which was achieved via integrating and mapping triplet drug-target-disease association graphs into low-dimensional dense vectors. To our knowledge, this is the first approach that addresses prediction between drugs and targets across six interaction types.",0,"Drug repurposing and prediction of multiple interaction types via graph embedding. Finding drugs that can interact with a specific target to induce a desired therapeutic outcome is key deliverable in drug discovery for targeted treatment. Therefore, both identifying new drug-target links, as well as delineating the type of drug interaction, are important in drug repurposing studies. A computational drug repurposing approach was proposed to predict novel drug-target interactions (DTIs), as well as to predict the type of interaction induced. The methodology is based on mining a heterogeneous graph that integrates drug-drug and protein-protein similarity networks, together with verified drug-disease and protein-disease associations. In order to extract appropriate features, the three-layer heterogeneous graph was mapped to low dimensional vectors using node embedding principles. The DTI prediction problem was formulated as a multi-label, multi-class classification task, aiming to determine drug modes of action. DTIs were defined by concatenating pairs of drug and target vectors extracted from graph embedding, which were used as input to classification via gradient boosted trees, where a model is trained to predict the type of interaction. After validating the prediction ability of DT2Vec+, a comprehensive analysis of all unknown DTIs was conducted to predict the degree and type of interaction. Finally, the model was applied to propose potential approved drugs to target cancer-specific biomarkers. DT2Vec+ showed promising results in predicting type of DTI, which was achieved via integrating and mapping triplet drug-target-disease association graphs into low-dimensional dense vectors. To our knowledge, this is the first approach that addresses prediction between drugs and targets across six interaction types."
