Title,PMID,Abstract,Regression,text
CSatDTA: Prediction of Drug-Target Binding Affinity Using Convolution Model with Self-Attention.,35955587,"Drug discovery, which aids to identify potential novel treatments, entails a broad range of fields of science, including chemistry, pharmacology, and biology. In the early stages of drug development, predicting drug-target affinity is crucial. The proposed model, the prediction of drug-target affinity using a convolution model with self-attention (CSatDTA), applies convolution-based self-attention mechanisms to the molecular drug and target sequences to predict drug-target affinity (DTA) effectively, unlike previous convolution methods, which exhibit significant limitations related to this aspect. The convolutional neural network (CNN) only works on a particular region of information, excluding comprehensive details. Self-attention, on the other hand, is a relatively recent technique for capturing long-range interactions that has been used primarily in sequence modeling tasks. The results of comparative experiments show that CSatDTA surpasses previous sequence-based or other approaches and has outstanding retention abilities.",1,"CSatDTA: Prediction of Drug-Target Binding Affinity Using Convolution Model with Self-Attention. Drug discovery, which aids to identify potential novel treatments, entails a broad range of fields of science, including chemistry, pharmacology, and biology. In the early stages of drug development, predicting drug-target affinity is crucial. The proposed model, the prediction of drug-target affinity using a convolution model with self-attention (CSatDTA), applies convolution-based self-attention mechanisms to the molecular drug and target sequences to predict drug-target affinity (DTA) effectively, unlike previous convolution methods, which exhibit significant limitations related to this aspect. The convolutional neural network (CNN) only works on a particular region of information, excluding comprehensive details. Self-attention, on the other hand, is a relatively recent technique for capturing long-range interactions that has been used primarily in sequence modeling tasks. The results of comparative experiments show that CSatDTA surpasses previous sequence-based or other approaches and has outstanding retention abilities."
Improved Prediction of Drug-Target Interactions Using Self-Paced Learning with Collaborative Matrix Factorization.,31260620,"Identifying drug-target interactions (DTIs) plays an important role in the field of drug discovery, drug side-effects, and drug repositioning. However, in vivo or biochemical experimental methods for identifying new DTIs are extremely expensive and time-consuming. Recently, in silico or various computational methods have been developed for DTI prediction, such as ligand-based approaches and docking approaches, but these traditional computational methods have several limitations. This work utilizes the chemogenomic-based approaches for efficiently identifying potential DTI candidates, namely, self-paced learning with collaborative matrix factorization based on weighted low-rank approximation (SPLCMF) for DTI prediction, which integrates multiple networks related to drugs and targets into regularized least-squares and focuses on learning a low-dimensional vector representation of features. The SPLCMF framework can select samples from easy to complex into training by using soft weighting, which is inclined to more faithfully reflect the latent importance of samples in training. Experimental results on synthetic data and five benchmark data sets show that our proposed SPLCMF outperforms other existing state-of-the-art approaches. These results indicate that our proposed SPLCMF can provide a useful tool to predict unknown DTIs, which may provide new insights into drug discovery, drug side-effect prediction, and repositioning existing drug.",0,"Improved Prediction of Drug-Target Interactions Using Self-Paced Learning with Collaborative Matrix Factorization. Identifying drug-target interactions (DTIs) plays an important role in the field of drug discovery, drug side-effects, and drug repositioning. However, in vivo or biochemical experimental methods for identifying new DTIs are extremely expensive and time-consuming. Recently, in silico or various computational methods have been developed for DTI prediction, such as ligand-based approaches and docking approaches, but these traditional computational methods have several limitations. This work utilizes the chemogenomic-based approaches for efficiently identifying potential DTI candidates, namely, self-paced learning with collaborative matrix factorization based on weighted low-rank approximation (SPLCMF) for DTI prediction, which integrates multiple networks related to drugs and targets into regularized least-squares and focuses on learning a low-dimensional vector representation of features. The SPLCMF framework can select samples from easy to complex into training by using soft weighting, which is inclined to more faithfully reflect the latent importance of samples in training. Experimental results on synthetic data and five benchmark data sets show that our proposed SPLCMF outperforms other existing state-of-the-art approaches. These results indicate that our proposed SPLCMF can provide a useful tool to predict unknown DTIs, which may provide new insights into drug discovery, drug side-effect prediction, and repositioning existing drug."
Predicting Drug-Target Interactions via Dual-Stream Graph Neural Network.,36074878,"Drug target interaction prediction is a crucial stage in drug discovery. However, brute-force search over a compound database is financially infeasible. We have witnessed the increasing measured drug-target interactions records in recent years, and the rich drug/protein-related information allows the usage of graph machine learning. Despite the advances in deep learning-enabled drug-target interaction, there are still open challenges: (1) rich and complex relationship between drugs and proteins can be explored; (2) the intermediate node is not calibrated in the heterogeneous graph. To tackle with above issues, this paper proposed a framework named DSG-DTI. Specifically, DSG-DTI has the heterogeneous graph autoencoder and heterogeneous attention network-based Matrix Completion. Our framework ensures that the known types of nodes (e.g., drug, target, side effects, diseases) are precisely embedded into high-dimensional space with our pretraining skills. Also, the attention-based heterogeneous graph-based matrix completion achieves highly competitive results via effective long-range dependencies extraction. We verify our model on two public benchmarks. The result of two publicly available benchmark application programs show that the proposed scheme effectively predicts drug-target interactions and can generalize to newly registered drugs and targets with slight performance degradation, outperforming the best accuracy compared with other baselines.",0,"Predicting Drug-Target Interactions via Dual-Stream Graph Neural Network. Drug target interaction prediction is a crucial stage in drug discovery. However, brute-force search over a compound database is financially infeasible. We have witnessed the increasing measured drug-target interactions records in recent years, and the rich drug/protein-related information allows the usage of graph machine learning. Despite the advances in deep learning-enabled drug-target interaction, there are still open challenges: (1) rich and complex relationship between drugs and proteins can be explored; (2) the intermediate node is not calibrated in the heterogeneous graph. To tackle with above issues, this paper proposed a framework named DSG-DTI. Specifically, DSG-DTI has the heterogeneous graph autoencoder and heterogeneous attention network-based Matrix Completion. Our framework ensures that the known types of nodes (e.g., drug, target, side effects, diseases) are precisely embedded into high-dimensional space with our pretraining skills. Also, the attention-based heterogeneous graph-based matrix completion achieves highly competitive results via effective long-range dependencies extraction. We verify our model on two public benchmarks. The result of two publicly available benchmark application programs show that the proposed scheme effectively predicts drug-target interactions and can generalize to newly registered drugs and targets with slight performance degradation, outperforming the best accuracy compared with other baselines."
PPDTS: Predicting potential drug-target interactions based on network similarity.,34783172,"Identification of drug-target interactions (DTIs) has great practical importance in the drug discovery process for known diseases. However, only a small proportion of DTIs in these databases has been verified experimentally, and the computational methods for predicting the interactions remain challenging. As a result, some effective computational models have become increasingly popular for predicting DTIs. In this work, the authors predict potential DTIs from the local structure of drug-target associations' network, which is different from the traditional global network similarity methods based on structure and ligand. A novel method called PPDTS is proposed to predict DTIs. First, according to the DTIs' network local structure, the known DTIs are converted into a binary network. Second, the Resource Allocation algorithm is used to obtain a drug-drug similarity network and a target-target similarity network. Third, a Collaborative Filtering algorithm is used with the known drug-target topology information to obtain similarity scores. Fourth, the linear combination of drug-target similarity model and the target-drug similarity model are innovatively proposed to obtain the final prediction results. Finally, the experimental performance of PPDTS has proved to be higher than that of the previously mentioned four popular network-based similarity methods, which is validated in different experimental datasets. Some of the predicted results can be supported in UniProt and DrugBank databases.",0,"PPDTS: Predicting potential drug-target interactions based on network similarity. Identification of drug-target interactions (DTIs) has great practical importance in the drug discovery process for known diseases. However, only a small proportion of DTIs in these databases has been verified experimentally, and the computational methods for predicting the interactions remain challenging. As a result, some effective computational models have become increasingly popular for predicting DTIs. In this work, the authors predict potential DTIs from the local structure of drug-target associations' network, which is different from the traditional global network similarity methods based on structure and ligand. A novel method called PPDTS is proposed to predict DTIs. First, according to the DTIs' network local structure, the known DTIs are converted into a binary network. Second, the Resource Allocation algorithm is used to obtain a drug-drug similarity network and a target-target similarity network. Third, a Collaborative Filtering algorithm is used with the known drug-target topology information to obtain similarity scores. Fourth, the linear combination of drug-target similarity model and the target-drug similarity model are innovatively proposed to obtain the final prediction results. Finally, the experimental performance of PPDTS has proved to be higher than that of the previously mentioned four popular network-based similarity methods, which is validated in different experimental datasets. Some of the predicted results can be supported in UniProt and DrugBank databases."
Deep drug-target binding affinity prediction with multiple attention blocks.,33866349,"Drug-target interaction (DTI) prediction has drawn increasing interest due to its substantial position in the drug discovery process. Many studies have introduced computational models to treat DTI prediction as a regression task, which directly predict the binding affinity of drug-target pairs. However, existing studies (i) ignore the essential correlations between atoms when encoding drug compounds and (ii) model the interaction of drug-target pairs simply by concatenation. Based on those observations, in this study, we propose an end-to-end model with multiple attention blocks to predict the binding affinity scores of drug-target pairs. Our proposed model offers the abilities to (i) encode the correlations between atoms by a relation-aware self-attention block and (ii) model the interaction of drug representations and target representations by the multi-head attention block. Experimental results of DTI prediction on two benchmark datasets show our approach outperforms existing methods, which are benefit from the correlation information encoded by the relation-aware self-attention block and the interaction information extracted by the multi-head attention block. Moreover, we conduct the experiments on the effects of max relative position length and find out the best max relative position length value $k \in \{3, 5\}$. Furthermore, we apply our model to predict the binding affinity of Corona Virus Disease 2019 (COVID-19)-related genome sequences and $3137$ FDA-approved drugs.",1,"Deep drug-target binding affinity prediction with multiple attention blocks. Drug-target interaction (DTI) prediction has drawn increasing interest due to its substantial position in the drug discovery process. Many studies have introduced computational models to treat DTI prediction as a regression task, which directly predict the binding affinity of drug-target pairs. However, existing studies (i) ignore the essential correlations between atoms when encoding drug compounds and (ii) model the interaction of drug-target pairs simply by concatenation. Based on those observations, in this study, we propose an end-to-end model with multiple attention blocks to predict the binding affinity scores of drug-target pairs. Our proposed model offers the abilities to (i) encode the correlations between atoms by a relation-aware self-attention block and (ii) model the interaction of drug representations and target representations by the multi-head attention block. Experimental results of DTI prediction on two benchmark datasets show our approach outperforms existing methods, which are benefit from the correlation information encoded by the relation-aware self-attention block and the interaction information extracted by the multi-head attention block. Moreover, we conduct the experiments on the effects of max relative position length and find out the best max relative position length value $k \in \{3, 5\}$. Furthermore, we apply our model to predict the binding affinity of Corona Virus Disease 2019 (COVID-19)-related genome sequences and $3137$ FDA-approved drugs."
Graph-sequence attention and transformer for predicting drug-target affinity.,36320763,"Drug-target binding affinity (DTA) prediction has drawn increasing interest due to its substantial position in the drug discovery process. The development of new drugs is costly, time-consuming, and often accompanied by safety issues. Drug repurposing can avoid the expensive and lengthy process of drug development by finding new uses for already approved drugs. Therefore, it is of great significance to develop effective computational methods to predict DTAs. The attention mechanisms allow the computational method to focus on the most relevant parts of the input and have been proven to be useful for various tasks. In this study, we proposed a novel model based on self-attention, called GSATDTA, to predict the binding affinity between drugs and targets. For the representation of drugs, we use Bi-directional Gated Recurrent Units (BiGRU) to extract the SMILES representation from SMILES sequences, and graph neural networks to extract the graph representation of the molecular graphs. Then we utilize an attention mechanism to fuse the two representations of the drug. For the target/protein, we utilized an efficient transformer to learn the representation of the protein, which can capture the long-distance relationships in the sequence of amino acids. We conduct extensive experiments to compare our model with state-of-the-art models. Experimental results show that our model outperforms the current state-of-the-art methods on two independent datasets.",1,"Graph-sequence attention and transformer for predicting drug-target affinity. Drug-target binding affinity (DTA) prediction has drawn increasing interest due to its substantial position in the drug discovery process. The development of new drugs is costly, time-consuming, and often accompanied by safety issues. Drug repurposing can avoid the expensive and lengthy process of drug development by finding new uses for already approved drugs. Therefore, it is of great significance to develop effective computational methods to predict DTAs. The attention mechanisms allow the computational method to focus on the most relevant parts of the input and have been proven to be useful for various tasks. In this study, we proposed a novel model based on self-attention, called GSATDTA, to predict the binding affinity between drugs and targets. For the representation of drugs, we use Bi-directional Gated Recurrent Units (BiGRU) to extract the SMILES representation from SMILES sequences, and graph neural networks to extract the graph representation of the molecular graphs. Then we utilize an attention mechanism to fuse the two representations of the drug. For the target/protein, we utilized an efficient transformer to learn the representation of the protein, which can capture the long-distance relationships in the sequence of amino acids. We conduct extensive experiments to compare our model with state-of-the-art models. Experimental results show that our model outperforms the current state-of-the-art methods on two independent datasets."
Drug-target affinity prediction method based on multi-scale information interaction and graph optimization.,37907030,"Drug-target affinity (DTA) prediction as an emerging and effective method is widely applied to explore the strength of drug-target interactions in drug development research. By predicting these interactions, researchers can assess the potential efficacy and safety of candidate drugs at an early stage, narrowing down the search space for therapeutic targets and accelerating the discovery and development of new drugs. However, existing DTA prediction models mainly use graphical representations of drug molecules, which lack information on interactions between individual substructures, thus affecting prediction accuracy and model interpretability. Therefore, transformer and diffusion on drug graphs in DTA prediction (TDGraphDTA) are introduced to predict drug-target interactions using multi-scale information interaction and graph optimization. An interactive module is integrated into feature extraction of drug and target features at different granularity levels. A diffusion model-based graph optimization module is proposed to improve the representation of molecular graph structures and enhance the interpretability of graph representations while obtaining optimal feature representations. In addition, TDGraphDTA improves the accuracy and reliability of predictions by capturing relationships and contextual information between molecular substructures. The performance of the proposed TDGraphDTA in DTA prediction was verified on three publicly available benchmark datasets (Davis, Metz, and KIBA). Compared with state-of-the-art baseline models, it achieved better results in terms of consistency index, R-squared, etc. Furthermore, compared with some existing methods, the proposed TDGraphDTA is demonstrated to have better structure capturing capabilities by visualizing the feature capturing capabilities of the model using Grad-AAM toxicity labels in the ToxCast dataset. The corresponding source codes are available at https://github.com/Lamouryz/TDGraph.",1,"Drug-target affinity prediction method based on multi-scale information interaction and graph optimization. Drug-target affinity (DTA) prediction as an emerging and effective method is widely applied to explore the strength of drug-target interactions in drug development research. By predicting these interactions, researchers can assess the potential efficacy and safety of candidate drugs at an early stage, narrowing down the search space for therapeutic targets and accelerating the discovery and development of new drugs. However, existing DTA prediction models mainly use graphical representations of drug molecules, which lack information on interactions between individual substructures, thus affecting prediction accuracy and model interpretability. Therefore, transformer and diffusion on drug graphs in DTA prediction (TDGraphDTA) are introduced to predict drug-target interactions using multi-scale information interaction and graph optimization. An interactive module is integrated into feature extraction of drug and target features at different granularity levels. A diffusion model-based graph optimization module is proposed to improve the representation of molecular graph structures and enhance the interpretability of graph representations while obtaining optimal feature representations. In addition, TDGraphDTA improves the accuracy and reliability of predictions by capturing relationships and contextual information between molecular substructures. The performance of the proposed TDGraphDTA in DTA prediction was verified on three publicly available benchmark datasets (Davis, Metz, and KIBA). Compared with state-of-the-art baseline models, it achieved better results in terms of consistency index, R-squared, etc. Furthermore, compared with some existing methods, the proposed TDGraphDTA is demonstrated to have better structure capturing capabilities by visualizing the feature capturing capabilities of the model using Grad-AAM toxicity labels in the ToxCast dataset. The corresponding source codes are available at https://github.com/Lamouryz/TDGraph."
