Title,PMID,Abstract,Docking,text
PLANET: A Multi-objective Graph Neural Network Model for Protein-Ligand Binding Affinity Prediction.,37319418,"Predicting protein-ligand binding affinity is a central issue in drug design. Various deep learning models have been published in recent years, where many of them rely on 3D protein-ligand complex structures as input and tend to focus on the single task of reproducing binding affinity. In this study, we have developed a graph neural network model called PLANET (Protein-Ligand Affinity prediction NETwork). This model takes the graph-represented 3D structure of the binding pocket on the target protein and the 2D chemical structure of the ligand molecule as input. It was trained through a multi-objective process with three related tasks, including deriving the protein-ligand binding affinity, protein-ligand contact map, and ligand distance matrix. Besides the protein-ligand complexes with known binding affinity data retrieved from the PDBbind database, a large number of non-binder decoys were also added to the training data for deriving the final model of PLANET. When tested on the CASF-2016 benchmark, PLANET exhibited a scoring power comparable to the best result yielded by other deep learning models as well as a reasonable ranking power and docking power. In virtual screening trials conducted on the DUD-E benchmark, PLANET's performance was notably better than several deep learning and machine learning models. As on the LIT-PCBA benchmark, PLANET achieved comparable accuracy as the conventional docking program Glide, but it only spent less than 1% of Glide's computation time to finish the same job because PLANET did not need exhaustive conformational sampling. Considering the decent accuracy and efficiency of PLANET in binding affinity prediction, it may become a useful tool for conducting large-scale virtual screening.",1,"PLANET: A Multi-objective Graph Neural Network Model for Protein-Ligand Binding Affinity Prediction. Predicting protein-ligand binding affinity is a central issue in drug design. Various deep learning models have been published in recent years, where many of them rely on 3D protein-ligand complex structures as input and tend to focus on the single task of reproducing binding affinity. In this study, we have developed a graph neural network model called PLANET (Protein-Ligand Affinity prediction NETwork). This model takes the graph-represented 3D structure of the binding pocket on the target protein and the 2D chemical structure of the ligand molecule as input. It was trained through a multi-objective process with three related tasks, including deriving the protein-ligand binding affinity, protein-ligand contact map, and ligand distance matrix. Besides the protein-ligand complexes with known binding affinity data retrieved from the PDBbind database, a large number of non-binder decoys were also added to the training data for deriving the final model of PLANET. When tested on the CASF-2016 benchmark, PLANET exhibited a scoring power comparable to the best result yielded by other deep learning models as well as a reasonable ranking power and docking power. In virtual screening trials conducted on the DUD-E benchmark, PLANET's performance was notably better than several deep learning and machine learning models. As on the LIT-PCBA benchmark, PLANET achieved comparable accuracy as the conventional docking program Glide, but it only spent less than 1% of Glide's computation time to finish the same job because PLANET did not need exhaustive conformational sampling. Considering the decent accuracy and efficiency of PLANET in binding affinity prediction, it may become a useful tool for conducting large-scale virtual screening."
Novel Compound-Target Interactions Prediction for the Herbal Formula Hua-Yu-Qiang-Shen-Tong-Bi-Fang.,31366827,"Herbal formulae have a long history in clinical medicine in Asia. While the complexity of the formulae leads to the complex compound-target interactions and the resultant multi-target therapeutic effects, it is difficult to elucidate the molecular/therapeutic mechanism of action for the many formulae. For example, the Hua-Yu-Qiang-Shen-Tong-Bi-Fang (TBF), an herbal formula of Chinese medicine, has been used for treating rheumatoid arthritis. However, the target information of a great number of compounds from the TBF formula is missing. In this study, we predicted the targets of the compounds from the TBF formula via network analysis and in silico computing. Initially, the information of the phytochemicals contained in the plants of the herbal formula was collected, and subsequently computed to their corresponding fingerprints for the sake of structural similarity calculation. Then a compound structural similarity network infused with available target information was constructed. Five local similarity indices were used and compared for their performance on predicting the potential new targets of the compounds. Finally, the Preferential Attachment Index was selected for it having an area under curve (AUC) of 0.886, which outperforms the other four algorithms in predicting the compound-target interactions. This method could provide a promising direction for identifying the compound-target interactions of herbal formulae in silico.",0,"Novel Compound-Target Interactions Prediction for the Herbal Formula Hua-Yu-Qiang-Shen-Tong-Bi-Fang. Herbal formulae have a long history in clinical medicine in Asia. While the complexity of the formulae leads to the complex compound-target interactions and the resultant multi-target therapeutic effects, it is difficult to elucidate the molecular/therapeutic mechanism of action for the many formulae. For example, the Hua-Yu-Qiang-Shen-Tong-Bi-Fang (TBF), an herbal formula of Chinese medicine, has been used for treating rheumatoid arthritis. However, the target information of a great number of compounds from the TBF formula is missing. In this study, we predicted the targets of the compounds from the TBF formula via network analysis and in silico computing. Initially, the information of the phytochemicals contained in the plants of the herbal formula was collected, and subsequently computed to their corresponding fingerprints for the sake of structural similarity calculation. Then a compound structural similarity network infused with available target information was constructed. Five local similarity indices were used and compared for their performance on predicting the potential new targets of the compounds. Finally, the Preferential Attachment Index was selected for it having an area under curve (AUC) of 0.886, which outperforms the other four algorithms in predicting the compound-target interactions. This method could provide a promising direction for identifying the compound-target interactions of herbal formulae in silico."
DeepFusionDTA: Drug-Target Binding Affinity Prediction With Information Fusion and Hybrid Deep-Learning Ensemble Model.,34379594,"Identification of drug-target interaction (DTI) is the most important issue in the broad field of drug discovery. Using purely biological experiments to verify drug-target binding profiles takes lots of time and effort, so computational technologies for this task obviously have great benefits in reducing the drug search space. Most of computational methods to predict DTI are proposed to solve a binary classification problem, which ignore the influence of binding strength. Therefore, drug-target binding affinity prediction is still a challenging issue. Currently, lots of studies only extract sequence information that lacks feature-rich representation, but we consider more spatial features in order to merge various data in drug and target spaces. In this study, we propose a two-stage deep neural network ensemble model for detecting drug-target binding affinity, called DeepFusionDTA, via various information analysis modules. First stage is to utilize sequence and structure information to generate fusion feature map of candidate protein and drug pair through various analysis modules based deep learning. Second stage is to apply bagging-based ensemble learning strategy for regression prediction, and we obtain outstanding results by combining the advantages of various algorithms in efficient feature abstraction and regression calculation. Importantly, we evaluate our novel method, DeepFusionDTA, which delivers 1.5 percent CI increase on KIBA dataset and 1.0 percent increase on Davis dataset, by comparing with existing prediction tools, DeepDTA. Furthermore, the ideas we have offered can be applied to in-silico screening of the interaction space, to provide novel DTIs which can be experimentally pursued. The codes and data are available from https://github.com/guofei-tju/DeepFusionDTA.",0,"DeepFusionDTA: Drug-Target Binding Affinity Prediction With Information Fusion and Hybrid Deep-Learning Ensemble Model. Identification of drug-target interaction (DTI) is the most important issue in the broad field of drug discovery. Using purely biological experiments to verify drug-target binding profiles takes lots of time and effort, so computational technologies for this task obviously have great benefits in reducing the drug search space. Most of computational methods to predict DTI are proposed to solve a binary classification problem, which ignore the influence of binding strength. Therefore, drug-target binding affinity prediction is still a challenging issue. Currently, lots of studies only extract sequence information that lacks feature-rich representation, but we consider more spatial features in order to merge various data in drug and target spaces. In this study, we propose a two-stage deep neural network ensemble model for detecting drug-target binding affinity, called DeepFusionDTA, via various information analysis modules. First stage is to utilize sequence and structure information to generate fusion feature map of candidate protein and drug pair through various analysis modules based deep learning. Second stage is to apply bagging-based ensemble learning strategy for regression prediction, and we obtain outstanding results by combining the advantages of various algorithms in efficient feature abstraction and regression calculation. Importantly, we evaluate our novel method, DeepFusionDTA, which delivers 1.5 percent CI increase on KIBA dataset and 1.0 percent increase on Davis dataset, by comparing with existing prediction tools, DeepDTA. Furthermore, the ideas we have offered can be applied to in-silico screening of the interaction space, to provide novel DTIs which can be experimentally pursued. The codes and data are available from https://github.com/guofei-tju/DeepFusionDTA."
Multitype Perception Method for Drug-Target Interaction Prediction.,37314917,"With the growing popularity of artificial intelligence in drug discovery, many deep-learning technologies have been used to automatically predict unknown drug-target interactions (DTIs). A unique challenge in using these technologies to predict DTI is fully exploiting the knowledge diversity across different interaction types, such as drug-drug, drug-target, drug-enzyme, drug-path, and drug-structure types. Unfortunately, existing methods tend to learn the specifical knowledge on each interaction type and they usually ignore the knowledge diversity across different interaction types. Therefore, we propose a multitype perception method (MPM) for DTI prediction by exploiting knowledge diversity across different link types. The method consists of two main components: a type perceptor and a multitype predictor. The type perceptor learns distinguished edge representations by retaining the specifical features across different interaction types; this maximizes the prediction performance for each interaction type. The multitype predictor calculates the type similarity between the type perceptor and predicted interactions, and the domain gate module is reconstructed to assign an adaptive weight to each type perceptor. Extensive experiments demonstrate that our proposed MPM outperforms the state-of-the-art methods in DTI prediction.",0,"Multitype Perception Method for Drug-Target Interaction Prediction. With the growing popularity of artificial intelligence in drug discovery, many deep-learning technologies have been used to automatically predict unknown drug-target interactions (DTIs). A unique challenge in using these technologies to predict DTI is fully exploiting the knowledge diversity across different interaction types, such as drug-drug, drug-target, drug-enzyme, drug-path, and drug-structure types. Unfortunately, existing methods tend to learn the specifical knowledge on each interaction type and they usually ignore the knowledge diversity across different interaction types. Therefore, we propose a multitype perception method (MPM) for DTI prediction by exploiting knowledge diversity across different link types. The method consists of two main components: a type perceptor and a multitype predictor. The type perceptor learns distinguished edge representations by retaining the specifical features across different interaction types; this maximizes the prediction performance for each interaction type. The multitype predictor calculates the type similarity between the type perceptor and predicted interactions, and the domain gate module is reconstructed to assign an adaptive weight to each type perceptor. Extensive experiments demonstrate that our proposed MPM outperforms the state-of-the-art methods in DTI prediction."
Exponential repulsion improves structural predictability of molecular docking.,27620738,"Molecular docking is a powerful tool for theoretical prediction of the preferred conformation and orientation of small molecules within protein active sites. The obtained poses can be used for estimation of binding energies, which indicate the inhibition effect of designed inhibitors, and therefore might be used for in silico drug design. However, the evaluation of ligand binding affinity critically depends on successful prediction of the native binding mode. Contemporary docking methods are often based on scoring functions derived from molecular mechanical potentials. In such potentials, nonbonded interactions are typically represented by electrostatic interactions between atom-centered partial charges and standard 6-12 Lennard-Jones potential. Here, we present implementation and testing of a scoring function based on more physically justified exponential repulsion instead of the standard Lennard-Jones potential. We found that this scoring function significantly improved prediction of the native binding modes in proteins bearing narrow active sites such as serine proteases and kinases. © 2016 Wiley Periodicals, Inc.",1,"Exponential repulsion improves structural predictability of molecular docking. Molecular docking is a powerful tool for theoretical prediction of the preferred conformation and orientation of small molecules within protein active sites. The obtained poses can be used for estimation of binding energies, which indicate the inhibition effect of designed inhibitors, and therefore might be used for in silico drug design. However, the evaluation of ligand binding affinity critically depends on successful prediction of the native binding mode. Contemporary docking methods are often based on scoring functions derived from molecular mechanical potentials. In such potentials, nonbonded interactions are typically represented by electrostatic interactions between atom-centered partial charges and standard 6-12 Lennard-Jones potential. Here, we present implementation and testing of a scoring function based on more physically justified exponential repulsion instead of the standard Lennard-Jones potential. We found that this scoring function significantly improved prediction of the native binding modes in proteins bearing narrow active sites such as serine proteases and kinases. © 2016 Wiley Periodicals, Inc."
A Robust Drug-Target Interaction Prediction Framework with Capsule Network and Transfer Learning.,37762364,"Drug-target interactions (DTIs) are considered a crucial component of drug design and drug discovery. To date, many computational methods were developed for drug-target interactions, but they are insufficiently informative for accurately predicting DTIs due to the lack of experimentally verified negative datasets, inaccurate molecular feature representation, and ineffective DTI classifiers. Therefore, we address the limitations of randomly selecting negative DTI data from unknown drug-target pairs by establishing two experimentally validated datasets and propose a capsule network-based framework called CapBM-DTI to capture hierarchical relationships of drugs and targets, which adopts pre-trained bidirectional encoder representations from transformers (BERT) for contextual sequence feature extraction from target proteins through transfer learning and the message-passing neural network (MPNN) for the 2-D graph feature extraction of compounds to accurately and robustly identify drug-target interactions. We compared the performance of CapBM-DTI with state-of-the-art methods using four experimentally validated DTI datasets of different sizes, including human (<i>Homo sapiens</i>) and worm (<i>Caenorhabditis elegans</i>) species datasets, as well as three subsets (new compounds, new proteins, and new pairs). Our results demonstrate that the proposed model achieved robust performance and powerful generalization ability in all experiments. The case study on treating COVID-19 demonstrates the applicability of the model in virtual screening.",0,"A Robust Drug-Target Interaction Prediction Framework with Capsule Network and Transfer Learning. Drug-target interactions (DTIs) are considered a crucial component of drug design and drug discovery. To date, many computational methods were developed for drug-target interactions, but they are insufficiently informative for accurately predicting DTIs due to the lack of experimentally verified negative datasets, inaccurate molecular feature representation, and ineffective DTI classifiers. Therefore, we address the limitations of randomly selecting negative DTI data from unknown drug-target pairs by establishing two experimentally validated datasets and propose a capsule network-based framework called CapBM-DTI to capture hierarchical relationships of drugs and targets, which adopts pre-trained bidirectional encoder representations from transformers (BERT) for contextual sequence feature extraction from target proteins through transfer learning and the message-passing neural network (MPNN) for the 2-D graph feature extraction of compounds to accurately and robustly identify drug-target interactions. We compared the performance of CapBM-DTI with state-of-the-art methods using four experimentally validated DTI datasets of different sizes, including human (<i>Homo sapiens</i>) and worm (<i>Caenorhabditis elegans</i>) species datasets, as well as three subsets (new compounds, new proteins, and new pairs). Our results demonstrate that the proposed model achieved robust performance and powerful generalization ability in all experiments. The case study on treating COVID-19 demonstrates the applicability of the model in virtual screening."
Network Pharmacology-Based Approach to Investigate the Molecular Targets of Rhubarb for Treating Cancer.,34211578,"Background: As a traditional Chinese medicine, rhubarb (also named Dahuang) is used to treat various diseases. Objective: To explore the possible antitumor mechanism of rhubarb by using network pharmacology and molecular docking in this study. Methods: Bioactive ingredients and related targets of rhubarb were obtained from the Traditional Chinese Medicine Systems Pharmacology (TCMSP) database. And the gene names corresponding to the proteins were found in the UniProt database. Then, the tumor-related targets were screened out from GeneCards and OMIM databases. Key antitumor targets of rhubarb were acquired by overlapping the above targets via the Venn diagram. The antitumor targets network of rhubarb active components was constructed by using Cytoscape 3.6.0 software. The protein interactions network was constructed using the STRING database. The GO and KEGG pathways involved in the targets were analyzed by using the DAVID database. Autodock Vina software was used to verify the molecular docking of rhubarb components and key targets. Results: Through screening and analysis, 10 active ingredients and 58 antitumor prediction targets were obtained and constructed a compound-target network. The targets such as CASP3, JUN, MYC, TNF, and PTGS2 may play a crucial role. These targets are involved in cancer pathway, calcium signaling pathway, cell apoptosis, small-cell lung cancer pathway, p53 signaling pathway, and TNF signaling pathway. The docking results indicated that the rhein binding with the CASP3 showed the highest binding energy. Conclusion: Based on the network pharmacology, the characteristics of multicomponent, multitarget, and multipathway of rhubarb were discussed, which provided a scientific basis for explaining the mechanism in treating cancer and new ideas for further research.",1,"Network Pharmacology-Based Approach to Investigate the Molecular Targets of Rhubarb for Treating Cancer. Background: As a traditional Chinese medicine, rhubarb (also named Dahuang) is used to treat various diseases. Objective: To explore the possible antitumor mechanism of rhubarb by using network pharmacology and molecular docking in this study. Methods: Bioactive ingredients and related targets of rhubarb were obtained from the Traditional Chinese Medicine Systems Pharmacology (TCMSP) database. And the gene names corresponding to the proteins were found in the UniProt database. Then, the tumor-related targets were screened out from GeneCards and OMIM databases. Key antitumor targets of rhubarb were acquired by overlapping the above targets via the Venn diagram. The antitumor targets network of rhubarb active components was constructed by using Cytoscape 3.6.0 software. The protein interactions network was constructed using the STRING database. The GO and KEGG pathways involved in the targets were analyzed by using the DAVID database. Autodock Vina software was used to verify the molecular docking of rhubarb components and key targets. Results: Through screening and analysis, 10 active ingredients and 58 antitumor prediction targets were obtained and constructed a compound-target network. The targets such as CASP3, JUN, MYC, TNF, and PTGS2 may play a crucial role. These targets are involved in cancer pathway, calcium signaling pathway, cell apoptosis, small-cell lung cancer pathway, p53 signaling pathway, and TNF signaling pathway. The docking results indicated that the rhein binding with the CASP3 showed the highest binding energy. Conclusion: Based on the network pharmacology, the characteristics of multicomponent, multitarget, and multipathway of rhubarb were discussed, which provided a scientific basis for explaining the mechanism in treating cancer and new ideas for further research."
